[32m[I 2021-06-01 15:10:50,483][0m Trial 313 finished with value: 0.9090370184698958 and parameters: {'criterion': 'gini', 'max_depth': 20, 'max_features': 'auto', 'min_samples_leaf': 2, 'min_samples_split': 5, 'n_estimators': 15}. Best is trial 284 with value: 0.9236651223187223.[0m
[32m[I 2021-06-01 15:10:50,529][0m Trial 312 finished with value: 0.9115588023088023 and parameters: {'criterion': 'gini', 'max_depth': 20, 'max_features': 'auto', 'min_samples_leaf': 2, 'min_samples_split': 5, 'n_estimators': 15}. Best is trial 284 with value: 0.9236651223187223.[0m
[32m[I 2021-06-01 15:10:50,842][0m Trial 319 finished with value: 0.909682236282731 and parameters: {'criterion': 'gini', 'max_depth': 20, 'max_features': 'auto', 'min_samples_leaf': 2, 'min_samples_split': 5, 'n_estimators': 15}. Best is trial 284 with value: 0.9236651223187223.[0m
[32m[I 2021-06-01 15:10:50,845][0m Trial 320 finished with value: 0.9099434422778625 and parameters: {'criterion': 'gini', 'max_depth': 20, 'max_features': 'auto', 'min_samples_leaf': 1, 'min_samples_split': 5, 'n_estimators': 15}. Best is trial 284 with value: 0.9236651223187223.[0m
[32m[I 2021-06-01 15:10:50,887][0m Trial 308 finished with value: 0.9105816265637674 and parameters: {'criterion': 'gini', 'max_depth': 20, 'max_features': 'auto', 'min_samples_leaf': 1, 'min_samples_split': 5, 'n_estimators': 15}. Best is trial 284 with value: 0.9236651223187223.[0m
[32m[I 2021-06-01 15:10:50,892][0m Trial 317 finished with value: 0.9091652541097057 and parameters: {'criterion': 'gini', 'max_depth': 20, 'max_features': 'auto', 'min_samples_leaf': 2, 'min_samples_split': 5, 'n_estimators': 15}. Best is trial 284 with value: 0.9236651223187223.[0m
[32m[I 2021-06-01 15:10:50,913][0m Trial 326 finished with value: 0.9102123273030314 and parameters: {'criterion': 'gini', 'max_depth': 20, 'max_features': 'auto', 'min_samples_leaf': 2, 'min_samples_split': 5, 'n_estimators': 15}. Best is trial 284 with value: 0.9236651223187223.[0m
[32m[I 2021-06-01 15:10:50,914][0m Trial 306 finished with value: 0.9096974786864692 and parameters: {'criterion': 'gini', 'max_depth': 20, 'max_features': 'auto', 'min_samples_leaf': 1, 'min_samples_split': 5, 'n_estimators': 15}. Best is trial 284 with value: 0.9236651223187223.[0m
[32m[I 2021-06-01 15:10:50,914][0m Trial 324 finished with value: 0.9075091894420652 and parameters: {'criterion': 'gini', 'max_depth': 20, 'max_features': 'auto', 'min_samples_leaf': 2, 'min_samples_split': 5, 'n_estimators': 15}. Best is trial 284 with value: 0.9236651223187223.[0m
[32m[I 2021-06-01 15:10:50,915][0m Trial 301 finished with value: 0.9133056884635831 and parameters: {'criterion': 'gini', 'max_depth': 20, 'max_features': 'auto', 'min_samples_leaf': 2, 'min_samples_split': 5, 'n_estimators': 15}. Best is trial 284 with value: 0.9236651223187223.[0m
[32m[I 2021-06-01 15:10:51,073][0m Trial 325 finished with value: 0.907564124497328 and parameters: {'criterion': 'gini', 'max_depth': 20, 'max_features': 'auto', 'min_samples_leaf': 1, 'min_samples_split': 5, 'n_estimators': 15}. Best is trial 284 with value: 0.9236651223187223.[0m
[32m[I 2021-06-01 15:10:51,096][0m Trial 322 finished with value: 0.9178627357007452 and parameters: {'criterion': 'gini', 'max_depth': 20, 'max_features': 'auto', 'min_samples_leaf': 1, 'min_samples_split': 5, 'n_estimators': 15}. Best is trial 284 with value: 0.9236651223187223.[0m
[32m[I 2021-06-01 15:10:51,097][0m Trial 323 finished with value: 0.9119188956504324 and parameters: {'criterion': 'gini', 'max_depth': 20, 'max_features': 'auto', 'min_samples_leaf': 1, 'min_samples_split': 5, 'n_estimators': 15}. Best is trial 284 with value: 0.9236651223187223.[0m
[32m[I 2021-06-01 15:10:51,180][0m Trial 311 finished with value: 0.9152283572258806 and parameters: {'criterion': 'gini', 'max_depth': 20, 'max_features': 'auto', 'min_samples_leaf': 1, 'min_samples_split': 5, 'n_estimators': 15}. Best is trial 284 with value: 0.9236651223187223.[0m
[32m[I 2021-06-01 15:11:01,755][0m Trial 315 finished with value: 0.9072956627124753 and parameters: {'criterion': 'gini', 'max_depth': 20, 'max_features': 'auto', 'min_samples_leaf': 2, 'min_samples_split': 5, 'n_estimators': 215}. Best is trial 284 with value: 0.9236651223187223.[0m
[32m[I 2021-06-01 15:11:01,764][0m Trial 305 finished with value: 0.9088263898557747 and parameters: {'criterion': 'gini', 'max_depth': 20, 'max_features': 'log2', 'min_samples_leaf': 1, 'min_samples_split': 5, 'n_estimators': 15}. Best is trial 284 with value: 0.9236651223187223.[0m
[32m[I 2021-06-01 15:11:01,839][0m Trial 307 finished with value: 0.9051703655419299 and parameters: {'criterion': 'gini', 'max_depth': 20, 'max_features': 'auto', 'min_samples_leaf': 2, 'min_samples_split': 5, 'n_estimators': 215}. Best is trial 284 with value: 0.9236651223187223.[0m
[32m[I 2021-06-01 15:11:02,293][0m Trial 303 finished with value: 0.9055379906001951 and parameters: {'criterion': 'gini', 'max_depth': 20, 'max_features': 'auto', 'min_samples_leaf': 1, 'min_samples_split': 5, 'n_estimators': 215}. Best is trial 284 with value: 0.9236651223187223.[0m
[32m[I 2021-06-01 15:11:02,708][0m Trial 316 finished with value: 0.9063865624558719 and parameters: {'criterion': 'gini', 'max_depth': 20, 'max_features': 'auto', 'min_samples_leaf': 1, 'min_samples_split': 5, 'n_estimators': 220}. Best is trial 284 with value: 0.9236651223187223.[0m
[32m[I 2021-06-01 15:11:03,016][0m Trial 330 finished with value: 0.9098904526139332 and parameters: {'criterion': 'gini', 'max_depth': 15, 'max_features': 'auto', 'min_samples_leaf': 1, 'min_samples_split': 7, 'n_estimators': 20}. Best is trial 284 with value: 0.9236651223187223.[0m
[32m[I 2021-06-01 15:11:03,622][0m Trial 329 finished with value: 0.9107070454856219 and parameters: {'criterion': 'gini', 'max_depth': 15, 'max_features': 'auto', 'min_samples_leaf': 1, 'min_samples_split': 7, 'n_estimators': 20}. Best is trial 284 with value: 0.9236651223187223.[0m
[32m[I 2021-06-01 15:11:03,955][0m Trial 331 finished with value: 0.9090211621001003 and parameters: {'criterion': 'gini', 'max_depth': 15, 'max_features': 'auto', 'min_samples_leaf': 1, 'min_samples_split': 5, 'n_estimators': 20}. Best is trial 284 with value: 0.9236651223187223.[0m
[32m[I 2021-06-01 15:11:04,170][0m Trial 337 finished with value: 0.9085184033657573 and parameters: {'criterion': 'gini', 'max_depth': 15, 'max_features': 'auto', 'min_samples_leaf': 1, 'min_samples_split': 5, 'n_estimators': 20}. Best is trial 284 with value: 0.9236651223187223.[0m
[32m[I 2021-06-01 15:11:04,227][0m Trial 314 finished with value: 0.9067081964086923 and parameters: {'criterion': 'gini', 'max_depth': 20, 'max_features': 'log2', 'min_samples_leaf': 2, 'min_samples_split': 5, 'n_estimators': 220}. Best is trial 284 with value: 0.9236651223187223.[0m
[32m[I 2021-06-01 15:11:04,248][0m Trial 339 finished with value: 0.9109177280914917 and parameters: {'criterion': 'gini', 'max_depth': None, 'max_features': 'auto', 'min_samples_leaf': 1, 'min_samples_split': 5, 'n_estimators': 20}. Best is trial 284 with value: 0.9236651223187223.[0m
[32m[I 2021-06-01 15:11:04,249][0m Trial 333 finished with value: 0.9116289946056881 and parameters: {'criterion': 'gini', 'max_depth': 15, 'max_features': 'auto', 'min_samples_leaf': 1, 'min_samples_split': 7, 'n_estimators': 20}. Best is trial 284 with value: 0.9236651223187223.[0m
[32m[I 2021-06-01 15:11:04,505][0m Trial 336 finished with value: 0.9101735193840458 and parameters: {'criterion': 'gini', 'max_depth': None, 'max_features': 'auto', 'min_samples_leaf': 1, 'min_samples_split': 7, 'n_estimators': 20}. Best is trial 284 with value: 0.9236651223187223.[0m
[32m[I 2021-06-01 15:11:04,507][0m Trial 346 finished with value: 0.9020026350461133 and parameters: {'criterion': 'gini', 'max_depth': None, 'max_features': 'auto', 'min_samples_leaf': 8, 'min_samples_split': 5, 'n_estimators': 20}. Best is trial 284 with value: 0.9236651223187223.[0m
[32m[I 2021-06-01 15:11:04,510][0m Trial 335 finished with value: 0.9092274625958836 and parameters: {'criterion': 'gini', 'max_depth': 15, 'max_features': 'auto', 'min_samples_leaf': 1, 'min_samples_split': 7, 'n_estimators': 20}. Best is trial 284 with value: 0.9236651223187223.[0m
[32m[I 2021-06-01 15:11:04,534][0m Trial 328 finished with value: 0.9077782952957616 and parameters: {'criterion': 'gini', 'max_depth': 15, 'max_features': 'auto', 'min_samples_leaf': 1, 'min_samples_split': 5, 'n_estimators': 20}. Best is trial 284 with value: 0.9236651223187223.[0m
[32m[I 2021-06-01 15:11:04,610][0m Trial 340 finished with value: 0.9103424562703106 and parameters: {'criterion': 'gini', 'max_depth': 15, 'max_features': 'auto', 'min_samples_leaf': 1, 'min_samples_split': 5, 'n_estimators': 20}. Best is trial 284 with value: 0.9236651223187223.[0m
[32m[I 2021-06-01 15:11:04,784][0m Trial 343 finished with value: 0.9131681526825914 and parameters: {'criterion': 'gini', 'max_depth': None, 'max_features': 'auto', 'min_samples_leaf': 1, 'min_samples_split': 5, 'n_estimators': 20}. Best is trial 284 with value: 0.9236651223187223.[0m
[32m[I 2021-06-01 15:11:05,178][0m Trial 342 finished with value: 0.9121559995020638 and parameters: {'criterion': 'gini', 'max_depth': None, 'max_features': 'auto', 'min_samples_leaf': 1, 'min_samples_split': 5, 'n_estimators': 20}. Best is trial 284 with value: 0.9236651223187223.[0m
[32m[I 2021-06-01 15:11:05,273][0m Trial 321 finished with value: 0.9059413057039789 and parameters: {'criterion': 'gini', 'max_depth': 20, 'max_features': 'log2', 'min_samples_leaf': 1, 'min_samples_split': 5, 'n_estimators': 215}. Best is trial 284 with value: 0.9236651223187223.[0m
[32m[I 2021-06-01 15:11:05,353][0m Trial 350 finished with value: 0.9099967418980324 and parameters: {'criterion': 'gini', 'max_depth': None, 'max_features': 'auto', 'min_samples_leaf': 1, 'min_samples_split': 5, 'n_estimators': 20}. Best is trial 284 with value: 0.9236651223187223.[0m
[32m[I 2021-06-01 15:11:05,373][0m Trial 347 finished with value: 0.908291561424711 and parameters: {'criterion': 'gini', 'max_depth': 15, 'max_features': 'auto', 'min_samples_leaf': 1, 'min_samples_split': 5, 'n_estimators': 20}. Best is trial 284 with value: 0.9236651223187223.[0m
[32m[I 2021-06-01 15:11:05,498][0m Trial 349 finished with value: 0.9120542500327303 and parameters: {'criterion': 'gini', 'max_depth': None, 'max_features': 'auto', 'min_samples_leaf': 1, 'min_samples_split': 5, 'n_estimators': 20}. Best is trial 284 with value: 0.9236651223187223.[0m
[32m[I 2021-06-01 15:11:05,562][0m Trial 338 finished with value: 0.910991914741963 and parameters: {'criterion': 'gini', 'max_depth': None, 'max_features': 'auto', 'min_samples_leaf': 1, 'min_samples_split': 5, 'n_estimators': 20}. Best is trial 284 with value: 0.9236651223187223.[0m
[32m[I 2021-06-01 15:11:05,567][0m Trial 327 finished with value: 0.907936366511184 and parameters: {'criterion': 'gini', 'max_depth': 15, 'max_features': 'auto', 'min_samples_leaf': 1, 'min_samples_split': 5, 'n_estimators': 230}. Best is trial 284 with value: 0.9236651223187223.[0m
[32m[I 2021-06-01 15:11:05,597][0m Trial 334 finished with value: 0.9107205019349781 and parameters: {'criterion': 'gini', 'max_depth': None, 'max_features': 'auto', 'min_samples_leaf': 1, 'min_samples_split': 5, 'n_estimators': 20}. Best is trial 284 with value: 0.9236651223187223.[0m
[32m[I 2021-06-01 15:11:06,100][0m Trial 345 finished with value: 0.9106494118242898 and parameters: {'criterion': 'gini', 'max_depth': None, 'max_features': 'auto', 'min_samples_leaf': 1, 'min_samples_split': 6, 'n_estimators': 20}. Best is trial 284 with value: 0.9236651223187223.[0m
[32m[I 2021-06-01 15:11:06,108][0m Trial 348 finished with value: 0.9124776820369508 and parameters: {'criterion': 'gini', 'max_depth': None, 'max_features': 'auto', 'min_samples_leaf': 1, 'min_samples_split': 5, 'n_estimators': 20}. Best is trial 284 with value: 0.9236651223187223.[0m
[32m[I 2021-06-01 15:11:06,112][0m Trial 344 finished with value: 0.9114391173845634 and parameters: {'criterion': 'gini', 'max_depth': None, 'max_features': 'auto', 'min_samples_leaf': 1, 'min_samples_split': 5, 'n_estimators': 20}. Best is trial 284 with value: 0.9236651223187223.[0m
[32m[I 2021-06-01 15:11:06,114][0m Trial 341 finished with value: 0.9138803992652059 and parameters: {'criterion': 'gini', 'max_depth': None, 'max_features': 'auto', 'min_samples_leaf': 1, 'min_samples_split': 5, 'n_estimators': 20}. Best is trial 284 with value: 0.9236651223187223.[0m
[32m[I 2021-06-01 15:11:06,642][0m Trial 351 finished with value: 0.9057665842261141 and parameters: {'criterion': 'gini', 'max_depth': None, 'max_features': 'auto', 'min_samples_leaf': 1, 'min_samples_split': 6, 'n_estimators': 20}. Best is trial 284 with value: 0.9236651223187223.[0m
[32m[I 2021-06-01 15:11:07,124][0m Trial 352 finished with value: 0.9091880448298492 and parameters: {'criterion': 'gini', 'max_depth': None, 'max_features': 'auto', 'min_samples_leaf': 1, 'min_samples_split': 6, 'n_estimators': 10}. Best is trial 284 with value: 0.9236651223187223.[0m
[32m[I 2021-06-01 15:11:07,148][0m Trial 332 finished with value: 0.9068470465996924 and parameters: {'criterion': 'gini', 'max_depth': None, 'max_features': 'auto', 'min_samples_leaf': 1, 'min_samples_split': 5, 'n_estimators': 215}. Best is trial 284 with value: 0.9236651223187223.[0m
[32m[I 2021-06-01 15:11:08,127][0m Trial 353 finished with value: 0.912280366536339 and parameters: {'criterion': 'gini', 'max_depth': None, 'max_features': 'auto', 'min_samples_leaf': 1, 'min_samples_split': 6, 'n_estimators': 10}. Best is trial 284 with value: 0.9236651223187223.[0m
[32m[I 2021-06-01 15:11:08,194][0m Trial 356 finished with value: 0.9122152246412509 and parameters: {'criterion': 'entropy', 'max_depth': None, 'max_features': 'auto', 'min_samples_leaf': 1, 'min_samples_split': 6, 'n_estimators': 10}. Best is trial 284 with value: 0.9236651223187223.[0m
[32m[I 2021-06-01 15:11:08,226][0m Trial 354 finished with value: 0.9135956937134763 and parameters: {'criterion': 'entropy', 'max_depth': None, 'max_features': 'auto', 'min_samples_leaf': 1, 'min_samples_split': 6, 'n_estimators': 10}. Best is trial 284 with value: 0.9236651223187223.[0m
[32m[I 2021-06-01 15:11:08,227][0m Trial 357 finished with value: 0.9161661526679568 and parameters: {'criterion': 'entropy', 'max_depth': None, 'max_features': 'auto', 'min_samples_leaf': 1, 'min_samples_split': 4, 'n_estimators': 10}. Best is trial 284 with value: 0.9236651223187223.[0m
[32m[I 2021-06-01 15:11:08,532][0m Trial 365 finished with value: 0.9166380405123247 and parameters: {'criterion': 'entropy', 'max_depth': None, 'max_features': 'auto', 'min_samples_leaf': 1, 'min_samples_split': 4, 'n_estimators': 10}. Best is trial 284 with value: 0.9236651223187223.[0m
[32m[I 2021-06-01 15:11:08,533][0m Trial 361 finished with value: 0.9158357655962577 and parameters: {'criterion': 'entropy', 'max_depth': None, 'max_features': 'auto', 'min_samples_leaf': 1, 'min_samples_split': 4, 'n_estimators': 10}. Best is trial 284 with value: 0.9236651223187223.[0m
[32m[I 2021-06-01 15:11:08,747][0m Trial 360 finished with value: 0.915406216047208 and parameters: {'criterion': 'entropy', 'max_depth': None, 'max_features': 'auto', 'min_samples_leaf': 1, 'min_samples_split': 4, 'n_estimators': 10}. Best is trial 284 with value: 0.9236651223187223.[0m
[32m[I 2021-06-01 15:11:08,900][0m Trial 362 finished with value: 0.9149782136279997 and parameters: {'criterion': 'entropy', 'max_depth': None, 'max_features': 'auto', 'min_samples_leaf': 1, 'min_samples_split': 4, 'n_estimators': 10}. Best is trial 284 with value: 0.9236651223187223.[0m
[32m[I 2021-06-01 15:11:08,949][0m Trial 359 finished with value: 0.9170469738480511 and parameters: {'criterion': 'entropy', 'max_depth': 45, 'max_features': 'auto', 'min_samples_leaf': 1, 'min_samples_split': 4, 'n_estimators': 10}. Best is trial 284 with value: 0.9236651223187223.[0m
[32m[I 2021-06-01 15:11:09,257][0m Trial 364 finished with value: 0.9152476860422066 and parameters: {'criterion': 'entropy', 'max_depth': None, 'max_features': 'auto', 'min_samples_leaf': 1, 'min_samples_split': 4, 'n_estimators': 10}. Best is trial 284 with value: 0.9236651223187223.[0m
[32m[I 2021-06-01 15:11:09,268][0m Trial 363 finished with value: 0.9204519508997041 and parameters: {'criterion': 'entropy', 'max_depth': 45, 'max_features': 'auto', 'min_samples_leaf': 1, 'min_samples_split': 4, 'n_estimators': 10}. Best is trial 284 with value: 0.9236651223187223.[0m
[32m[I 2021-06-01 15:11:09,269][0m Trial 371 finished with value: 0.917279838553268 and parameters: {'criterion': 'entropy', 'max_depth': 45, 'max_features': 'auto', 'min_samples_leaf': 1, 'min_samples_split': 4, 'n_estimators': 10}. Best is trial 284 with value: 0.9236651223187223.[0m
[32m[I 2021-06-01 15:11:09,343][0m Trial 358 finished with value: 0.9115791956857808 and parameters: {'criterion': 'entropy', 'max_depth': None, 'max_features': 'auto', 'min_samples_leaf': 1, 'min_samples_split': 4, 'n_estimators': 10}. Best is trial 284 with value: 0.9236651223187223.[0m
[32m[I 2021-06-01 15:11:09,466][0m Trial 367 finished with value: 0.9166708131509675 and parameters: {'criterion': 'entropy', 'max_depth': 45, 'max_features': 'auto', 'min_samples_leaf': 1, 'min_samples_split': 4, 'n_estimators': 10}. Best is trial 284 with value: 0.9236651223187223.[0m
[32m[I 2021-06-01 15:11:09,628][0m Trial 375 finished with value: 0.9123785241038604 and parameters: {'criterion': 'entropy', 'max_depth': 45, 'max_features': 'auto', 'min_samples_leaf': 1, 'min_samples_split': 4, 'n_estimators': 10}. Best is trial 284 with value: 0.9236651223187223.[0m
[32m[I 2021-06-01 15:11:09,978][0m Trial 372 finished with value: 0.9174795715736632 and parameters: {'criterion': 'entropy', 'max_depth': 45, 'max_features': 'auto', 'min_samples_leaf': 1, 'min_samples_split': 4, 'n_estimators': 10}. Best is trial 284 with value: 0.9236651223187223.[0m
[32m[I 2021-06-01 15:11:09,990][0m Trial 373 finished with value: 0.9138636098202172 and parameters: {'criterion': 'entropy', 'max_depth': 45, 'max_features': 'auto', 'min_samples_leaf': 1, 'min_samples_split': 4, 'n_estimators': 10}. Best is trial 284 with value: 0.9236651223187223.[0m
[32m[I 2021-06-01 15:11:10,254][0m Trial 374 finished with value: 0.9192912848137131 and parameters: {'criterion': 'entropy', 'max_depth': 45, 'max_features': 'auto', 'min_samples_leaf': 1, 'min_samples_split': 4, 'n_estimators': 10}. Best is trial 284 with value: 0.9236651223187223.[0m
[32m[I 2021-06-01 15:11:10,442][0m Trial 369 finished with value: 0.9088796726585523 and parameters: {'criterion': 'entropy', 'max_depth': 45, 'max_features': 'auto', 'min_samples_leaf': 1, 'min_samples_split': 10, 'n_estimators': 10}. Best is trial 284 with value: 0.9236651223187223.[0m
[32m[I 2021-06-01 15:11:10,443][0m Trial 370 finished with value: 0.9166973770538377 and parameters: {'criterion': 'entropy', 'max_depth': 45, 'max_features': 'auto', 'min_samples_leaf': 1, 'min_samples_split': 4, 'n_estimators': 10}. Best is trial 284 with value: 0.9236651223187223.[0m
[32m[I 2021-06-01 15:11:10,796][0m Trial 376 finished with value: 0.9127124201657908 and parameters: {'criterion': 'entropy', 'max_depth': 45, 'max_features': 'auto', 'min_samples_leaf': 1, 'min_samples_split': 4, 'n_estimators': 10}. Best is trial 284 with value: 0.9236651223187223.[0m
[32m[I 2021-06-01 15:11:11,214][0m Trial 368 finished with value: 0.9182403966255093 and parameters: {'criterion': 'entropy', 'max_depth': 45, 'max_features': 'auto', 'min_samples_leaf': 1, 'min_samples_split': 4, 'n_estimators': 10}. Best is trial 284 with value: 0.9236651223187223.[0m
[32m[I 2021-06-01 15:11:11,227][0m Trial 383 finished with value: 0.9155804668304668 and parameters: {'criterion': 'entropy', 'max_depth': 45, 'max_features': 'auto', 'min_samples_leaf': 1, 'min_samples_split': 4, 'n_estimators': 10}. Best is trial 284 with value: 0.9236651223187223.[0m
[32m[I 2021-06-01 15:11:11,294][0m Trial 366 finished with value: 0.9167159326576687 and parameters: {'criterion': 'entropy', 'max_depth': 45, 'max_features': 'auto', 'min_samples_leaf': 1, 'min_samples_split': 4, 'n_estimators': 10}. Best is trial 284 with value: 0.9236651223187223.[0m
[32m[I 2021-06-01 15:11:11,960][0m Trial 377 finished with value: 0.9159162659199589 and parameters: {'criterion': 'entropy', 'max_depth': 45, 'max_features': 'auto', 'min_samples_leaf': 1, 'min_samples_split': 4, 'n_estimators': 10}. Best is trial 284 with value: 0.9236651223187223.[0m
[32m[I 2021-06-01 15:11:12,061][0m Trial 385 finished with value: 0.9156573747755544 and parameters: {'criterion': 'entropy', 'max_depth': 45, 'max_features': 'auto', 'min_samples_leaf': 1, 'min_samples_split': 4, 'n_estimators': 10}. Best is trial 284 with value: 0.9236651223187223.[0m
[32m[I 2021-06-01 15:11:12,140][0m Trial 380 finished with value: 0.9154316710144172 and parameters: {'criterion': 'entropy', 'max_depth': 45, 'max_features': 'auto', 'min_samples_leaf': 1, 'min_samples_split': 4, 'n_estimators': 10}. Best is trial 284 with value: 0.9236651223187223.[0m
[32m[I 2021-06-01 15:11:12,165][0m Trial 379 finished with value: 0.9125872205614117 and parameters: {'criterion': 'entropy', 'max_depth': 45, 'max_features': 'auto', 'min_samples_leaf': 1, 'min_samples_split': 4, 'n_estimators': 10}. Best is trial 284 with value: 0.9236651223187223.[0m
