2021-06-01 15:08:50.463724: W tensorflow/stream_executor/platform/default/dso_loader.cc:64] Could not load dynamic library 'libcudart.so.11.0'; dlerror: libcudart.so.11.0: cannot open shared object file: No such file or directory; LD_LIBRARY_PATH: /sw/ompi/4.1.1/lib:/sw/ompi/4.1.1/include:/sw/ucx/1.10.0/lib:/sw/gcc/10.2.0/lib64:/sw/gcc/10.2.0/lib
2021-06-01 15:08:50.463776: I tensorflow/stream_executor/cuda/cudart_stub.cc:29] Ignore above cudart dlerror if you do not have a GPU set up on your machine.
2021-06-01 15:08:50.463720: W tensorflow/stream_executor/platform/default/dso_loader.cc:64] Could not load dynamic library 'libcudart.so.11.0'; dlerror: libcudart.so.11.0: cannot open shared object file: No such file or directory; LD_LIBRARY_PATH: /sw/ompi/4.1.1/lib:/sw/ompi/4.1.1/include:/sw/ucx/1.10.0/lib:/sw/gcc/10.2.0/lib64:/sw/gcc/10.2.0/lib
2021-06-01 15:08:50.463770: I tensorflow/stream_executor/cuda/cudart_stub.cc:29] Ignore above cudart dlerror if you do not have a GPU set up on your machine.
2021-06-01 15:08:50.463739: W tensorflow/stream_executor/platform/default/dso_loader.cc:64] Could not load dynamic library 'libcudart.so.11.0'; dlerror: libcudart.so.11.0: cannot open shared object file: No such file or directory; LD_LIBRARY_PATH: /sw/ompi/4.1.1/lib:/sw/ompi/4.1.1/include:/sw/ucx/1.10.0/lib:/sw/gcc/10.2.0/lib64:/sw/gcc/10.2.0/lib
2021-06-01 15:08:50.463787: I tensorflow/stream_executor/cuda/cudart_stub.cc:29] Ignore above cudart dlerror if you do not have a GPU set up on your machine.
2021-06-01 15:08:50.463709: W tensorflow/stream_executor/platform/default/dso_loader.cc:64] Could not load dynamic library 'libcudart.so.11.0'; dlerror: libcudart.so.11.0: cannot open shared object file: No such file or directory; LD_LIBRARY_PATH: /sw/ompi/4.1.1/lib:/sw/ompi/4.1.1/include:/sw/ucx/1.10.0/lib:/sw/gcc/10.2.0/lib64:/sw/gcc/10.2.0/lib
2021-06-01 15:08:50.463769: I tensorflow/stream_executor/cuda/cudart_stub.cc:29] Ignore above cudart dlerror if you do not have a GPU set up on your machine.
2021-06-01 15:08:50.463756: W tensorflow/stream_executor/platform/default/dso_loader.cc:64] Could not load dynamic library 'libcudart.so.11.0'; dlerror: libcudart.so.11.0: cannot open shared object file: No such file or directory; LD_LIBRARY_PATH: /sw/ompi/4.1.1/lib:/sw/ompi/4.1.1/include:/sw/ucx/1.10.0/lib:/sw/gcc/10.2.0/lib64:/sw/gcc/10.2.0/lib
2021-06-01 15:08:50.463802: I tensorflow/stream_executor/cuda/cudart_stub.cc:29] Ignore above cudart dlerror if you do not have a GPU set up on your machine.
2021-06-01 15:08:50.463845: W tensorflow/stream_executor/platform/default/dso_loader.cc:64] Could not load dynamic library 'libcudart.so.11.0'; dlerror: libcudart.so.11.0: cannot open shared object file: No such file or directory; LD_LIBRARY_PATH: /sw/ompi/4.1.1/lib:/sw/ompi/4.1.1/include:/sw/ucx/1.10.0/lib:/sw/gcc/10.2.0/lib64:/sw/gcc/10.2.0/lib
2021-06-01 15:08:50.463890: I tensorflow/stream_executor/cuda/cudart_stub.cc:29] Ignore above cudart dlerror if you do not have a GPU set up on your machine.
2021-06-01 15:08:50.463777: W tensorflow/stream_executor/platform/default/dso_loader.cc:64] Could not load dynamic library 'libcudart.so.11.0'; dlerror: libcudart.so.11.0: cannot open shared object file: No such file or directory; LD_LIBRARY_PATH: /sw/ompi/4.1.1/lib:/sw/ompi/4.1.1/include:/sw/ucx/1.10.0/lib:/sw/gcc/10.2.0/lib64:/sw/gcc/10.2.0/lib
2021-06-01 15:08:50.463822: I tensorflow/stream_executor/cuda/cudart_stub.cc:29] Ignore above cudart dlerror if you do not have a GPU set up on your machine.
2021-06-01 15:08:50.463907: W tensorflow/stream_executor/platform/default/dso_loader.cc:64] Could not load dynamic library 'libcudart.so.11.0'; dlerror: libcudart.so.11.0: cannot open shared object file: No such file or directory; LD_LIBRARY_PATH: /sw/ompi/4.1.1/lib:/sw/ompi/4.1.1/include:/sw/ucx/1.10.0/lib:/sw/gcc/10.2.0/lib64:/sw/gcc/10.2.0/lib
2021-06-01 15:08:50.463952: I tensorflow/stream_executor/cuda/cudart_stub.cc:29] Ignore above cudart dlerror if you do not have a GPU set up on your machine.
2021-06-01 15:08:50.463805: W tensorflow/stream_executor/platform/default/dso_loader.cc:64] Could not load dynamic library 'libcudart.so.11.0'; dlerror: libcudart.so.11.0: cannot open shared object file: No such file or directory; LD_LIBRARY_PATH: /sw/ompi/4.1.1/lib:/sw/ompi/4.1.1/include:/sw/ucx/1.10.0/lib:/sw/gcc/10.2.0/lib64:/sw/gcc/10.2.0/lib
2021-06-01 15:08:50.463850: I tensorflow/stream_executor/cuda/cudart_stub.cc:29] Ignore above cudart dlerror if you do not have a GPU set up on your machine.
2021-06-01 15:08:50.463928: W tensorflow/stream_executor/platform/default/dso_loader.cc:64] Could not load dynamic library 'libcudart.so.11.0'; dlerror: libcudart.so.11.0: cannot open shared object file: No such file or directory; LD_LIBRARY_PATH: /sw/ompi/4.1.1/lib:/sw/ompi/4.1.1/include:/sw/ucx/1.10.0/lib:/sw/gcc/10.2.0/lib64:/sw/gcc/10.2.0/lib
2021-06-01 15:08:50.463972: I tensorflow/stream_executor/cuda/cudart_stub.cc:29] Ignore above cudart dlerror if you do not have a GPU set up on your machine.
2021-06-01 15:08:50.463792: W tensorflow/stream_executor/platform/default/dso_loader.cc:64] Could not load dynamic library 'libcudart.so.11.0'; dlerror: libcudart.so.11.0: cannot open shared object file: No such file or directory; LD_LIBRARY_PATH: /sw/ompi/4.1.1/lib:/sw/ompi/4.1.1/include:/sw/ucx/1.10.0/lib:/sw/gcc/10.2.0/lib64:/sw/gcc/10.2.0/lib
2021-06-01 15:08:50.463839: I tensorflow/stream_executor/cuda/cudart_stub.cc:29] Ignore above cudart dlerror if you do not have a GPU set up on your machine.
2021-06-01 15:08:50.463890: W tensorflow/stream_executor/platform/default/dso_loader.cc:64] Could not load dynamic library 'libcudart.so.11.0'; dlerror: libcudart.so.11.0: cannot open shared object file: No such file or directory; LD_LIBRARY_PATH: /sw/ompi/4.1.1/lib:/sw/ompi/4.1.1/include:/sw/ucx/1.10.0/lib:/sw/gcc/10.2.0/lib64:/sw/gcc/10.2.0/lib
2021-06-01 15:08:50.463935: I tensorflow/stream_executor/cuda/cudart_stub.cc:29] Ignore above cudart dlerror if you do not have a GPU set up on your machine.
2021-06-01 15:08:50.463786: W tensorflow/stream_executor/platform/default/dso_loader.cc:64] Could not load dynamic library 'libcudart.so.11.0'; dlerror: libcudart.so.11.0: cannot open shared object file: No such file or directory; LD_LIBRARY_PATH: /sw/ompi/4.1.1/lib:/sw/ompi/4.1.1/include:/sw/ucx/1.10.0/lib:/sw/gcc/10.2.0/lib64:/sw/gcc/10.2.0/lib
2021-06-01 15:08:50.463829: I tensorflow/stream_executor/cuda/cudart_stub.cc:29] Ignore above cudart dlerror if you do not have a GPU set up on your machine.
2021-06-01 15:08:50.463780: W tensorflow/stream_executor/platform/default/dso_loader.cc:64] Could not load dynamic library 'libcudart.so.11.0'; dlerror: libcudart.so.11.0: cannot open shared object file: No such file or directory; LD_LIBRARY_PATH: /sw/ompi/4.1.1/lib:/sw/ompi/4.1.1/include:/sw/ucx/1.10.0/lib:/sw/gcc/10.2.0/lib64:/sw/gcc/10.2.0/lib
2021-06-01 15:08:50.463825: I tensorflow/stream_executor/cuda/cudart_stub.cc:29] Ignore above cudart dlerror if you do not have a GPU set up on your machine.
2021-06-01 15:08:50.463865: W tensorflow/stream_executor/platform/default/dso_loader.cc:64] Could not load dynamic library 'libcudart.so.11.0'; dlerror: libcudart.so.11.0: cannot open shared object file: No such file or directory; LD_LIBRARY_PATH: /sw/ompi/4.1.1/lib:/sw/ompi/4.1.1/include:/sw/ucx/1.10.0/lib:/sw/gcc/10.2.0/lib64:/sw/gcc/10.2.0/lib
2021-06-01 15:08:50.463910: I tensorflow/stream_executor/cuda/cudart_stub.cc:29] Ignore above cudart dlerror if you do not have a GPU set up on your machine.
2021-06-01 15:08:50.463826: W tensorflow/stream_executor/platform/default/dso_loader.cc:64] Could not load dynamic library 'libcudart.so.11.0'; dlerror: libcudart.so.11.0: cannot open shared object file: No such file or directory; LD_LIBRARY_PATH: /sw/ompi/4.1.1/lib:/sw/ompi/4.1.1/include:/sw/ucx/1.10.0/lib:/sw/gcc/10.2.0/lib64:/sw/gcc/10.2.0/lib
2021-06-01 15:08:50.463871: I tensorflow/stream_executor/cuda/cudart_stub.cc:29] Ignore above cudart dlerror if you do not have a GPU set up on your machine.
2021-06-01 15:08:50.463773: W tensorflow/stream_executor/platform/default/dso_loader.cc:64] Could not load dynamic library 'libcudart.so.11.0'; dlerror: libcudart.so.11.0: cannot open shared object file: No such file or directory; LD_LIBRARY_PATH: /sw/ompi/4.1.1/lib:/sw/ompi/4.1.1/include:/sw/ucx/1.10.0/lib:/sw/gcc/10.2.0/lib64:/sw/gcc/10.2.0/lib
2021-06-01 15:08:50.463826: I tensorflow/stream_executor/cuda/cudart_stub.cc:29] Ignore above cudart dlerror if you do not have a GPU set up on your machine.
2021-06-01 15:08:50.463945: W tensorflow/stream_executor/platform/default/dso_loader.cc:64] Could not load dynamic library 'libcudart.so.11.0'; dlerror: libcudart.so.11.0: cannot open shared object file: No such file or directory; LD_LIBRARY_PATH: /sw/ompi/4.1.1/lib:/sw/ompi/4.1.1/include:/sw/ucx/1.10.0/lib:/sw/gcc/10.2.0/lib64:/sw/gcc/10.2.0/lib
2021-06-01 15:08:50.463990: I tensorflow/stream_executor/cuda/cudart_stub.cc:29] Ignore above cudart dlerror if you do not have a GPU set up on your machine.
2021-06-01 15:08:50.464579: W tensorflow/stream_executor/platform/default/dso_loader.cc:64] Could not load dynamic library 'libcudart.so.11.0'; dlerror: libcudart.so.11.0: cannot open shared object file: No such file or directory; LD_LIBRARY_PATH: /sw/ompi/4.1.1/lib:/sw/ompi/4.1.1/include:/sw/ucx/1.10.0/lib:/sw/gcc/10.2.0/lib64:/sw/gcc/10.2.0/lib
2021-06-01 15:08:50.464626: I tensorflow/stream_executor/cuda/cudart_stub.cc:29] Ignore above cudart dlerror if you do not have a GPU set up on your machine.
2021-06-01 15:08:50.464540: W tensorflow/stream_executor/platform/default/dso_loader.cc:64] Could not load dynamic library 'libcudart.so.11.0'; dlerror: libcudart.so.11.0: cannot open shared object file: No such file or directory; LD_LIBRARY_PATH: /sw/ompi/4.1.1/lib:/sw/ompi/4.1.1/include:/sw/ucx/1.10.0/lib:/sw/gcc/10.2.0/lib64:/sw/gcc/10.2.0/lib
2021-06-01 15:08:50.464588: I tensorflow/stream_executor/cuda/cudart_stub.cc:29] Ignore above cudart dlerror if you do not have a GPU set up on your machine.
2021-06-01 15:08:50.464378: W tensorflow/stream_executor/platform/default/dso_loader.cc:64] Could not load dynamic library 'libcudart.so.11.0'; dlerror: libcudart.so.11.0: cannot open shared object file: No such file or directory; LD_LIBRARY_PATH: /sw/ompi/4.1.1/lib:/sw/ompi/4.1.1/include:/sw/ucx/1.10.0/lib:/sw/gcc/10.2.0/lib64:/sw/gcc/10.2.0/lib
2021-06-01 15:08:50.464435: I tensorflow/stream_executor/cuda/cudart_stub.cc:29] Ignore above cudart dlerror if you do not have a GPU set up on your machine.
2021-06-01 15:08:50.464538: W tensorflow/stream_executor/platform/default/dso_loader.cc:64] Could not load dynamic library 'libcudart.so.11.0'; dlerror: libcudart.so.11.0: cannot open shared object file: No such file or directory; LD_LIBRARY_PATH: /sw/ompi/4.1.1/lib:/sw/ompi/4.1.1/include:/sw/ucx/1.10.0/lib:/sw/gcc/10.2.0/lib64:/sw/gcc/10.2.0/lib
2021-06-01 15:08:50.464606: I tensorflow/stream_executor/cuda/cudart_stub.cc:29] Ignore above cudart dlerror if you do not have a GPU set up on your machine.
2021-06-01 15:08:50.464374: W tensorflow/stream_executor/platform/default/dso_loader.cc:64] Could not load dynamic library 'libcudart.so.11.0'; dlerror: libcudart.so.11.0: cannot open shared object file: No such file or directory; LD_LIBRARY_PATH: /sw/ompi/4.1.1/lib:/sw/ompi/4.1.1/include:/sw/ucx/1.10.0/lib:/sw/gcc/10.2.0/lib64:/sw/gcc/10.2.0/lib
2021-06-01 15:08:50.464458: I tensorflow/stream_executor/cuda/cudart_stub.cc:29] Ignore above cudart dlerror if you do not have a GPU set up on your machine.
2021-06-01 15:08:50.464481: W tensorflow/stream_executor/platform/default/dso_loader.cc:64] Could not load dynamic library 'libcudart.so.11.0'; dlerror: libcudart.so.11.0: cannot open shared object file: No such file or directory; LD_LIBRARY_PATH: /sw/ompi/4.1.1/lib:/sw/ompi/4.1.1/include:/sw/ucx/1.10.0/lib:/sw/gcc/10.2.0/lib64:/sw/gcc/10.2.0/lib
2021-06-01 15:08:50.464551: I tensorflow/stream_executor/cuda/cudart_stub.cc:29] Ignore above cudart dlerror if you do not have a GPU set up on your machine.
2021-06-01 15:08:50.464557: W tensorflow/stream_executor/platform/default/dso_loader.cc:64] Could not load dynamic library 'libcudart.so.11.0'; dlerror: libcudart.so.11.0: cannot open shared object file: No such file or directory; LD_LIBRARY_PATH: /sw/ompi/4.1.1/lib:/sw/ompi/4.1.1/include:/sw/ucx/1.10.0/lib:/sw/gcc/10.2.0/lib64:/sw/gcc/10.2.0/lib
2021-06-01 15:08:50.464602: I tensorflow/stream_executor/cuda/cudart_stub.cc:29] Ignore above cudart dlerror if you do not have a GPU set up on your machine.
2021-06-01 15:08:50.463972: W tensorflow/stream_executor/platform/default/dso_loader.cc:64] Could not load dynamic library 'libcudart.so.11.0'; dlerror: libcudart.so.11.0: cannot open shared object file: No such file or directory; LD_LIBRARY_PATH: /sw/ompi/4.1.1/lib:/sw/ompi/4.1.1/include:/sw/ucx/1.10.0/lib:/sw/gcc/10.2.0/lib64:/sw/gcc/10.2.0/lib
2021-06-01 15:08:50.464017: I tensorflow/stream_executor/cuda/cudart_stub.cc:29] Ignore above cudart dlerror if you do not have a GPU set up on your machine.
2021-06-01 15:08:50.464254: W tensorflow/stream_executor/platform/default/dso_loader.cc:64] Could not load dynamic library 'libcudart.so.11.0'; dlerror: libcudart.so.11.0: cannot open shared object file: No such file or directory; LD_LIBRARY_PATH: /sw/ompi/4.1.1/lib:/sw/ompi/4.1.1/include:/sw/ucx/1.10.0/lib:/sw/gcc/10.2.0/lib64:/sw/gcc/10.2.0/lib
2021-06-01 15:08:50.464305: I tensorflow/stream_executor/cuda/cudart_stub.cc:29] Ignore above cudart dlerror if you do not have a GPU set up on your machine.
2021-06-01 15:08:50.464490: W tensorflow/stream_executor/platform/default/dso_loader.cc:64] Could not load dynamic library 'libcudart.so.11.0'; dlerror: libcudart.so.11.0: cannot open shared object file: No such file or directory; LD_LIBRARY_PATH: /sw/ompi/4.1.1/lib:/sw/ompi/4.1.1/include:/sw/ucx/1.10.0/lib:/sw/gcc/10.2.0/lib64:/sw/gcc/10.2.0/lib
2021-06-01 15:08:50.464538: I tensorflow/stream_executor/cuda/cudart_stub.cc:29] Ignore above cudart dlerror if you do not have a GPU set up on your machine.
[32m[I 2021-06-01 15:10:45,045][0m Trial 281 finished with value: 0.9146814033151459 and parameters: {'criterion': 'gini', 'max_depth': None, 'max_features': 'auto', 'min_samples_leaf': 1, 'min_samples_split': 5, 'n_estimators': 10}. Best is trial 233 with value: 0.9218531751282842.[0m
[32m[I 2021-06-01 15:10:45,524][0m Trial 288 finished with value: 0.9102640739938123 and parameters: {'criterion': 'gini', 'max_depth': None, 'max_features': 'auto', 'min_samples_leaf': 1, 'min_samples_split': 5, 'n_estimators': 10}. Best is trial 233 with value: 0.9218531751282842.[0m
[32m[I 2021-06-01 15:10:45,840][0m Trial 280 finished with value: 0.9123805382212462 and parameters: {'criterion': 'gini', 'max_depth': None, 'max_features': 'auto', 'min_samples_leaf': 1, 'min_samples_split': 5, 'n_estimators': 10}. Best is trial 284 with value: 0.9236651223187223.[0m
[32m[I 2021-06-01 15:10:45,866][0m Trial 282 finished with value: 0.9142504758975347 and parameters: {'criterion': 'gini', 'max_depth': None, 'max_features': 'auto', 'min_samples_leaf': 1, 'min_samples_split': 5, 'n_estimators': 10}. Best is trial 284 with value: 0.9236651223187223.[0m
[32m[I 2021-06-01 15:10:45,869][0m Trial 284 finished with value: 0.9236651223187223 and parameters: {'criterion': 'gini', 'max_depth': None, 'max_features': 'auto', 'min_samples_leaf': 1, 'min_samples_split': 5, 'n_estimators': 10}. Best is trial 284 with value: 0.9236651223187223.[0m
[32m[I 2021-06-01 15:10:45,871][0m Trial 287 finished with value: 0.9187004523292126 and parameters: {'criterion': 'gini', 'max_depth': None, 'max_features': 'auto', 'min_samples_leaf': 1, 'min_samples_split': 5, 'n_estimators': 10}. Best is trial 284 with value: 0.9236651223187223.[0m
[32m[I 2021-06-01 15:10:45,876][0m Trial 293 finished with value: 0.9117569959339871 and parameters: {'criterion': 'gini', 'max_depth': None, 'max_features': 'auto', 'min_samples_leaf': 1, 'min_samples_split': 5, 'n_estimators': 10}. Best is trial 284 with value: 0.9236651223187223.[0m
[32m[I 2021-06-01 15:10:45,878][0m Trial 289 finished with value: 0.9110604815518586 and parameters: {'criterion': 'gini', 'max_depth': None, 'max_features': 'auto', 'min_samples_leaf': 1, 'min_samples_split': 5, 'n_estimators': 10}. Best is trial 284 with value: 0.9236651223187223.[0m
[32m[I 2021-06-01 15:10:45,946][0m Trial 286 finished with value: 0.9121235580783225 and parameters: {'criterion': 'gini', 'max_depth': None, 'max_features': 'auto', 'min_samples_leaf': 1, 'min_samples_split': 5, 'n_estimators': 10}. Best is trial 284 with value: 0.9236651223187223.[0m
[32m[I 2021-06-01 15:10:45,951][0m Trial 299 finished with value: 0.9104612530076501 and parameters: {'criterion': 'gini', 'max_depth': None, 'max_features': 'auto', 'min_samples_leaf': 1, 'min_samples_split': 5, 'n_estimators': 10}. Best is trial 284 with value: 0.9236651223187223.[0m
[32m[I 2021-06-01 15:10:46,097][0m Trial 283 finished with value: 0.9165882282047872 and parameters: {'criterion': 'gini', 'max_depth': None, 'max_features': 'auto', 'min_samples_leaf': 1, 'min_samples_split': 5, 'n_estimators': 10}. Best is trial 284 with value: 0.9236651223187223.[0m
[32m[I 2021-06-01 15:10:46,513][0m Trial 297 finished with value: 0.9101537598984193 and parameters: {'criterion': 'gini', 'max_depth': None, 'max_features': 'auto', 'min_samples_leaf': 1, 'min_samples_split': 5, 'n_estimators': 10}. Best is trial 284 with value: 0.9236651223187223.[0m
[32m[I 2021-06-01 15:10:46,560][0m Trial 292 finished with value: 0.9170709616301809 and parameters: {'criterion': 'gini', 'max_depth': None, 'max_features': 'auto', 'min_samples_leaf': 1, 'min_samples_split': 5, 'n_estimators': 10}. Best is trial 284 with value: 0.9236651223187223.[0m
[32m[I 2021-06-01 15:10:46,581][0m Trial 296 finished with value: 0.9191951951951951 and parameters: {'criterion': 'gini', 'max_depth': None, 'max_features': 'auto', 'min_samples_leaf': 1, 'min_samples_split': 5, 'n_estimators': 10}. Best is trial 284 with value: 0.9236651223187223.[0m
[32m[I 2021-06-01 15:10:46,584][0m Trial 285 finished with value: 0.9100776564321527 and parameters: {'criterion': 'gini', 'max_depth': None, 'max_features': 'auto', 'min_samples_leaf': 1, 'min_samples_split': 5, 'n_estimators': 10}. Best is trial 284 with value: 0.9236651223187223.[0m
[32m[I 2021-06-01 15:10:46,591][0m Trial 295 finished with value: 0.9154118644038638 and parameters: {'criterion': 'gini', 'max_depth': None, 'max_features': 'auto', 'min_samples_leaf': 1, 'min_samples_split': 5, 'n_estimators': 10}. Best is trial 284 with value: 0.9236651223187223.[0m
[32m[I 2021-06-01 15:10:46,595][0m Trial 298 finished with value: 0.9074130830393857 and parameters: {'criterion': 'gini', 'max_depth': None, 'max_features': 'auto', 'min_samples_leaf': 1, 'min_samples_split': 5, 'n_estimators': 10}. Best is trial 284 with value: 0.9236651223187223.[0m
[32m[I 2021-06-01 15:10:46,629][0m Trial 294 finished with value: 0.9118716577540106 and parameters: {'criterion': 'gini', 'max_depth': None, 'max_features': 'auto', 'min_samples_leaf': 1, 'min_samples_split': 5, 'n_estimators': 10}. Best is trial 284 with value: 0.9236651223187223.[0m
[32m[I 2021-06-01 15:10:46,880][0m Trial 291 finished with value: 0.9117851293828577 and parameters: {'criterion': 'gini', 'max_depth': None, 'max_features': 'auto', 'min_samples_leaf': 1, 'min_samples_split': 5, 'n_estimators': 10}. Best is trial 284 with value: 0.9236651223187223.[0m
[32m[I 2021-06-01 15:10:47,009][0m Trial 290 finished with value: 0.9048811125454176 and parameters: {'criterion': 'gini', 'max_depth': None, 'max_features': 'auto', 'min_samples_leaf': 10, 'min_samples_split': 5, 'n_estimators': 10}. Best is trial 284 with value: 0.9236651223187223.[0m
[32m[I 2021-06-01 15:10:49,763][0m Trial 300 finished with value: 0.9148371792182365 and parameters: {'criterion': 'gini', 'max_depth': 20, 'max_features': 'auto', 'min_samples_leaf': 2, 'min_samples_split': 5, 'n_estimators': 15}. Best is trial 284 with value: 0.9236651223187223.[0m
[32m[I 2021-06-01 15:10:49,763][0m Trial 304 finished with value: 0.9115542040812791 and parameters: {'criterion': 'gini', 'max_depth': 20, 'max_features': 'auto', 'min_samples_leaf': 2, 'min_samples_split': 5, 'n_estimators': 15}. Best is trial 284 with value: 0.9236651223187223.[0m
[32m[I 2021-06-01 15:10:49,819][0m Trial 309 finished with value: 0.9113811908088806 and parameters: {'criterion': 'gini', 'max_depth': 20, 'max_features': 'auto', 'min_samples_leaf': 2, 'min_samples_split': 5, 'n_estimators': 15}. Best is trial 284 with value: 0.9236651223187223.[0m
[32m[I 2021-06-01 15:10:49,855][0m Trial 302 finished with value: 0.9108239134279732 and parameters: {'criterion': 'gini', 'max_depth': 20, 'max_features': 'auto', 'min_samples_leaf': 2, 'min_samples_split': 5, 'n_estimators': 15}. Best is trial 284 with value: 0.9236651223187223.[0m
[32m[I 2021-06-01 15:10:49,864][0m Trial 310 finished with value: 0.9139615098651823 and parameters: {'criterion': 'gini', 'max_depth': 20, 'max_features': 'auto', 'min_samples_leaf': 1, 'min_samples_split': 5, 'n_estimators': 15}. Best is trial 284 with value: 0.9236651223187223.[0m
[32m[I 2021-06-01 15:10:50,219][0m Trial 318 finished with value: 0.9107127054361566 and parameters: {'criterion': 'gini', 'max_depth': 20, 'max_features': 'auto', 'min_samples_leaf': 2, 'min_samples_split': 5, 'n_estimators': 15}. Best is trial 284 with value: 0.9236651223187223.[0m
