[32m[I 2021-06-01 15:11:12,346][0m Trial 378 finished with value: 0.9117166139217703 and parameters: {'criterion': 'entropy', 'max_depth': 45, 'max_features': 'auto', 'min_samples_leaf': 1, 'min_samples_split': 4, 'n_estimators': 10}. Best is trial 284 with value: 0.9236651223187223.[0m
[32m[I 2021-06-01 15:11:12,487][0m Trial 386 finished with value: 0.9209677654184381 and parameters: {'criterion': 'entropy', 'max_depth': 45, 'max_features': 'auto', 'min_samples_leaf': 1, 'min_samples_split': 4, 'n_estimators': 10}. Best is trial 284 with value: 0.9236651223187223.[0m
[32m[I 2021-06-01 15:11:12,842][0m Trial 389 finished with value: 0.9152328042699638 and parameters: {'criterion': 'entropy', 'max_depth': 45, 'max_features': 'auto', 'min_samples_leaf': 1, 'min_samples_split': 4, 'n_estimators': 10}. Best is trial 284 with value: 0.9236651223187223.[0m
[32m[I 2021-06-01 15:11:13,135][0m Trial 388 finished with value: 0.9158550059072056 and parameters: {'criterion': 'entropy', 'max_depth': 45, 'max_features': 'auto', 'min_samples_leaf': 1, 'min_samples_split': 4, 'n_estimators': 10}. Best is trial 284 with value: 0.9236651223187223.[0m
[32m[I 2021-06-01 15:11:13,271][0m Trial 387 finished with value: 0.9121907312596923 and parameters: {'criterion': 'entropy', 'max_depth': 45, 'max_features': 'auto', 'min_samples_leaf': 1, 'min_samples_split': 4, 'n_estimators': 10}. Best is trial 284 with value: 0.9236651223187223.[0m
[32m[I 2021-06-01 15:11:13,607][0m Trial 393 finished with value: 0.910470919451094 and parameters: {'criterion': 'entropy', 'max_depth': 45, 'max_features': 'auto', 'min_samples_leaf': 1, 'min_samples_split': 4, 'n_estimators': 30}. Best is trial 284 with value: 0.9236651223187223.[0m
[32m[I 2021-06-01 15:11:13,611][0m Trial 392 finished with value: 0.9036094871523008 and parameters: {'criterion': 'entropy', 'max_depth': 45, 'max_features': 'auto', 'min_samples_leaf': 9, 'min_samples_split': 4, 'n_estimators': 30}. Best is trial 284 with value: 0.9236651223187223.[0m
[32m[I 2021-06-01 15:11:13,611][0m Trial 390 finished with value: 0.9131957498420332 and parameters: {'criterion': 'entropy', 'max_depth': 45, 'max_features': 'auto', 'min_samples_leaf': 1, 'min_samples_split': 4, 'n_estimators': 30}. Best is trial 284 with value: 0.9236651223187223.[0m
[32m[I 2021-06-01 15:11:13,737][0m Trial 395 finished with value: 0.9125680342568095 and parameters: {'criterion': 'entropy', 'max_depth': 45, 'max_features': 'log2', 'min_samples_leaf': 1, 'min_samples_split': 4, 'n_estimators': 35}. Best is trial 284 with value: 0.9236651223187223.[0m
[32m[I 2021-06-01 15:11:13,988][0m Trial 382 finished with value: 0.914255772005772 and parameters: {'criterion': 'entropy', 'max_depth': 45, 'max_features': 'auto', 'min_samples_leaf': 1, 'min_samples_split': 4, 'n_estimators': 10}. Best is trial 284 with value: 0.9236651223187223.[0m
[32m[I 2021-06-01 15:11:13,991][0m Trial 381 finished with value: 0.9157598290431743 and parameters: {'criterion': 'entropy', 'max_depth': 45, 'max_features': 'auto', 'min_samples_leaf': 1, 'min_samples_split': 4, 'n_estimators': 10}. Best is trial 284 with value: 0.9236651223187223.[0m
[32m[I 2021-06-01 15:11:14,015][0m Trial 355 finished with value: 0.9121100526326991 and parameters: {'criterion': 'entropy', 'max_depth': None, 'max_features': 'auto', 'min_samples_leaf': 1, 'min_samples_split': 6, 'n_estimators': 245}. Best is trial 284 with value: 0.9236651223187223.[0m
[32m[I 2021-06-01 15:11:14,123][0m Trial 384 finished with value: 0.9096993330004232 and parameters: {'criterion': 'entropy', 'max_depth': 45, 'max_features': 'auto', 'min_samples_leaf': 1, 'min_samples_split': 4, 'n_estimators': 90}. Best is trial 284 with value: 0.9236651223187223.[0m
[32m[I 2021-06-01 15:11:14,380][0m Trial 400 finished with value: 0.9069981767543662 and parameters: {'criterion': 'entropy', 'max_depth': 45, 'max_features': 'log2', 'min_samples_leaf': 1, 'min_samples_split': 4, 'n_estimators': 30}. Best is trial 284 with value: 0.9236651223187223.[0m
[32m[I 2021-06-01 15:11:14,384][0m Trial 396 finished with value: 0.9079108972916732 and parameters: {'criterion': 'entropy', 'max_depth': 45, 'max_features': 'log2', 'min_samples_leaf': 1, 'min_samples_split': 4, 'n_estimators': 30}. Best is trial 284 with value: 0.9236651223187223.[0m
[32m[I 2021-06-01 15:11:14,466][0m Trial 403 finished with value: 0.909810309368603 and parameters: {'criterion': 'entropy', 'max_depth': 45, 'max_features': 'auto', 'min_samples_leaf': 1, 'min_samples_split': 4, 'n_estimators': 30}. Best is trial 284 with value: 0.9236651223187223.[0m
[32m[I 2021-06-01 15:11:14,716][0m Trial 398 finished with value: 0.913169054135842 and parameters: {'criterion': 'entropy', 'max_depth': 45, 'max_features': 'auto', 'min_samples_leaf': 1, 'min_samples_split': 4, 'n_estimators': 35}. Best is trial 284 with value: 0.9236651223187223.[0m
[32m[I 2021-06-01 15:11:15,185][0m Trial 391 finished with value: 0.9083192269643161 and parameters: {'criterion': 'entropy', 'max_depth': 45, 'max_features': 'log2', 'min_samples_leaf': 1, 'min_samples_split': 4, 'n_estimators': 90}. Best is trial 284 with value: 0.9236651223187223.[0m
[32m[I 2021-06-01 15:11:15,203][0m Trial 394 finished with value: 0.9138349718771333 and parameters: {'criterion': 'entropy', 'max_depth': 45, 'max_features': 'auto', 'min_samples_leaf': 1, 'min_samples_split': 4, 'n_estimators': 30}. Best is trial 284 with value: 0.9236651223187223.[0m
[32m[I 2021-06-01 15:11:15,725][0m Trial 404 finished with value: 0.9073558962769199 and parameters: {'criterion': 'entropy', 'max_depth': 45, 'max_features': 'auto', 'min_samples_leaf': 7, 'min_samples_split': 4, 'n_estimators': 30}. Best is trial 284 with value: 0.9236651223187223.[0m
[32m[I 2021-06-01 15:11:15,863][0m Trial 402 finished with value: 0.912074097485602 and parameters: {'criterion': 'entropy', 'max_depth': 45, 'max_features': 'auto', 'min_samples_leaf': 1, 'min_samples_split': 3, 'n_estimators': 30}. Best is trial 284 with value: 0.9236651223187223.[0m
[32m[I 2021-06-01 15:11:15,895][0m Trial 405 finished with value: 0.9133814246608946 and parameters: {'criterion': 'entropy', 'max_depth': 45, 'max_features': 'auto', 'min_samples_leaf': 1, 'min_samples_split': 3, 'n_estimators': 35}. Best is trial 284 with value: 0.9236651223187223.[0m
[32m[I 2021-06-01 15:11:15,946][0m Trial 399 finished with value: 0.9159346521348187 and parameters: {'criterion': 'entropy', 'max_depth': 45, 'max_features': 'auto', 'min_samples_leaf': 1, 'min_samples_split': 4, 'n_estimators': 30}. Best is trial 284 with value: 0.9236651223187223.[0m
[32m[I 2021-06-01 15:11:16,044][0m Trial 411 finished with value: 0.9141676629213542 and parameters: {'criterion': 'entropy', 'max_depth': 45, 'max_features': 'auto', 'min_samples_leaf': 1, 'min_samples_split': 4, 'n_estimators': 30}. Best is trial 284 with value: 0.9236651223187223.[0m
[32m[I 2021-06-01 15:11:16,381][0m Trial 397 finished with value: 0.9060887178775479 and parameters: {'criterion': 'entropy', 'max_depth': 45, 'max_features': 'auto', 'min_samples_leaf': 1, 'min_samples_split': 4, 'n_estimators': 95}. Best is trial 284 with value: 0.9236651223187223.[0m
[32m[I 2021-06-01 15:11:16,392][0m Trial 410 finished with value: 0.9132711895252118 and parameters: {'criterion': 'entropy', 'max_depth': 45, 'max_features': 'auto', 'min_samples_leaf': 1, 'min_samples_split': 4, 'n_estimators': 30}. Best is trial 284 with value: 0.9236651223187223.[0m
[32m[I 2021-06-01 15:11:16,411][0m Trial 413 finished with value: 0.9121699973756552 and parameters: {'criterion': 'entropy', 'max_depth': 45, 'max_features': 'auto', 'min_samples_leaf': 1, 'min_samples_split': 3, 'n_estimators': 15}. Best is trial 284 with value: 0.9236651223187223.[0m
[32m[I 2021-06-01 15:11:16,434][0m Trial 408 finished with value: 0.9114692264426175 and parameters: {'criterion': 'entropy', 'max_depth': 45, 'max_features': 'auto', 'min_samples_leaf': 1, 'min_samples_split': 3, 'n_estimators': 30}. Best is trial 284 with value: 0.9236651223187223.[0m
[32m[I 2021-06-01 15:11:16,453][0m Trial 409 finished with value: 0.910280408835006 and parameters: {'criterion': 'entropy', 'max_depth': 45, 'max_features': 'auto', 'min_samples_leaf': 1, 'min_samples_split': 3, 'n_estimators': 35}. Best is trial 284 with value: 0.9236651223187223.[0m
[32m[I 2021-06-01 15:11:16,854][0m Trial 406 finished with value: 0.9162968148457477 and parameters: {'criterion': 'entropy', 'max_depth': 45, 'max_features': 'auto', 'min_samples_leaf': 1, 'min_samples_split': 3, 'n_estimators': 30}. Best is trial 284 with value: 0.9236651223187223.[0m
[32m[I 2021-06-01 15:11:16,853][0m Trial 407 finished with value: 0.9110800794919347 and parameters: {'criterion': 'entropy', 'max_depth': 45, 'max_features': 'auto', 'min_samples_leaf': 1, 'min_samples_split': 4, 'n_estimators': 30}. Best is trial 284 with value: 0.9236651223187223.[0m
[32m[I 2021-06-01 15:11:16,858][0m Trial 412 finished with value: 0.9185892529715993 and parameters: {'criterion': 'entropy', 'max_depth': 45, 'max_features': 'auto', 'min_samples_leaf': 1, 'min_samples_split': 3, 'n_estimators': 15}. Best is trial 284 with value: 0.9236651223187223.[0m
[32m[I 2021-06-01 15:11:17,181][0m Trial 416 finished with value: 0.9144388342738597 and parameters: {'criterion': 'entropy', 'max_depth': 45, 'max_features': 'auto', 'min_samples_leaf': 1, 'min_samples_split': 4, 'n_estimators': 15}. Best is trial 284 with value: 0.9236651223187223.[0m
[32m[I 2021-06-01 15:11:17,395][0m Trial 417 finished with value: 0.9119624420800891 and parameters: {'criterion': 'entropy', 'max_depth': 45, 'max_features': 'auto', 'min_samples_leaf': 1, 'min_samples_split': 4, 'n_estimators': 15}. Best is trial 284 with value: 0.9236651223187223.[0m
[32m[I 2021-06-01 15:11:17,433][0m Trial 419 finished with value: 0.9043547301379083 and parameters: {'criterion': 'entropy', 'max_depth': 5, 'max_features': 'auto', 'min_samples_leaf': 1, 'min_samples_split': 4, 'n_estimators': 15}. Best is trial 284 with value: 0.9236651223187223.[0m
[32m[I 2021-06-01 15:11:17,438][0m Trial 414 finished with value: 0.9019951063429325 and parameters: {'criterion': 'entropy', 'max_depth': 5, 'max_features': 'auto', 'min_samples_leaf': 1, 'min_samples_split': 4, 'n_estimators': 15}. Best is trial 284 with value: 0.9236651223187223.[0m
[32m[I 2021-06-01 15:11:18,278][0m Trial 424 finished with value: 0.9036213062300018 and parameters: {'criterion': 'entropy', 'max_depth': 5, 'max_features': 'auto', 'min_samples_leaf': 1, 'min_samples_split': 3, 'n_estimators': 15}. Best is trial 284 with value: 0.9236651223187223.[0m
[32m[I 2021-06-01 15:11:18,405][0m Trial 415 finished with value: 0.911631316822838 and parameters: {'criterion': 'entropy', 'max_depth': 45, 'max_features': 'auto', 'min_samples_leaf': 1, 'min_samples_split': 3, 'n_estimators': 15}. Best is trial 284 with value: 0.9236651223187223.[0m
[32m[I 2021-06-01 15:11:18,409][0m Trial 425 finished with value: 0.9035510713542749 and parameters: {'criterion': 'entropy', 'max_depth': 5, 'max_features': 'auto', 'min_samples_leaf': 4, 'min_samples_split': 4, 'n_estimators': 15}. Best is trial 284 with value: 0.9236651223187223.[0m
[32m[I 2021-06-01 15:11:18,440][0m Trial 421 finished with value: 0.9037191793713534 and parameters: {'criterion': 'entropy', 'max_depth': 5, 'max_features': 'auto', 'min_samples_leaf': 1, 'min_samples_split': 4, 'n_estimators': 15}. Best is trial 284 with value: 0.9236651223187223.[0m
[32m[I 2021-06-01 15:11:18,511][0m Trial 423 finished with value: 0.9024440240875243 and parameters: {'criterion': 'entropy', 'max_depth': 5, 'max_features': 'auto', 'min_samples_leaf': 1, 'min_samples_split': 4, 'n_estimators': 15}. Best is trial 284 with value: 0.9236651223187223.[0m
[32m[I 2021-06-01 15:11:18,569][0m Trial 418 finished with value: 0.9144907019285744 and parameters: {'criterion': 'entropy', 'max_depth': 30, 'max_features': 'auto', 'min_samples_leaf': 1, 'min_samples_split': 4, 'n_estimators': 15}. Best is trial 284 with value: 0.9236651223187223.[0m
[32m[I 2021-06-01 15:11:18,790][0m Trial 401 finished with value: 0.9105071736902042 and parameters: {'criterion': 'entropy', 'max_depth': 45, 'max_features': 'auto', 'min_samples_leaf': 1, 'min_samples_split': 4, 'n_estimators': 245}. Best is trial 284 with value: 0.9236651223187223.[0m
[32m[I 2021-06-01 15:11:19,247][0m Trial 432 finished with value: 0.9146797001871674 and parameters: {'criterion': 'entropy', 'max_depth': 30, 'max_features': 'auto', 'min_samples_leaf': 1, 'min_samples_split': 2, 'n_estimators': 15}. Best is trial 284 with value: 0.9236651223187223.[0m
[32m[I 2021-06-01 15:11:19,737][0m Trial 430 finished with value: 0.9106917556838636 and parameters: {'criterion': 'entropy', 'max_depth': 30, 'max_features': 'auto', 'min_samples_leaf': 1, 'min_samples_split': 6, 'n_estimators': 15}. Best is trial 284 with value: 0.9236651223187223.[0m
[32m[I 2021-06-01 15:11:19,769][0m Trial 433 finished with value: 0.9113601649237365 and parameters: {'criterion': 'entropy', 'max_depth': 30, 'max_features': 'auto', 'min_samples_leaf': 1, 'min_samples_split': 2, 'n_estimators': 15}. Best is trial 284 with value: 0.9236651223187223.[0m
[32m[I 2021-06-01 15:11:19,769][0m Trial 427 finished with value: 0.904993592589571 and parameters: {'criterion': 'entropy', 'max_depth': 5, 'max_features': 'auto', 'min_samples_leaf': 1, 'min_samples_split': 2, 'n_estimators': 15}. Best is trial 284 with value: 0.9236651223187223.[0m
[32m[I 2021-06-01 15:11:19,773][0m Trial 431 finished with value: 0.9130126370410707 and parameters: {'criterion': 'entropy', 'max_depth': 30, 'max_features': 'auto', 'min_samples_leaf': 1, 'min_samples_split': 2, 'n_estimators': 15}. Best is trial 284 with value: 0.9236651223187223.[0m
[32m[I 2021-06-01 15:11:20,209][0m Trial 422 finished with value: 0.9149348851758035 and parameters: {'criterion': 'entropy', 'max_depth': 30, 'max_features': 'auto', 'min_samples_leaf': 1, 'min_samples_split': 2, 'n_estimators': 15}. Best is trial 284 with value: 0.9236651223187223.[0m
[32m[I 2021-06-01 15:11:20,214][0m Trial 426 finished with value: 0.9085212716044999 and parameters: {'criterion': 'entropy', 'max_depth': 30, 'max_features': 'auto', 'min_samples_leaf': 1, 'min_samples_split': 9, 'n_estimators': 15}. Best is trial 284 with value: 0.9236651223187223.[0m
[32m[I 2021-06-01 15:11:20,225][0m Trial 428 finished with value: 0.9034723201846202 and parameters: {'criterion': 'entropy', 'max_depth': 5, 'max_features': 'auto', 'min_samples_leaf': 1, 'min_samples_split': 3, 'n_estimators': 15}. Best is trial 284 with value: 0.9236651223187223.[0m
[32m[I 2021-06-01 15:11:20,229][0m Trial 434 finished with value: 0.9133616770027622 and parameters: {'criterion': 'entropy', 'max_depth': 30, 'max_features': 'auto', 'min_samples_leaf': 1, 'min_samples_split': 6, 'n_estimators': 15}. Best is trial 284 with value: 0.9236651223187223.[0m
[32m[I 2021-06-01 15:11:20,894][0m Trial 437 finished with value: 0.9102813720687261 and parameters: {'criterion': 'entropy', 'max_depth': 30, 'max_features': 'auto', 'min_samples_leaf': 1, 'min_samples_split': 2, 'n_estimators': 20}. Best is trial 284 with value: 0.9236651223187223.[0m
[32m[I 2021-06-01 15:11:20,922][0m Trial 420 finished with value: 0.9021645021645022 and parameters: {'criterion': 'entropy', 'max_depth': 5, 'max_features': 'auto', 'min_samples_leaf': 4, 'min_samples_split': 2, 'n_estimators': 140}. Best is trial 284 with value: 0.9236651223187223.[0m
[32m[I 2021-06-01 15:11:20,932][0m Trial 438 finished with value: 0.9126890334467428 and parameters: {'criterion': 'entropy', 'max_depth': 30, 'max_features': 'auto', 'min_samples_leaf': 1, 'min_samples_split': 2, 'n_estimators': 20}. Best is trial 284 with value: 0.9236651223187223.[0m
[32m[I 2021-06-01 15:11:20,936][0m Trial 436 finished with value: 0.9114982175737266 and parameters: {'criterion': 'entropy', 'max_depth': 30, 'max_features': 'auto', 'min_samples_leaf': 2, 'min_samples_split': 2, 'n_estimators': 15}. Best is trial 284 with value: 0.9236651223187223.[0m
[32m[I 2021-06-01 15:11:21,067][0m Trial 441 finished with value: 0.9159131518193112 and parameters: {'criterion': 'entropy', 'max_depth': 30, 'max_features': 'auto', 'min_samples_leaf': 1, 'min_samples_split': 2, 'n_estimators': 20}. Best is trial 284 with value: 0.9236651223187223.[0m
[32m[I 2021-06-01 15:11:21,708][0m Trial 446 finished with value: 0.9115841837643964 and parameters: {'criterion': 'entropy', 'max_depth': 30, 'max_features': 'auto', 'min_samples_leaf': 2, 'min_samples_split': 5, 'n_estimators': 20}. Best is trial 284 with value: 0.9236651223187223.[0m
[32m[I 2021-06-01 15:11:21,713][0m Trial 444 finished with value: 0.9092574073760167 and parameters: {'criterion': 'entropy', 'max_depth': 30, 'max_features': 'auto', 'min_samples_leaf': 2, 'min_samples_split': 5, 'n_estimators': 20}. Best is trial 284 with value: 0.9236651223187223.[0m
[32m[I 2021-06-01 15:11:21,715][0m Trial 435 finished with value: 0.910069064712774 and parameters: {'criterion': 'entropy', 'max_depth': 30, 'max_features': 'auto', 'min_samples_leaf': 2, 'min_samples_split': 8, 'n_estimators': 15}. Best is trial 284 with value: 0.9236651223187223.[0m
[32m[I 2021-06-01 15:11:21,828][0m Trial 439 finished with value: 0.9093004753701898 and parameters: {'criterion': 'entropy', 'max_depth': 30, 'max_features': 'auto', 'min_samples_leaf': 1, 'min_samples_split': 5, 'n_estimators': 135}. Best is trial 284 with value: 0.9236651223187223.[0m
[32m[I 2021-06-01 15:11:22,016][0m Trial 442 finished with value: 0.9149562153191338 and parameters: {'criterion': 'entropy', 'max_depth': 30, 'max_features': 'auto', 'min_samples_leaf': 1, 'min_samples_split': 5, 'n_estimators': 20}. Best is trial 284 with value: 0.9236651223187223.[0m
[32m[I 2021-06-01 15:11:22,033][0m Trial 443 finished with value: 0.9064855706268544 and parameters: {'criterion': 'entropy', 'max_depth': 30, 'max_features': 'auto', 'min_samples_leaf': 2, 'min_samples_split': 9, 'n_estimators': 20}. Best is trial 284 with value: 0.9236651223187223.[0m
[32m[I 2021-06-01 15:11:22,529][0m Trial 429 finished with value: 0.9128140495051461 and parameters: {'criterion': 'entropy', 'max_depth': 30, 'max_features': 'auto', 'min_samples_leaf': 2, 'min_samples_split': 5, 'n_estimators': 15}. Best is trial 284 with value: 0.9236651223187223.[0m
[32m[I 2021-06-01 15:11:22,678][0m Trial 448 finished with value: 0.9126429554019351 and parameters: {'criterion': 'entropy', 'max_depth': 25, 'max_features': 'auto', 'min_samples_leaf': 2, 'min_samples_split': 5, 'n_estimators': 20}. Best is trial 284 with value: 0.9236651223187223.[0m
[32m[I 2021-06-01 15:11:23,041][0m Trial 453 finished with value: 0.9102522759029512 and parameters: {'criterion': 'entropy', 'max_depth': 25, 'max_features': 'auto', 'min_samples_leaf': 1, 'min_samples_split': 5, 'n_estimators': 20}. Best is trial 284 with value: 0.9236651223187223.[0m
[32m[I 2021-06-01 15:11:23,042][0m Trial 440 finished with value: 0.9093891761901721 and parameters: {'criterion': 'entropy', 'max_depth': 30, 'max_features': 'auto', 'min_samples_leaf': 2, 'min_samples_split': 2, 'n_estimators': 135}. Best is trial 284 with value: 0.9236651223187223.[0m
[32m[I 2021-06-01 15:11:23,043][0m Trial 447 finished with value: 0.9100481818769947 and parameters: {'criterion': 'entropy', 'max_depth': 30, 'max_features': 'auto', 'min_samples_leaf': 2, 'min_samples_split': 5, 'n_estimators': 20}. Best is trial 284 with value: 0.9236651223187223.[0m
[32m[I 2021-06-01 15:11:23,044][0m Trial 450 finished with value: 0.9124883562449935 and parameters: {'criterion': 'entropy', 'max_depth': 25, 'max_features': 'auto', 'min_samples_leaf': 1, 'min_samples_split': 5, 'n_estimators': 20}. Best is trial 284 with value: 0.9236651223187223.[0m
[32m[I 2021-06-01 15:11:23,263][0m Trial 454 finished with value: 0.9095581549718863 and parameters: {'criterion': 'entropy', 'max_depth': 40, 'max_features': 'auto', 'min_samples_leaf': 1, 'min_samples_split': 5, 'n_estimators': 20}. Best is trial 284 with value: 0.9236651223187223.[0m
[32m[I 2021-06-01 15:11:23,419][0m Trial 445 finished with value: 0.9156150692532119 and parameters: {'criterion': 'entropy', 'max_depth': 25, 'max_features': 'auto', 'min_samples_leaf': 2, 'min_samples_split': 5, 'n_estimators': 20}. Best is trial 284 with value: 0.9236651223187223.[0m
[32m[I 2021-06-01 15:11:23,504][0m Trial 456 finished with value: 0.9097245905910352 and parameters: {'criterion': 'entropy', 'max_depth': 25, 'max_features': 'auto', 'min_samples_leaf': 1, 'min_samples_split': 5, 'n_estimators': 20}. Best is trial 284 with value: 0.9236651223187223.[0m
[32m[I 2021-06-01 15:11:23,588][0m Trial 452 finished with value: 0.9133477247896786 and parameters: {'criterion': 'entropy', 'max_depth': 25, 'max_features': 'auto', 'min_samples_leaf': 1, 'min_samples_split': 5, 'n_estimators': 20}. Best is trial 284 with value: 0.9236651223187223.[0m
[32m[I 2021-06-01 15:11:23,687][0m Trial 455 finished with value: 0.9095742839005059 and parameters: {'criterion': 'entropy', 'max_depth': 35, 'max_features': 'auto', 'min_samples_leaf': 1, 'min_samples_split': 5, 'n_estimators': 20}. Best is trial 284 with value: 0.9236651223187223.[0m
[32m[I 2021-06-01 15:11:23,992][0m Trial 457 finished with value: 0.9131118911172125 and parameters: {'criterion': 'entropy', 'max_depth': 35, 'max_features': 'auto', 'min_samples_leaf': 1, 'min_samples_split': 5, 'n_estimators': 25}. Best is trial 284 with value: 0.9236651223187223.[0m
