[32m[I 2021-06-01 15:11:36,129][0m Trial 535 finished with value: 0.9165565830326441 and parameters: {'criterion': 'entropy', 'max_depth': 40, 'max_features': 'auto', 'min_samples_leaf': 1, 'min_samples_split': 4, 'n_estimators': 15}. Best is trial 284 with value: 0.9236651223187223.[0m
[32m[I 2021-06-01 15:11:36,131][0m Trial 529 finished with value: 0.9127529076487667 and parameters: {'criterion': 'entropy', 'max_depth': 40, 'max_features': 'auto', 'min_samples_leaf': 1, 'min_samples_split': 4, 'n_estimators': 15}. Best is trial 284 with value: 0.9236651223187223.[0m
[32m[I 2021-06-01 15:11:36,132][0m Trial 531 finished with value: 0.9145132030526767 and parameters: {'criterion': 'entropy', 'max_depth': 40, 'max_features': 'auto', 'min_samples_leaf': 1, 'min_samples_split': 4, 'n_estimators': 15}. Best is trial 284 with value: 0.9236651223187223.[0m
[32m[I 2021-06-01 15:11:36,134][0m Trial 532 finished with value: 0.912555980380243 and parameters: {'criterion': 'entropy', 'max_depth': 40, 'max_features': 'auto', 'min_samples_leaf': 1, 'min_samples_split': 4, 'n_estimators': 15}. Best is trial 284 with value: 0.9236651223187223.[0m
[32m[I 2021-06-01 15:11:36,150][0m Trial 527 finished with value: 0.9144138822092239 and parameters: {'criterion': 'entropy', 'max_depth': 40, 'max_features': 'auto', 'min_samples_leaf': 1, 'min_samples_split': 4, 'n_estimators': 15}. Best is trial 284 with value: 0.9236651223187223.[0m
[32m[I 2021-06-01 15:11:36,662][0m Trial 537 finished with value: 0.9173496187380612 and parameters: {'criterion': 'entropy', 'max_depth': 40, 'max_features': 'auto', 'min_samples_leaf': 1, 'min_samples_split': 4, 'n_estimators': 15}. Best is trial 284 with value: 0.9236651223187223.[0m
[32m[I 2021-06-01 15:11:37,057][0m Trial 539 finished with value: 0.9111189961771355 and parameters: {'criterion': 'entropy', 'max_depth': 40, 'max_features': 'auto', 'min_samples_leaf': 2, 'min_samples_split': 4, 'n_estimators': 15}. Best is trial 284 with value: 0.9236651223187223.[0m
[32m[I 2021-06-01 15:11:37,098][0m Trial 540 finished with value: 0.91455023443886 and parameters: {'criterion': 'entropy', 'max_depth': 40, 'max_features': 'auto', 'min_samples_leaf': 1, 'min_samples_split': 4, 'n_estimators': 15}. Best is trial 284 with value: 0.9236651223187223.[0m
[32m[I 2021-06-01 15:11:37,103][0m Trial 538 finished with value: 0.9158075226692992 and parameters: {'criterion': 'entropy', 'max_depth': 40, 'max_features': 'auto', 'min_samples_leaf': 2, 'min_samples_split': 4, 'n_estimators': 15}. Best is trial 284 with value: 0.9236651223187223.[0m
[32m[I 2021-06-01 15:11:37,412][0m Trial 542 finished with value: 0.9110432053883176 and parameters: {'criterion': 'entropy', 'max_depth': 40, 'max_features': 'auto', 'min_samples_leaf': 5, 'min_samples_split': 4, 'n_estimators': 15}. Best is trial 284 with value: 0.9236651223187223.[0m
[32m[I 2021-06-01 15:11:37,416][0m Trial 543 finished with value: 0.9147452038959566 and parameters: {'criterion': 'entropy', 'max_depth': 40, 'max_features': 'auto', 'min_samples_leaf': 2, 'min_samples_split': 4, 'n_estimators': 15}. Best is trial 284 with value: 0.9236651223187223.[0m
[32m[I 2021-06-01 15:11:37,418][0m Trial 534 finished with value: 0.9074378283671332 and parameters: {'criterion': 'entropy', 'max_depth': 40, 'max_features': 'auto', 'min_samples_leaf': 1, 'min_samples_split': 4, 'n_estimators': 70}. Best is trial 284 with value: 0.9236651223187223.[0m
[32m[I 2021-06-01 15:11:37,640][0m Trial 544 finished with value: 0.9177575953458307 and parameters: {'criterion': 'entropy', 'max_depth': 40, 'max_features': 'auto', 'min_samples_leaf': 2, 'min_samples_split': 4, 'n_estimators': 15}. Best is trial 284 with value: 0.9236651223187223.[0m
[32m[I 2021-06-01 15:11:37,647][0m Trial 541 finished with value: 0.9172112232736083 and parameters: {'criterion': 'entropy', 'max_depth': 40, 'max_features': 'auto', 'min_samples_leaf': 2, 'min_samples_split': 4, 'n_estimators': 15}. Best is trial 284 with value: 0.9236651223187223.[0m
[32m[I 2021-06-01 15:11:38,153][0m Trial 545 finished with value: 0.9104686182712992 and parameters: {'criterion': 'entropy', 'max_depth': 40, 'max_features': 'auto', 'min_samples_leaf': 2, 'min_samples_split': 4, 'n_estimators': 15}. Best is trial 284 with value: 0.9236651223187223.[0m
[32m[I 2021-06-01 15:11:38,215][0m Trial 546 finished with value: 0.9046990611246299 and parameters: {'criterion': 'entropy', 'max_depth': 40, 'max_features': 'auto', 'min_samples_leaf': 8, 'min_samples_split': 4, 'n_estimators': 15}. Best is trial 284 with value: 0.9236651223187223.[0m
[32m[I 2021-06-01 15:11:38,231][0m Trial 547 finished with value: 0.9089863754319099 and parameters: {'criterion': 'entropy', 'max_depth': 40, 'max_features': 'auto', 'min_samples_leaf': 1, 'min_samples_split': 4, 'n_estimators': 15}. Best is trial 284 with value: 0.9236651223187223.[0m
[32m[I 2021-06-01 15:11:38,290][0m Trial 548 finished with value: 0.9124388740765623 and parameters: {'criterion': 'entropy', 'max_depth': 40, 'max_features': 'auto', 'min_samples_leaf': 1, 'min_samples_split': 4, 'n_estimators': 15}. Best is trial 284 with value: 0.9236651223187223.[0m
[32m[I 2021-06-01 15:11:38,535][0m Trial 550 finished with value: 0.9119345402099974 and parameters: {'criterion': 'gini', 'max_depth': 40, 'max_features': 'auto', 'min_samples_leaf': 1, 'min_samples_split': 4, 'n_estimators': 15}. Best is trial 284 with value: 0.9236651223187223.[0m
[32m[I 2021-06-01 15:11:38,545][0m Trial 549 finished with value: 0.9113352038319 and parameters: {'criterion': 'entropy', 'max_depth': 40, 'max_features': 'auto', 'min_samples_leaf': 1, 'min_samples_split': 4, 'n_estimators': 15}. Best is trial 284 with value: 0.9236651223187223.[0m
[32m[I 2021-06-01 15:11:38,653][0m Trial 553 finished with value: 0.9161595946609552 and parameters: {'criterion': 'gini', 'max_depth': 40, 'max_features': 'auto', 'min_samples_leaf': 1, 'min_samples_split': 4, 'n_estimators': 15}. Best is trial 284 with value: 0.9236651223187223.[0m
[32m[I 2021-06-01 15:11:38,655][0m Trial 552 finished with value: 0.9101416326165431 and parameters: {'criterion': 'gini', 'max_depth': 40, 'max_features': 'auto', 'min_samples_leaf': 1, 'min_samples_split': 4, 'n_estimators': 15}. Best is trial 284 with value: 0.9236651223187223.[0m
[32m[I 2021-06-01 15:11:39,139][0m Trial 554 finished with value: 0.9151615168832479 and parameters: {'criterion': 'gini', 'max_depth': 25, 'max_features': 'auto', 'min_samples_leaf': 1, 'min_samples_split': 4, 'n_estimators': 10}. Best is trial 284 with value: 0.9236651223187223.[0m
[32m[I 2021-06-01 15:11:39,294][0m Trial 555 finished with value: 0.9139743204424027 and parameters: {'criterion': 'gini', 'max_depth': 25, 'max_features': 'auto', 'min_samples_leaf': 1, 'min_samples_split': 4, 'n_estimators': 10}. Best is trial 284 with value: 0.9236651223187223.[0m
[32m[I 2021-06-01 15:11:39,683][0m Trial 556 finished with value: 0.9134175232880277 and parameters: {'criterion': 'gini', 'max_depth': 45, 'max_features': 'auto', 'min_samples_leaf': 1, 'min_samples_split': 4, 'n_estimators': 10}. Best is trial 284 with value: 0.9236651223187223.[0m
[32m[I 2021-06-01 15:11:40,118][0m Trial 557 finished with value: 0.918902686739896 and parameters: {'criterion': 'gini', 'max_depth': 25, 'max_features': 'auto', 'min_samples_leaf': 1, 'min_samples_split': 4, 'n_estimators': 10}. Best is trial 284 with value: 0.9236651223187223.[0m
[32m[I 2021-06-01 15:11:40,405][0m Trial 558 finished with value: 0.9102639993080043 and parameters: {'criterion': 'gini', 'max_depth': 45, 'max_features': 'auto', 'min_samples_leaf': 1, 'min_samples_split': 4, 'n_estimators': 10}. Best is trial 284 with value: 0.9236651223187223.[0m
[32m[I 2021-06-01 15:11:40,991][0m Trial 559 finished with value: 0.9144977666329976 and parameters: {'criterion': 'entropy', 'max_depth': 45, 'max_features': 'auto', 'min_samples_leaf': 1, 'min_samples_split': 4, 'n_estimators': 10}. Best is trial 284 with value: 0.9236651223187223.[0m
[32m[I 2021-06-01 15:11:42,780][0m Trial 551 finished with value: 0.9110889383680403 and parameters: {'criterion': 'gini', 'max_depth': 40, 'max_features': 'auto', 'min_samples_leaf': 1, 'min_samples_split': 4, 'n_estimators': 300}. Best is trial 284 with value: 0.9236651223187223.[0m
