[32m[I 2021-06-01 15:11:24,061][0m Trial 449 finished with value: 0.9141402818717982 and parameters: {'criterion': 'entropy', 'max_depth': 25, 'max_features': 'auto', 'min_samples_leaf': 1, 'min_samples_split': 5, 'n_estimators': 20}. Best is trial 284 with value: 0.9236651223187223.[0m
[32m[I 2021-06-01 15:11:24,468][0m Trial 451 finished with value: 0.9152386371299164 and parameters: {'criterion': 'entropy', 'max_depth': 35, 'max_features': 'auto', 'min_samples_leaf': 1, 'min_samples_split': 5, 'n_estimators': 20}. Best is trial 284 with value: 0.9236651223187223.[0m
[32m[I 2021-06-01 15:11:24,573][0m Trial 464 finished with value: 0.9117458714268599 and parameters: {'criterion': 'entropy', 'max_depth': 35, 'max_features': 'auto', 'min_samples_leaf': 1, 'min_samples_split': 5, 'n_estimators': 10}. Best is trial 284 with value: 0.9236651223187223.[0m
[32m[I 2021-06-01 15:11:24,575][0m Trial 460 finished with value: 0.9140838693748131 and parameters: {'criterion': 'entropy', 'max_depth': 25, 'max_features': 'auto', 'min_samples_leaf': 1, 'min_samples_split': 5, 'n_estimators': 25}. Best is trial 284 with value: 0.9236651223187223.[0m
[32m[I 2021-06-01 15:11:24,602][0m Trial 458 finished with value: 0.9182032569662824 and parameters: {'criterion': 'entropy', 'max_depth': 25, 'max_features': 'auto', 'min_samples_leaf': 1, 'min_samples_split': 5, 'n_estimators': 25}. Best is trial 284 with value: 0.9236651223187223.[0m
[32m[I 2021-06-01 15:11:25,010][0m Trial 469 finished with value: 0.9149963621744801 and parameters: {'criterion': 'entropy', 'max_depth': 35, 'max_features': 'auto', 'min_samples_leaf': 1, 'min_samples_split': 4, 'n_estimators': 10}. Best is trial 284 with value: 0.9236651223187223.[0m
[32m[I 2021-06-01 15:11:25,010][0m Trial 462 finished with value: 0.9115501978496466 and parameters: {'criterion': 'entropy', 'max_depth': 45, 'max_features': 'auto', 'min_samples_leaf': 1, 'min_samples_split': 5, 'n_estimators': 10}. Best is trial 284 with value: 0.9236651223187223.[0m
[32m[I 2021-06-01 15:11:25,123][0m Trial 461 finished with value: 0.9109924517608265 and parameters: {'criterion': 'entropy', 'max_depth': 45, 'max_features': 'auto', 'min_samples_leaf': 1, 'min_samples_split': 5, 'n_estimators': 25}. Best is trial 284 with value: 0.9236651223187223.[0m
[32m[I 2021-06-01 15:11:25,168][0m Trial 459 finished with value: 0.9117951045133947 and parameters: {'criterion': 'entropy', 'max_depth': 45, 'max_features': 'auto', 'min_samples_leaf': 1, 'min_samples_split': 5, 'n_estimators': 25}. Best is trial 284 with value: 0.9236651223187223.[0m
[32m[I 2021-06-01 15:11:26,034][0m Trial 471 finished with value: 0.9124311840875718 and parameters: {'criterion': 'entropy', 'max_depth': 35, 'max_features': 'auto', 'min_samples_leaf': 1, 'min_samples_split': 4, 'n_estimators': 10}. Best is trial 284 with value: 0.9236651223187223.[0m
[32m[I 2021-06-01 15:11:26,094][0m Trial 466 finished with value: 0.9143140025126926 and parameters: {'criterion': 'entropy', 'max_depth': 40, 'max_features': 'auto', 'min_samples_leaf': 1, 'min_samples_split': 5, 'n_estimators': 10}. Best is trial 284 with value: 0.9236651223187223.[0m
[32m[I 2021-06-01 15:11:26,132][0m Trial 473 finished with value: 0.9140654650279103 and parameters: {'criterion': 'gini', 'max_depth': 45, 'max_features': 'auto', 'min_samples_leaf': 1, 'min_samples_split': 4, 'n_estimators': 10}. Best is trial 284 with value: 0.9236651223187223.[0m
[32m[I 2021-06-01 15:11:26,157][0m Trial 476 finished with value: 0.9108532968401963 and parameters: {'criterion': 'gini', 'max_depth': 45, 'max_features': 'auto', 'min_samples_leaf': 1, 'min_samples_split': 4, 'n_estimators': 10}. Best is trial 284 with value: 0.9236651223187223.[0m
[32m[I 2021-06-01 15:11:26,158][0m Trial 470 finished with value: 0.917009922285575 and parameters: {'criterion': 'gini', 'max_depth': 45, 'max_features': 'auto', 'min_samples_leaf': 1, 'min_samples_split': 4, 'n_estimators': 10}. Best is trial 284 with value: 0.9236651223187223.[0m
[32m[I 2021-06-01 15:11:26,166][0m Trial 463 finished with value: 0.9149739186669981 and parameters: {'criterion': 'entropy', 'max_depth': 45, 'max_features': 'auto', 'min_samples_leaf': 1, 'min_samples_split': 6, 'n_estimators': 10}. Best is trial 284 with value: 0.9236651223187223.[0m
[32m[I 2021-06-01 15:11:26,176][0m Trial 468 finished with value: 0.9193383964781556 and parameters: {'criterion': 'entropy', 'max_depth': 40, 'max_features': 'auto', 'min_samples_leaf': 1, 'min_samples_split': 4, 'n_estimators': 10}. Best is trial 284 with value: 0.9236651223187223.[0m
[32m[I 2021-06-01 15:11:26,746][0m Trial 467 finished with value: 0.9181153233124799 and parameters: {'criterion': 'gini', 'max_depth': 45, 'max_features': 'auto', 'min_samples_leaf': 1, 'min_samples_split': 4, 'n_estimators': 10}. Best is trial 284 with value: 0.9236651223187223.[0m
[32m[I 2021-06-01 15:11:26,865][0m Trial 474 finished with value: 0.9135873753177242 and parameters: {'criterion': 'gini', 'max_depth': 45, 'max_features': 'auto', 'min_samples_leaf': 1, 'min_samples_split': 6, 'n_estimators': 10}. Best is trial 284 with value: 0.9236651223187223.[0m
[32m[I 2021-06-01 15:11:26,892][0m Trial 475 finished with value: 0.9109499784430863 and parameters: {'criterion': 'gini', 'max_depth': 45, 'max_features': 'auto', 'min_samples_leaf': 1, 'min_samples_split': 6, 'n_estimators': 10}. Best is trial 284 with value: 0.9236651223187223.[0m
[32m[I 2021-06-01 15:11:27,499][0m Trial 477 finished with value: 0.9145160457890327 and parameters: {'criterion': 'entropy', 'max_depth': 45, 'max_features': 'auto', 'min_samples_leaf': 1, 'min_samples_split': 6, 'n_estimators': 10}. Best is trial 284 with value: 0.9236651223187223.[0m
[32m[I 2021-06-01 15:11:27,621][0m Trial 481 finished with value: 0.9179752187482111 and parameters: {'criterion': 'entropy', 'max_depth': 45, 'max_features': 'auto', 'min_samples_leaf': 1, 'min_samples_split': 6, 'n_estimators': 10}. Best is trial 284 with value: 0.9236651223187223.[0m
[32m[I 2021-06-01 15:11:27,866][0m Trial 472 finished with value: 0.9157304317304318 and parameters: {'criterion': 'gini', 'max_depth': 45, 'max_features': 'auto', 'min_samples_leaf': 1, 'min_samples_split': 6, 'n_estimators': 10}. Best is trial 284 with value: 0.9236651223187223.[0m
[32m[I 2021-06-01 15:11:27,881][0m Trial 479 finished with value: 0.9156564882705958 and parameters: {'criterion': 'entropy', 'max_depth': 45, 'max_features': 'auto', 'min_samples_leaf': 1, 'min_samples_split': 6, 'n_estimators': 10}. Best is trial 284 with value: 0.9236651223187223.[0m
[32m[I 2021-06-01 15:11:27,966][0m Trial 480 finished with value: 0.9129350190245098 and parameters: {'criterion': 'entropy', 'max_depth': 45, 'max_features': 'auto', 'min_samples_leaf': 3, 'min_samples_split': 6, 'n_estimators': 10}. Best is trial 284 with value: 0.9236651223187223.[0m
[32m[I 2021-06-01 15:11:27,966][0m Trial 482 finished with value: 0.9148033191997081 and parameters: {'criterion': 'entropy', 'max_depth': 45, 'max_features': 'auto', 'min_samples_leaf': 1, 'min_samples_split': 3, 'n_estimators': 10}. Best is trial 284 with value: 0.9236651223187223.[0m
[32m[I 2021-06-01 15:11:28,254][0m Trial 486 finished with value: 0.9158424616723231 and parameters: {'criterion': 'entropy', 'max_depth': 25, 'max_features': 'auto', 'min_samples_leaf': 1, 'min_samples_split': 4, 'n_estimators': 10}. Best is trial 284 with value: 0.9236651223187223.[0m
[32m[I 2021-06-01 15:11:28,668][0m Trial 483 finished with value: 0.9122012663148744 and parameters: {'criterion': 'entropy', 'max_depth': 45, 'max_features': 'auto', 'min_samples_leaf': 1, 'min_samples_split': 6, 'n_estimators': 10}. Best is trial 284 with value: 0.9236651223187223.[0m
[32m[I 2021-06-01 15:11:28,748][0m Trial 478 finished with value: 0.9169937794937795 and parameters: {'criterion': 'gini', 'max_depth': 45, 'max_features': 'auto', 'min_samples_leaf': 1, 'min_samples_split': 6, 'n_estimators': 10}. Best is trial 284 with value: 0.9236651223187223.[0m
[32m[I 2021-06-01 15:11:28,748][0m Trial 485 finished with value: 0.9148850043761548 and parameters: {'criterion': 'entropy', 'max_depth': 25, 'max_features': 'auto', 'min_samples_leaf': 1, 'min_samples_split': 6, 'n_estimators': 10}. Best is trial 284 with value: 0.9236651223187223.[0m
[32m[I 2021-06-01 15:11:28,761][0m Trial 487 finished with value: 0.9216887378652086 and parameters: {'criterion': 'entropy', 'max_depth': 40, 'max_features': 'auto', 'min_samples_leaf': 1, 'min_samples_split': 4, 'n_estimators': 10}. Best is trial 284 with value: 0.9236651223187223.[0m
[32m[I 2021-06-01 15:11:28,764][0m Trial 484 finished with value: 0.9126885282043821 and parameters: {'criterion': 'entropy', 'max_depth': 45, 'max_features': 'auto', 'min_samples_leaf': 3, 'min_samples_split': 6, 'n_estimators': 10}. Best is trial 284 with value: 0.9236651223187223.[0m
[32m[I 2021-06-01 15:11:28,776][0m Trial 490 finished with value: 0.9185949107353217 and parameters: {'criterion': 'entropy', 'max_depth': 45, 'max_features': 'auto', 'min_samples_leaf': 1, 'min_samples_split': 4, 'n_estimators': 10}. Best is trial 284 with value: 0.9236651223187223.[0m
[32m[I 2021-06-01 15:11:28,892][0m Trial 465 finished with value: 0.9199959124668151 and parameters: {'criterion': 'entropy', 'max_depth': 40, 'max_features': 'auto', 'min_samples_leaf': 1, 'min_samples_split': 4, 'n_estimators': 10}. Best is trial 284 with value: 0.9236651223187223.[0m
[32m[I 2021-06-01 15:11:29,378][0m Trial 488 finished with value: 0.9181307397068806 and parameters: {'criterion': 'entropy', 'max_depth': 40, 'max_features': 'auto', 'min_samples_leaf': 1, 'min_samples_split': 4, 'n_estimators': 10}. Best is trial 284 with value: 0.9236651223187223.[0m
[32m[I 2021-06-01 15:11:29,395][0m Trial 492 finished with value: 0.9141463313259168 and parameters: {'criterion': 'gini', 'max_depth': 40, 'max_features': 'auto', 'min_samples_leaf': 1, 'min_samples_split': 4, 'n_estimators': 10}. Best is trial 284 with value: 0.9236651223187223.[0m
[32m[I 2021-06-01 15:11:29,571][0m Trial 497 finished with value: 0.9161466466911673 and parameters: {'criterion': 'gini', 'max_depth': 10, 'max_features': 'auto', 'min_samples_leaf': 1, 'min_samples_split': 4, 'n_estimators': 10}. Best is trial 284 with value: 0.9236651223187223.[0m
[32m[I 2021-06-01 15:11:30,000][0m Trial 498 finished with value: 0.9151456858417213 and parameters: {'criterion': 'gini', 'max_depth': 10, 'max_features': 'auto', 'min_samples_leaf': 1, 'min_samples_split': 4, 'n_estimators': 10}. Best is trial 284 with value: 0.9236651223187223.[0m
[32m[I 2021-06-01 15:11:30,527][0m Trial 499 finished with value: 0.9114154807343662 and parameters: {'criterion': 'gini', 'max_depth': 40, 'max_features': 'auto', 'min_samples_leaf': 1, 'min_samples_split': 4, 'n_estimators': 10}. Best is trial 284 with value: 0.9236651223187223.[0m
[32m[I 2021-06-01 15:11:30,553][0m Trial 496 finished with value: 0.9149933758204458 and parameters: {'criterion': 'gini', 'max_depth': 40, 'max_features': 'auto', 'min_samples_leaf': 1, 'min_samples_split': 4, 'n_estimators': 10}. Best is trial 284 with value: 0.9236651223187223.[0m
[32m[I 2021-06-01 15:11:30,559][0m Trial 494 finished with value: 0.9089906838588293 and parameters: {'criterion': 'gini', 'max_depth': 45, 'max_features': 'auto', 'min_samples_leaf': 1, 'min_samples_split': 4, 'n_estimators': 10}. Best is trial 284 with value: 0.9236651223187223.[0m
[32m[I 2021-06-01 15:11:30,672][0m Trial 493 finished with value: 0.9206056137337363 and parameters: {'criterion': 'gini', 'max_depth': 40, 'max_features': 'auto', 'min_samples_leaf': 1, 'min_samples_split': 4, 'n_estimators': 10}. Best is trial 284 with value: 0.9236651223187223.[0m
[32m[I 2021-06-01 15:11:30,711][0m Trial 491 finished with value: 0.9133824415118837 and parameters: {'criterion': 'gini', 'max_depth': 10, 'max_features': 'auto', 'min_samples_leaf': 1, 'min_samples_split': 4, 'n_estimators': 10}. Best is trial 284 with value: 0.9236651223187223.[0m
[32m[I 2021-06-01 15:11:30,734][0m Trial 502 finished with value: 0.9131200647208566 and parameters: {'criterion': 'gini', 'max_depth': 40, 'max_features': 'auto', 'min_samples_leaf': 1, 'min_samples_split': 4, 'n_estimators': 10}. Best is trial 284 with value: 0.9236651223187223.[0m
[32m[I 2021-06-01 15:11:31,291][0m Trial 504 finished with value: 0.9124344756970661 and parameters: {'criterion': 'gini', 'max_depth': 40, 'max_features': 'auto', 'min_samples_leaf': 1, 'min_samples_split': 4, 'n_estimators': 10}. Best is trial 284 with value: 0.9236651223187223.[0m
[32m[I 2021-06-01 15:11:31,294][0m Trial 503 finished with value: 0.9100494993187562 and parameters: {'criterion': 'gini', 'max_depth': 45, 'max_features': 'auto', 'min_samples_leaf': 1, 'min_samples_split': 4, 'n_estimators': 25}. Best is trial 284 with value: 0.9236651223187223.[0m
[32m[I 2021-06-01 15:11:31,379][0m Trial 489 finished with value: 0.908702724788682 and parameters: {'criterion': 'entropy', 'max_depth': 10, 'max_features': 'auto', 'min_samples_leaf': 6, 'min_samples_split': 4, 'n_estimators': 10}. Best is trial 284 with value: 0.9236651223187223.[0m
[32m[I 2021-06-01 15:11:32,050][0m Trial 507 finished with value: 0.9097783175158147 and parameters: {'criterion': 'entropy', 'max_depth': 40, 'max_features': 'log2', 'min_samples_leaf': 1, 'min_samples_split': 4, 'n_estimators': 25}. Best is trial 284 with value: 0.9236651223187223.[0m
[32m[I 2021-06-01 15:11:32,086][0m Trial 505 finished with value: 0.9125071091333826 and parameters: {'criterion': 'entropy', 'max_depth': 40, 'max_features': 'auto', 'min_samples_leaf': 1, 'min_samples_split': 4, 'n_estimators': 25}. Best is trial 284 with value: 0.9236651223187223.[0m
[32m[I 2021-06-01 15:11:32,103][0m Trial 506 finished with value: 0.9041359353126763 and parameters: {'criterion': 'entropy', 'max_depth': 40, 'max_features': 'log2', 'min_samples_leaf': 6, 'min_samples_split': 4, 'n_estimators': 25}. Best is trial 284 with value: 0.9236651223187223.[0m
[32m[I 2021-06-01 15:11:32,106][0m Trial 510 finished with value: 0.9140844955776748 and parameters: {'criterion': 'entropy', 'max_depth': 40, 'max_features': 'log2', 'min_samples_leaf': 1, 'min_samples_split': 4, 'n_estimators': 25}. Best is trial 284 with value: 0.9236651223187223.[0m
[32m[I 2021-06-01 15:11:32,385][0m Trial 508 finished with value: 0.910629100042683 and parameters: {'criterion': 'entropy', 'max_depth': 40, 'max_features': 'auto', 'min_samples_leaf': 1, 'min_samples_split': 4, 'n_estimators': 25}. Best is trial 284 with value: 0.9236651223187223.[0m
[32m[I 2021-06-01 15:11:32,612][0m Trial 513 finished with value: 0.9101286549707602 and parameters: {'criterion': 'entropy', 'max_depth': 40, 'max_features': 'log2', 'min_samples_leaf': 1, 'min_samples_split': 4, 'n_estimators': 25}. Best is trial 284 with value: 0.9236651223187223.[0m
[32m[I 2021-06-01 15:11:32,665][0m Trial 515 finished with value: 0.9126524460932066 and parameters: {'criterion': 'entropy', 'max_depth': 40, 'max_features': 'auto', 'min_samples_leaf': 1, 'min_samples_split': 4, 'n_estimators': 25}. Best is trial 284 with value: 0.9236651223187223.[0m
[32m[I 2021-06-01 15:11:32,997][0m Trial 509 finished with value: 0.9133354589350458 and parameters: {'criterion': 'entropy', 'max_depth': 40, 'max_features': 'log2', 'min_samples_leaf': 1, 'min_samples_split': 4, 'n_estimators': 25}. Best is trial 284 with value: 0.9236651223187223.[0m
[32m[I 2021-06-01 15:11:33,039][0m Trial 516 finished with value: 0.9131581749704525 and parameters: {'criterion': 'entropy', 'max_depth': 25, 'max_features': 'auto', 'min_samples_leaf': 1, 'min_samples_split': 4, 'n_estimators': 25}. Best is trial 284 with value: 0.9236651223187223.[0m
[32m[I 2021-06-01 15:11:33,042][0m Trial 495 finished with value: 0.9117327436243301 and parameters: {'criterion': 'gini', 'max_depth': 40, 'max_features': 'auto', 'min_samples_leaf': 1, 'min_samples_split': 4, 'n_estimators': 150}. Best is trial 284 with value: 0.9236651223187223.[0m
[32m[I 2021-06-01 15:11:33,045][0m Trial 511 finished with value: 0.9149100493241462 and parameters: {'criterion': 'entropy', 'max_depth': 40, 'max_features': 'auto', 'min_samples_leaf': 1, 'min_samples_split': 4, 'n_estimators': 25}. Best is trial 284 with value: 0.9236651223187223.[0m
[32m[I 2021-06-01 15:11:33,258][0m Trial 517 finished with value: 0.914602468240901 and parameters: {'criterion': 'entropy', 'max_depth': 40, 'max_features': 'auto', 'min_samples_leaf': 1, 'min_samples_split': 3, 'n_estimators': 25}. Best is trial 284 with value: 0.9236651223187223.[0m
[32m[I 2021-06-01 15:11:33,920][0m Trial 522 finished with value: 0.9128340149367637 and parameters: {'criterion': 'entropy', 'max_depth': 40, 'max_features': 'auto', 'min_samples_leaf': 1, 'min_samples_split': 3, 'n_estimators': 25}. Best is trial 284 with value: 0.9236651223187223.[0m
[32m[I 2021-06-01 15:11:33,920][0m Trial 500 finished with value: 0.9103383695051903 and parameters: {'criterion': 'gini', 'max_depth': 40, 'max_features': 'auto', 'min_samples_leaf': 1, 'min_samples_split': 4, 'n_estimators': 190}. Best is trial 284 with value: 0.9236651223187223.[0m
[32m[I 2021-06-01 15:11:33,961][0m Trial 514 finished with value: 0.9081505919224098 and parameters: {'criterion': 'entropy', 'max_depth': 40, 'max_features': 'auto', 'min_samples_leaf': 1, 'min_samples_split': 4, 'n_estimators': 25}. Best is trial 284 with value: 0.9236651223187223.[0m
[32m[I 2021-06-01 15:11:33,967][0m Trial 518 finished with value: 0.9139462705436158 and parameters: {'criterion': 'entropy', 'max_depth': 40, 'max_features': 'auto', 'min_samples_leaf': 1, 'min_samples_split': 4, 'n_estimators': 25}. Best is trial 284 with value: 0.9236651223187223.[0m
[32m[I 2021-06-01 15:11:34,099][0m Trial 520 finished with value: 0.9086222732107266 and parameters: {'criterion': 'entropy', 'max_depth': 40, 'max_features': 'auto', 'min_samples_leaf': 1, 'min_samples_split': 3, 'n_estimators': 25}. Best is trial 284 with value: 0.9236651223187223.[0m
[32m[I 2021-06-01 15:11:34,219][0m Trial 512 finished with value: 0.9117392555780517 and parameters: {'criterion': 'entropy', 'max_depth': 40, 'max_features': 'auto', 'min_samples_leaf': 1, 'min_samples_split': 4, 'n_estimators': 80}. Best is trial 284 with value: 0.9236651223187223.[0m
[32m[I 2021-06-01 15:11:34,271][0m Trial 501 finished with value: 0.9071612568248575 and parameters: {'criterion': 'gini', 'max_depth': 40, 'max_features': 'auto', 'min_samples_leaf': 1, 'min_samples_split': 4, 'n_estimators': 185}. Best is trial 284 with value: 0.9236651223187223.[0m
[32m[I 2021-06-01 15:11:34,805][0m Trial 523 finished with value: 0.9146506003668993 and parameters: {'criterion': 'entropy', 'max_depth': 40, 'max_features': 'auto', 'min_samples_leaf': 1, 'min_samples_split': 3, 'n_estimators': 25}. Best is trial 284 with value: 0.9236651223187223.[0m
[32m[I 2021-06-01 15:11:34,998][0m Trial 525 finished with value: 0.9095604377669595 and parameters: {'criterion': 'entropy', 'max_depth': 40, 'max_features': 'auto', 'min_samples_leaf': 1, 'min_samples_split': 3, 'n_estimators': 25}. Best is trial 284 with value: 0.9236651223187223.[0m
[32m[I 2021-06-01 15:11:35,237][0m Trial 521 finished with value: 0.9115882073659061 and parameters: {'criterion': 'entropy', 'max_depth': 40, 'max_features': 'auto', 'min_samples_leaf': 1, 'min_samples_split': 3, 'n_estimators': 25}. Best is trial 284 with value: 0.9236651223187223.[0m
[32m[I 2021-06-01 15:11:35,294][0m Trial 528 finished with value: 0.91346246230725 and parameters: {'criterion': 'entropy', 'max_depth': 40, 'max_features': 'auto', 'min_samples_leaf': 1, 'min_samples_split': 3, 'n_estimators': 15}. Best is trial 284 with value: 0.9236651223187223.[0m
[32m[I 2021-06-01 15:11:35,297][0m Trial 526 finished with value: 0.9146682805153914 and parameters: {'criterion': 'entropy', 'max_depth': 40, 'max_features': 'auto', 'min_samples_leaf': 1, 'min_samples_split': 3, 'n_estimators': 25}. Best is trial 284 with value: 0.9236651223187223.[0m
[32m[I 2021-06-01 15:11:35,402][0m Trial 519 finished with value: 0.9088858211649274 and parameters: {'criterion': 'entropy', 'max_depth': 40, 'max_features': 'auto', 'min_samples_leaf': 1, 'min_samples_split': 3, 'n_estimators': 25}. Best is trial 284 with value: 0.9236651223187223.[0m
[32m[I 2021-06-01 15:11:35,429][0m Trial 524 finished with value: 0.9146240250911019 and parameters: {'criterion': 'entropy', 'max_depth': 40, 'max_features': 'auto', 'min_samples_leaf': 1, 'min_samples_split': 3, 'n_estimators': 25}. Best is trial 284 with value: 0.9236651223187223.[0m
[32m[I 2021-06-01 15:11:35,998][0m Trial 530 finished with value: 0.9164111112417157 and parameters: {'criterion': 'entropy', 'max_depth': 40, 'max_features': 'auto', 'min_samples_leaf': 1, 'min_samples_split': 4, 'n_estimators': 15}. Best is trial 284 with value: 0.9236651223187223.[0m
[32m[I 2021-06-01 15:11:36,000][0m Trial 533 finished with value: 0.9162235831763151 and parameters: {'criterion': 'entropy', 'max_depth': 40, 'max_features': 'auto', 'min_samples_leaf': 1, 'min_samples_split': 4, 'n_estimators': 15}. Best is trial 284 with value: 0.9236651223187223.[0m
[32m[I 2021-06-01 15:11:36,126][0m Trial 536 finished with value: 0.919066574607036 and parameters: {'criterion': 'entropy', 'max_depth': 40, 'max_features': 'auto', 'min_samples_leaf': 1, 'min_samples_split': 4, 'n_estimators': 15}. Best is trial 284 with value: 0.9236651223187223.[0m
