[32m[I 2021-06-01 14:44:14,880][0m Trial 255 finished with value: 0.9144864189792015 and parameters: {'criterion': 'gini', 'max_depth': 40, 'max_features': 'sqrt', 'min_samples_leaf': 1, 'min_samples_split': 3, 'n_estimators': 10}. Best is trial 234 with value: 0.9157152387746089.[0m
[32m[I 2021-06-01 14:44:16,330][0m Trial 258 finished with value: 0.9152070559988829 and parameters: {'criterion': 'gini', 'max_depth': 40, 'max_features': 'sqrt', 'min_samples_leaf': 1, 'min_samples_split': 3, 'n_estimators': 10}. Best is trial 234 with value: 0.9157152387746089.[0m
[32m[I 2021-06-01 14:44:16,331][0m Trial 256 finished with value: 0.9143608856731437 and parameters: {'criterion': 'gini', 'max_depth': 40, 'max_features': 'sqrt', 'min_samples_leaf': 1, 'min_samples_split': 3, 'n_estimators': 10}. Best is trial 234 with value: 0.9157152387746089.[0m
[32m[I 2021-06-01 14:44:16,380][0m Trial 257 finished with value: 0.9148253666549154 and parameters: {'criterion': 'gini', 'max_depth': 40, 'max_features': 'sqrt', 'min_samples_leaf': 1, 'min_samples_split': 3, 'n_estimators': 10}. Best is trial 234 with value: 0.9157152387746089.[0m
[32m[I 2021-06-01 14:44:17,440][0m Trial 260 finished with value: 0.9148778385404579 and parameters: {'criterion': 'gini', 'max_depth': 40, 'max_features': 'sqrt', 'min_samples_leaf': 1, 'min_samples_split': 3, 'n_estimators': 10}. Best is trial 234 with value: 0.9157152387746089.[0m
[32m[I 2021-06-01 14:44:17,486][0m Trial 259 finished with value: 0.9144003164251903 and parameters: {'criterion': 'gini', 'max_depth': 40, 'max_features': 'sqrt', 'min_samples_leaf': 1, 'min_samples_split': 3, 'n_estimators': 10}. Best is trial 234 with value: 0.9157152387746089.[0m
[32m[I 2021-06-01 14:44:19,123][0m Trial 261 finished with value: 0.914411880826288 and parameters: {'criterion': 'gini', 'max_depth': 40, 'max_features': 'sqrt', 'min_samples_leaf': 1, 'min_samples_split': 3, 'n_estimators': 10}. Best is trial 234 with value: 0.9157152387746089.[0m
[32m[I 2021-06-01 14:44:20,270][0m Trial 262 finished with value: 0.9152963709500455 and parameters: {'criterion': 'gini', 'max_depth': 40, 'max_features': 'sqrt', 'min_samples_leaf': 1, 'min_samples_split': 3, 'n_estimators': 10}. Best is trial 234 with value: 0.9157152387746089.[0m
[32m[I 2021-06-01 14:44:23,841][0m Trial 263 finished with value: 0.91231215800484 and parameters: {'criterion': 'gini', 'max_depth': 40, 'max_features': 'sqrt', 'min_samples_leaf': 1, 'min_samples_split': 3, 'n_estimators': 20}. Best is trial 234 with value: 0.9157152387746089.[0m
[32m[I 2021-06-01 14:44:25,272][0m Trial 265 finished with value: 0.9126461417755406 and parameters: {'criterion': 'gini', 'max_depth': 40, 'max_features': 'sqrt', 'min_samples_leaf': 1, 'min_samples_split': 3, 'n_estimators': 20}. Best is trial 234 with value: 0.9157152387746089.[0m
[32m[I 2021-06-01 14:44:27,562][0m Trial 266 finished with value: 0.9130490540339322 and parameters: {'criterion': 'gini', 'max_depth': 40, 'max_features': 'sqrt', 'min_samples_leaf': 1, 'min_samples_split': 3, 'n_estimators': 20}. Best is trial 234 with value: 0.9157152387746089.[0m
[32m[I 2021-06-01 14:44:27,768][0m Trial 267 finished with value: 0.9123244740800764 and parameters: {'criterion': 'gini', 'max_depth': 40, 'max_features': 'sqrt', 'min_samples_leaf': 1, 'min_samples_split': 3, 'n_estimators': 20}. Best is trial 234 with value: 0.9157152387746089.[0m
[32m[I 2021-06-01 14:44:29,312][0m Trial 268 finished with value: 0.9142092167366368 and parameters: {'criterion': 'gini', 'max_depth': 40, 'max_features': 'sqrt', 'min_samples_leaf': 1, 'min_samples_split': 3, 'n_estimators': 20}. Best is trial 234 with value: 0.9157152387746089.[0m
[32m[I 2021-06-01 14:44:30,364][0m Trial 269 finished with value: 0.9126216071903235 and parameters: {'criterion': 'gini', 'max_depth': 40, 'max_features': 'sqrt', 'min_samples_leaf': 1, 'min_samples_split': 3, 'n_estimators': 20}. Best is trial 234 with value: 0.9157152387746089.[0m
[32m[I 2021-06-01 14:44:35,462][0m Trial 272 finished with value: 0.9129413861184592 and parameters: {'criterion': 'gini', 'max_depth': 40, 'max_features': 'sqrt', 'min_samples_leaf': 2, 'min_samples_split': 3, 'n_estimators': 10}. Best is trial 234 with value: 0.9157152387746089.[0m
[32m[I 2021-06-01 14:44:37,631][0m Trial 270 finished with value: 0.9130149906016101 and parameters: {'criterion': 'gini', 'max_depth': 40, 'max_features': 'sqrt', 'min_samples_leaf': 1, 'min_samples_split': 3, 'n_estimators': 20}. Best is trial 234 with value: 0.9157152387746089.[0m
[32m[I 2021-06-01 14:44:39,309][0m Trial 271 finished with value: 0.9129901096390171 and parameters: {'criterion': 'gini', 'max_depth': 40, 'max_features': 'sqrt', 'min_samples_leaf': 1, 'min_samples_split': 3, 'n_estimators': 20}. Best is trial 234 with value: 0.9157152387746089.[0m
[32m[I 2021-06-01 14:44:41,660][0m Trial 273 finished with value: 0.9087063398975561 and parameters: {'criterion': 'gini', 'max_depth': 40, 'max_features': 'sqrt', 'min_samples_leaf': 9, 'min_samples_split': 3, 'n_estimators': 10}. Best is trial 234 with value: 0.9157152387746089.[0m
[32m[I 2021-06-01 14:45:12,684][0m Trial 264 finished with value: 0.9111439960797835 and parameters: {'criterion': 'gini', 'max_depth': 40, 'max_features': 'sqrt', 'min_samples_leaf': 1, 'min_samples_split': 3, 'n_estimators': 125}. Best is trial 234 with value: 0.9157152387746089.[0m
[32m[I 2021-06-01 14:45:17,837][0m Trial 275 finished with value: 0.9149616067449173 and parameters: {'criterion': 'gini', 'max_depth': 40, 'max_features': 'sqrt', 'min_samples_leaf': 1, 'min_samples_split': 3, 'n_estimators': 10}. Best is trial 234 with value: 0.9157152387746089.[0m
[32m[I 2021-06-01 14:45:27,461][0m Trial 276 finished with value: 0.9121539039234241 and parameters: {'criterion': 'gini', 'max_depth': 40, 'max_features': 'sqrt', 'min_samples_leaf': 1, 'min_samples_split': 3, 'n_estimators': 20}. Best is trial 234 with value: 0.9157152387746089.[0m
[32m[I 2021-06-01 14:45:29,351][0m Trial 274 finished with value: 0.9110333912942605 and parameters: {'criterion': 'gini', 'max_depth': 40, 'max_features': 'sqrt', 'min_samples_leaf': 1, 'min_samples_split': 3, 'n_estimators': 115}. Best is trial 234 with value: 0.9157152387746089.[0m
[32m[I 2021-06-01 14:45:32,803][0m Trial 277 finished with value: 0.9142762605132685 and parameters: {'criterion': 'gini', 'max_depth': 40, 'max_features': 'sqrt', 'min_samples_leaf': 1, 'min_samples_split': 3, 'n_estimators': 10}. Best is trial 234 with value: 0.9157152387746089.[0m
[32m[I 2021-06-01 14:45:34,694][0m Trial 278 finished with value: 0.9147839650883707 and parameters: {'criterion': 'gini', 'max_depth': 40, 'max_features': 'sqrt', 'min_samples_leaf': 1, 'min_samples_split': 3, 'n_estimators': 10}. Best is trial 234 with value: 0.9157152387746089.[0m
[32m[I 2021-06-01 14:45:43,271][0m Trial 279 finished with value: 0.9111830804976453 and parameters: {'criterion': 'gini', 'max_depth': 40, 'max_features': 'sqrt', 'min_samples_leaf': 2, 'min_samples_split': 3, 'n_estimators': 20}. Best is trial 234 with value: 0.9157152387746089.[0m
