[32m[I 2021-06-01 14:37:37,507][0m Trial 4 finished with value: 0.9094926744968695 and parameters: {'criterion': 'gini', 'max_depth': 15, 'max_features': 'auto', 'min_samples_leaf': 2, 'min_samples_split': 5, 'n_estimators': 260}. Best is trial 49 with value: 0.9119226777658795.[0m
[32m[I 2021-06-01 14:37:42,866][0m Trial 50 finished with value: 0.9102721285742579 and parameters: {'criterion': 'entropy', 'max_depth': None, 'max_features': 'log2', 'min_samples_leaf': 1, 'min_samples_split': 5, 'n_estimators': 30}. Best is trial 49 with value: 0.9119226777658795.[0m
[32m[I 2021-06-01 14:37:44,734][0m Trial 6 finished with value: 0.9083742340087648 and parameters: {'criterion': 'entropy', 'max_depth': 30, 'max_features': 'auto', 'min_samples_leaf': 10, 'min_samples_split': 8, 'n_estimators': 145}. Best is trial 49 with value: 0.9119226777658795.[0m
[32m[I 2021-06-01 14:37:45,206][0m Trial 54 finished with value: 0.9085773481433644 and parameters: {'criterion': 'entropy', 'max_depth': 10, 'max_features': 'auto', 'min_samples_leaf': 2, 'min_samples_split': 8, 'n_estimators': 10}. Best is trial 49 with value: 0.9119226777658795.[0m
[32m[I 2021-06-01 14:37:51,368][0m Trial 55 finished with value: 0.9086421682829504 and parameters: {'criterion': 'entropy', 'max_depth': 10, 'max_features': 'auto', 'min_samples_leaf': 3, 'min_samples_split': 8, 'n_estimators': 10}. Best is trial 49 with value: 0.9119226777658795.[0m
[32m[I 2021-06-01 14:37:54,188][0m Trial 52 finished with value: 0.9106715400386161 and parameters: {'criterion': 'entropy', 'max_depth': None, 'max_features': 'auto', 'min_samples_leaf': 1, 'min_samples_split': 8, 'n_estimators': 25}. Best is trial 49 with value: 0.9119226777658795.[0m
[32m[I 2021-06-01 14:37:54,581][0m Trial 56 finished with value: 0.9084298140971796 and parameters: {'criterion': 'entropy', 'max_depth': 10, 'max_features': 'auto', 'min_samples_leaf': 3, 'min_samples_split': 9, 'n_estimators': 15}. Best is trial 49 with value: 0.9119226777658795.[0m
[32m[I 2021-06-01 14:37:55,332][0m Trial 1 finished with value: 0.9096301963286815 and parameters: {'criterion': 'gini', 'max_depth': 20, 'max_features': 'sqrt', 'min_samples_leaf': 2, 'min_samples_split': 4, 'n_estimators': 265}. Best is trial 49 with value: 0.9119226777658795.[0m
[32m[I 2021-06-01 14:37:55,530][0m Trial 58 finished with value: 0.9118635973018081 and parameters: {'criterion': 'entropy', 'max_depth': None, 'max_features': 'auto', 'min_samples_leaf': 1, 'min_samples_split': 7, 'n_estimators': 10}. Best is trial 49 with value: 0.9119226777658795.[0m
[32m[I 2021-06-01 14:37:55,739][0m Trial 53 finished with value: 0.9095175014482569 and parameters: {'criterion': 'entropy', 'max_depth': 15, 'max_features': 'auto', 'min_samples_leaf': 1, 'min_samples_split': 8, 'n_estimators': 20}. Best is trial 49 with value: 0.9119226777658795.[0m
[32m[I 2021-06-01 14:37:57,439][0m Trial 57 finished with value: 0.9087109924372007 and parameters: {'criterion': 'entropy', 'max_depth': 10, 'max_features': 'auto', 'min_samples_leaf': 1, 'min_samples_split': 8, 'n_estimators': 10}. Best is trial 49 with value: 0.9119226777658795.[0m
[32m[I 2021-06-01 14:37:57,614][0m Trial 45 finished with value: 0.9098054145647213 and parameters: {'criterion': 'entropy', 'max_depth': None, 'max_features': 'auto', 'min_samples_leaf': 1, 'min_samples_split': 8, 'n_estimators': 45}. Best is trial 49 with value: 0.9119226777658795.[0m
[32m[I 2021-06-01 14:37:58,196][0m Trial 2 finished with value: 0.909222012058095 and parameters: {'criterion': 'entropy', 'max_depth': 45, 'max_features': 'auto', 'min_samples_leaf': 4, 'min_samples_split': 5, 'n_estimators': 140}. Best is trial 49 with value: 0.9119226777658795.[0m
[32m[I 2021-06-01 14:38:05,139][0m Trial 7 finished with value: 0.9115283060243662 and parameters: {'criterion': 'gini', 'max_depth': None, 'max_features': 'auto', 'min_samples_leaf': 1, 'min_samples_split': 2, 'n_estimators': 235}. Best is trial 49 with value: 0.9119226777658795.[0m
[32m[I 2021-06-01 14:38:08,733][0m Trial 10 finished with value: 0.909024760000932 and parameters: {'criterion': 'entropy', 'max_depth': 45, 'max_features': 'sqrt', 'min_samples_leaf': 4, 'min_samples_split': 4, 'n_estimators': 145}. Best is trial 49 with value: 0.9119226777658795.[0m
[32m[I 2021-06-01 14:38:10,896][0m Trial 47 finished with value: 0.910149533205162 and parameters: {'criterion': 'entropy', 'max_depth': None, 'max_features': 'auto', 'min_samples_leaf': 1, 'min_samples_split': 7, 'n_estimators': 50}. Best is trial 49 with value: 0.9119226777658795.[0m
[32m[I 2021-06-01 14:38:11,393][0m Trial 59 finished with value: 0.9111944535373476 and parameters: {'criterion': 'entropy', 'max_depth': None, 'max_features': 'auto', 'min_samples_leaf': 1, 'min_samples_split': 7, 'n_estimators': 20}. Best is trial 49 with value: 0.9119226777658795.[0m
[32m[I 2021-06-01 14:38:11,478][0m Trial 48 finished with value: 0.9094449971845606 and parameters: {'criterion': 'entropy', 'max_depth': None, 'max_features': 'auto', 'min_samples_leaf': 1, 'min_samples_split': 7, 'n_estimators': 50}. Best is trial 49 with value: 0.9119226777658795.[0m
[32m[I 2021-06-01 14:38:11,925][0m Trial 29 finished with value: 0.9084857025380779 and parameters: {'criterion': 'entropy', 'max_depth': 15, 'max_features': 'auto', 'min_samples_leaf': 7, 'min_samples_split': 6, 'n_estimators': 145}. Best is trial 49 with value: 0.9119226777658795.[0m
[32m[I 2021-06-01 14:38:13,420][0m Trial 31 finished with value: 0.9083738578024946 and parameters: {'criterion': 'entropy', 'max_depth': 40, 'max_features': 'sqrt', 'min_samples_leaf': 9, 'min_samples_split': 6, 'n_estimators': 140}. Best is trial 49 with value: 0.9119226777658795.[0m
[32m[I 2021-06-01 14:38:18,676][0m Trial 60 finished with value: 0.9096027132532724 and parameters: {'criterion': 'entropy', 'max_depth': 20, 'max_features': 'auto', 'min_samples_leaf': 1, 'min_samples_split': 9, 'n_estimators': 25}. Best is trial 49 with value: 0.9119226777658795.[0m
[32m[I 2021-06-01 14:38:19,498][0m Trial 63 finished with value: 0.9100858626650637 and parameters: {'criterion': 'entropy', 'max_depth': 20, 'max_features': 'auto', 'min_samples_leaf': 2, 'min_samples_split': 7, 'n_estimators': 25}. Best is trial 49 with value: 0.9119226777658795.[0m
[32m[I 2021-06-01 14:38:23,835][0m Trial 61 finished with value: 0.9106332176577017 and parameters: {'criterion': 'entropy', 'max_depth': 20, 'max_features': 'auto', 'min_samples_leaf': 1, 'min_samples_split': 7, 'n_estimators': 30}. Best is trial 49 with value: 0.9119226777658795.[0m
[32m[I 2021-06-01 14:38:25,154][0m Trial 64 finished with value: 0.9100970011132542 and parameters: {'criterion': 'entropy', 'max_depth': 20, 'max_features': 'auto', 'min_samples_leaf': 2, 'min_samples_split': 7, 'n_estimators': 30}. Best is trial 49 with value: 0.9119226777658795.[0m
[32m[I 2021-06-01 14:38:26,161][0m Trial 66 finished with value: 0.9100994131856813 and parameters: {'criterion': 'entropy', 'max_depth': 20, 'max_features': 'auto', 'min_samples_leaf': 2, 'min_samples_split': 7, 'n_estimators': 30}. Best is trial 49 with value: 0.9119226777658795.[0m
[32m[I 2021-06-01 14:38:30,684][0m Trial 65 finished with value: 0.9097227143349251 and parameters: {'criterion': 'entropy', 'max_depth': 20, 'max_features': 'auto', 'min_samples_leaf': 2, 'min_samples_split': 7, 'n_estimators': 35}. Best is trial 49 with value: 0.9119226777658795.[0m
[32m[I 2021-06-01 14:39:12,079][0m Trial 30 finished with value: 0.9083745161634672 and parameters: {'criterion': 'entropy', 'max_depth': 10, 'max_features': 'sqrt', 'min_samples_leaf': 5, 'min_samples_split': 4, 'n_estimators': 220}. Best is trial 49 with value: 0.9119226777658795.[0m
[32m[I 2021-06-01 14:39:17,965][0m Trial 20 finished with value: 0.9099094536546561 and parameters: {'criterion': 'entropy', 'max_depth': 30, 'max_features': 'sqrt', 'min_samples_leaf': 3, 'min_samples_split': 6, 'n_estimators': 220}. Best is trial 49 with value: 0.9119226777658795.[0m
[32m[I 2021-06-01 14:39:19,239][0m Trial 26 finished with value: 0.9083734580833325 and parameters: {'criterion': 'entropy', 'max_depth': 10, 'max_features': 'auto', 'min_samples_leaf': 6, 'min_samples_split': 2, 'n_estimators': 275}. Best is trial 49 with value: 0.9119226777658795.[0m
[32m[I 2021-06-01 14:39:20,214][0m Trial 9 finished with value: 0.9083675755530256 and parameters: {'criterion': 'entropy', 'max_depth': 30, 'max_features': 'auto', 'min_samples_leaf': 8, 'min_samples_split': 5, 'n_estimators': 260}. Best is trial 49 with value: 0.9119226777658795.[0m
[32m[I 2021-06-01 14:39:30,473][0m Trial 42 finished with value: 0.9098599456093724 and parameters: {'criterion': 'entropy', 'max_depth': None, 'max_features': 'log2', 'min_samples_leaf': 1, 'min_samples_split': 6, 'n_estimators': 280}. Best is trial 49 with value: 0.9119226777658795.[0m
[32m[I 2021-06-01 14:39:32,359][0m Trial 43 finished with value: 0.9096053899706182 and parameters: {'criterion': 'entropy', 'max_depth': None, 'max_features': 'log2', 'min_samples_leaf': 1, 'min_samples_split': 6, 'n_estimators': 275}. Best is trial 49 with value: 0.9119226777658795.[0m
[32m[I 2021-06-01 14:39:38,923][0m Trial 13 finished with value: 0.9084232176418711 and parameters: {'criterion': 'entropy', 'max_depth': 15, 'max_features': 'auto', 'min_samples_leaf': 6, 'min_samples_split': 2, 'n_estimators': 275}. Best is trial 49 with value: 0.9119226777658795.[0m
[32m[I 2021-06-01 14:39:47,968][0m Trial 44 finished with value: 0.9101818167273137 and parameters: {'criterion': 'entropy', 'max_depth': None, 'max_features': 'log2', 'min_samples_leaf': 1, 'min_samples_split': 6, 'n_estimators': 290}. Best is trial 49 with value: 0.9119226777658795.[0m
[32m[I 2021-06-01 14:39:52,698][0m Trial 67 finished with value: 0.9098295346249741 and parameters: {'criterion': 'entropy', 'max_depth': None, 'max_features': 'auto', 'min_samples_leaf': 2, 'min_samples_split': 7, 'n_estimators': 115}. Best is trial 49 with value: 0.9119226777658795.[0m
[32m[I 2021-06-01 14:39:57,253][0m Trial 24 finished with value: 0.9086102257730346 and parameters: {'criterion': 'entropy', 'max_depth': 25, 'max_features': 'sqrt', 'min_samples_leaf': 6, 'min_samples_split': 4, 'n_estimators': 290}. Best is trial 49 with value: 0.9119226777658795.[0m
[32m[I 2021-06-01 14:40:02,499][0m Trial 35 finished with value: 0.9102635652816409 and parameters: {'criterion': 'entropy', 'max_depth': 30, 'max_features': 'sqrt', 'min_samples_leaf': 1, 'min_samples_split': 7, 'n_estimators': 205}. Best is trial 49 with value: 0.9119226777658795.[0m
[32m[I 2021-06-01 14:40:02,793][0m Trial 88 finished with value: 0.9107127814458812 and parameters: {'criterion': 'entropy', 'max_depth': None, 'max_features': 'auto', 'min_samples_leaf': 2, 'min_samples_split': 9, 'n_estimators': 15}. Best is trial 49 with value: 0.9119226777658795.[0m
[32m[I 2021-06-01 14:40:05,022][0m Trial 5 finished with value: 0.9090975021639978 and parameters: {'criterion': 'entropy', 'max_depth': 35, 'max_features': 'sqrt', 'min_samples_leaf': 3, 'min_samples_split': 8, 'n_estimators': 275}. Best is trial 49 with value: 0.9119226777658795.[0m
[32m[I 2021-06-01 14:40:11,102][0m Trial 92 finished with value: 0.9109778323328491 and parameters: {'criterion': 'gini', 'max_depth': 35, 'max_features': 'auto', 'min_samples_leaf': 2, 'min_samples_split': 8, 'n_estimators': 15}. Best is trial 49 with value: 0.9119226777658795.[0m
[32m[I 2021-06-01 14:40:17,848][0m Trial 93 finished with value: 0.9098810602327585 and parameters: {'criterion': 'gini', 'max_depth': 35, 'max_features': 'auto', 'min_samples_leaf': 2, 'min_samples_split': 9, 'n_estimators': 15}. Best is trial 49 with value: 0.9119226777658795.[0m
[32m[I 2021-06-01 14:40:44,938][0m Trial 22 finished with value: 0.9101858280762853 and parameters: {'criterion': 'entropy', 'max_depth': 25, 'max_features': 'auto', 'min_samples_leaf': 2, 'min_samples_split': 4, 'n_estimators': 295}. Best is trial 49 with value: 0.9119226777658795.[0m
[32m[I 2021-06-01 14:41:02,869][0m Trial 85 finished with value: 0.909490161034206 and parameters: {'criterion': 'gini', 'max_depth': 35, 'max_features': 'auto', 'min_samples_leaf': 2, 'min_samples_split': 9, 'n_estimators': 190}. Best is trial 49 with value: 0.9119226777658795.[0m
[32m[I 2021-06-01 14:41:05,308][0m Trial 69 finished with value: 0.9094321804880808 and parameters: {'criterion': 'entropy', 'max_depth': 35, 'max_features': 'auto', 'min_samples_leaf': 2, 'min_samples_split': 9, 'n_estimators': 185}. Best is trial 49 with value: 0.9119226777658795.[0m
[32m[I 2021-06-01 14:41:09,848][0m Trial 86 finished with value: 0.9093212943133571 and parameters: {'criterion': 'gini', 'max_depth': 35, 'max_features': 'auto', 'min_samples_leaf': 2, 'min_samples_split': 9, 'n_estimators': 200}. Best is trial 49 with value: 0.9119226777658795.[0m
[32m[I 2021-06-01 14:41:11,978][0m Trial 87 finished with value: 0.9088736552838302 and parameters: {'criterion': 'gini', 'max_depth': None, 'max_features': 'auto', 'min_samples_leaf': 3, 'min_samples_split': 9, 'n_estimators': 195}. Best is trial 49 with value: 0.9119226777658795.[0m
[32m[I 2021-06-01 14:41:19,837][0m Trial 71 finished with value: 0.9103379136195094 and parameters: {'criterion': 'entropy', 'max_depth': 20, 'max_features': 'auto', 'min_samples_leaf': 2, 'min_samples_split': 6, 'n_estimators': 200}. Best is trial 49 with value: 0.9119226777658795.[0m
[32m[I 2021-06-01 14:41:21,691][0m Trial 97 finished with value: 0.9095032015912589 and parameters: {'criterion': 'gini', 'max_depth': 35, 'max_features': 'auto', 'min_samples_leaf': 3, 'min_samples_split': 8, 'n_estimators': 40}. Best is trial 49 with value: 0.9119226777658795.[0m
[32m[I 2021-06-01 14:41:21,778][0m Trial 100 finished with value: 0.9100986314052125 and parameters: {'criterion': 'gini', 'max_depth': None, 'max_features': 'auto', 'min_samples_leaf': 3, 'min_samples_split': 8, 'n_estimators': 20}. Best is trial 49 with value: 0.9119226777658795.[0m
[32m[I 2021-06-01 14:41:24,592][0m Trial 37 finished with value: 0.9095114516269961 and parameters: {'criterion': 'entropy', 'max_depth': None, 'max_features': 'auto', 'min_samples_leaf': 1, 'min_samples_split': 7, 'n_estimators': 285}. Best is trial 49 with value: 0.9119226777658795.[0m
[32m[I 2021-06-01 14:41:24,610][0m Trial 76 finished with value: 0.9094027971214942 and parameters: {'criterion': 'entropy', 'max_depth': 35, 'max_features': 'auto', 'min_samples_leaf': 2, 'min_samples_split': 7, 'n_estimators': 195}. Best is trial 49 with value: 0.9119226777658795.[0m
[32m[I 2021-06-01 14:41:26,855][0m Trial 75 finished with value: 0.9100602468679151 and parameters: {'criterion': 'entropy', 'max_depth': None, 'max_features': 'auto', 'min_samples_leaf': 2, 'min_samples_split': 7, 'n_estimators': 200}. Best is trial 49 with value: 0.9119226777658795.[0m
[32m[I 2021-06-01 14:41:29,205][0m Trial 78 finished with value: 0.9092421563149298 and parameters: {'criterion': 'entropy', 'max_depth': None, 'max_features': 'auto', 'min_samples_leaf': 2, 'min_samples_split': 9, 'n_estimators': 195}. Best is trial 49 with value: 0.9119226777658795.[0m
[32m[I 2021-06-01 14:41:31,985][0m Trial 104 finished with value: 0.9116142336692855 and parameters: {'criterion': 'gini', 'max_depth': None, 'max_features': 'auto', 'min_samples_leaf': 1, 'min_samples_split': 8, 'n_estimators': 10}. Best is trial 49 with value: 0.9119226777658795.[0m
[32m[I 2021-06-01 14:41:32,551][0m Trial 102 finished with value: 0.9108965269683417 and parameters: {'criterion': 'gini', 'max_depth': None, 'max_features': 'auto', 'min_samples_leaf': 1, 'min_samples_split': 8, 'n_estimators': 10}. Best is trial 49 with value: 0.9119226777658795.[0m
[32m[I 2021-06-01 14:41:33,602][0m Trial 79 finished with value: 0.9096289526735466 and parameters: {'criterion': 'entropy', 'max_depth': None, 'max_features': 'auto', 'min_samples_leaf': 2, 'min_samples_split': 9, 'n_estimators': 200}. Best is trial 49 with value: 0.9119226777658795.[0m
[32m[I 2021-06-01 14:41:35,164][0m Trial 91 finished with value: 0.9096110182276304 and parameters: {'criterion': 'gini', 'max_depth': 35, 'max_features': 'auto', 'min_samples_leaf': 2, 'min_samples_split': 9, 'n_estimators': 190}. Best is trial 49 with value: 0.9119226777658795.[0m
[32m[I 2021-06-01 14:41:38,101][0m Trial 108 finished with value: 0.9115622625356332 and parameters: {'criterion': 'gini', 'max_depth': None, 'max_features': 'auto', 'min_samples_leaf': 1, 'min_samples_split': 8, 'n_estimators': 10}. Best is trial 49 with value: 0.9119226777658795.[0m
[32m[I 2021-06-01 14:42:05,882][0m Trial 74 finished with value: 0.909062940288057 and parameters: {'criterion': 'entropy', 'max_depth': 20, 'max_features': 'auto', 'min_samples_leaf': 2, 'min_samples_split': 9, 'n_estimators': 245}. Best is trial 49 with value: 0.9119226777658795.[0m
[32m[I 2021-06-01 14:42:08,513][0m Trial 94 finished with value: 0.909657650319431 and parameters: {'criterion': 'gini', 'max_depth': 35, 'max_features': 'auto', 'min_samples_leaf': 2, 'min_samples_split': 9, 'n_estimators': 240}. Best is trial 49 with value: 0.9119226777658795.[0m
[32m[I 2021-06-01 14:42:10,420][0m Trial 112 finished with value: 0.9097949423468977 and parameters: {'criterion': 'gini', 'max_depth': None, 'max_features': 'auto', 'min_samples_leaf': 1, 'min_samples_split': 8, 'n_estimators': 60}. Best is trial 49 with value: 0.9119226777658795.[0m
[32m[I 2021-06-01 14:42:17,117][0m Trial 83 finished with value: 0.9098414240065298 and parameters: {'criterion': 'entropy', 'max_depth': None, 'max_features': 'auto', 'min_samples_leaf': 2, 'min_samples_split': 6, 'n_estimators': 180}. Best is trial 49 with value: 0.9119226777658795.[0m
[32m[I 2021-06-01 14:42:17,793][0m Trial 113 finished with value: 0.9103291315245704 and parameters: {'criterion': 'gini', 'max_depth': None, 'max_features': 'auto', 'min_samples_leaf': 1, 'min_samples_split': 8, 'n_estimators': 20}. Best is trial 49 with value: 0.9119226777658795.[0m
[32m[I 2021-06-01 14:42:18,779][0m Trial 95 finished with value: 0.909354455882643 and parameters: {'criterion': 'gini', 'max_depth': 35, 'max_features': 'auto', 'min_samples_leaf': 2, 'min_samples_split': 8, 'n_estimators': 245}. Best is trial 49 with value: 0.9119226777658795.[0m
[32m[I 2021-06-01 14:42:21,932][0m Trial 115 finished with value: 0.9105516620212333 and parameters: {'criterion': 'gini', 'max_depth': None, 'max_features': 'auto', 'min_samples_leaf': 1, 'min_samples_split': 8, 'n_estimators': 20}. Best is trial 49 with value: 0.9119226777658795.[0m
[32m[I 2021-06-01 14:42:25,406][0m Trial 118 finished with value: 0.9114157645881853 and parameters: {'criterion': 'gini', 'max_depth': None, 'max_features': 'auto', 'min_samples_leaf': 1, 'min_samples_split': 8, 'n_estimators': 10}. Best is trial 49 with value: 0.9119226777658795.[0m
[32m[I 2021-06-01 14:42:28,036][0m Trial 119 finished with value: 0.9113942661193409 and parameters: {'criterion': 'gini', 'max_depth': None, 'max_features': 'auto', 'min_samples_leaf': 1, 'min_samples_split': 8, 'n_estimators': 10}. Best is trial 49 with value: 0.9119226777658795.[0m
[32m[I 2021-06-01 14:42:28,891][0m Trial 116 finished with value: 0.9112726313854014 and parameters: {'criterion': 'gini', 'max_depth': None, 'max_features': 'auto', 'min_samples_leaf': 1, 'min_samples_split': 8, 'n_estimators': 20}. Best is trial 49 with value: 0.9119226777658795.[0m
[32m[I 2021-06-01 14:42:29,430][0m Trial 84 finished with value: 0.9095241013291109 and parameters: {'criterion': 'entropy', 'max_depth': None, 'max_features': 'auto', 'min_samples_leaf': 2, 'min_samples_split': 9, 'n_estimators': 195}. Best is trial 49 with value: 0.9119226777658795.[0m
[32m[I 2021-06-01 14:42:35,573][0m Trial 122 finished with value: 0.9113349587885236 and parameters: {'criterion': 'gini', 'max_depth': None, 'max_features': 'auto', 'min_samples_leaf': 1, 'min_samples_split': 8, 'n_estimators': 10}. Best is trial 49 with value: 0.9119226777658795.[0m
[32m[I 2021-06-01 14:42:35,985][0m Trial 70 finished with value: 0.9095462461658897 and parameters: {'criterion': 'entropy', 'max_depth': 20, 'max_features': 'auto', 'min_samples_leaf': 2, 'min_samples_split': 7, 'n_estimators': 280}. Best is trial 49 with value: 0.9119226777658795.[0m
[32m[I 2021-06-01 14:42:40,274][0m Trial 117 finished with value: 0.9098084182007746 and parameters: {'criterion': 'gini', 'max_depth': None, 'max_features': 'auto', 'min_samples_leaf': 1, 'min_samples_split': 8, 'n_estimators': 40}. Best is trial 49 with value: 0.9119226777658795.[0m
[32m[I 2021-06-01 14:42:44,806][0m Trial 114 finished with value: 0.9104328394457586 and parameters: {'criterion': 'gini', 'max_depth': None, 'max_features': 'auto', 'min_samples_leaf': 1, 'min_samples_split': 8, 'n_estimators': 60}. Best is trial 49 with value: 0.9119226777658795.[0m
[32m[I 2021-06-01 14:42:45,267][0m Trial 68 finished with value: 0.9094417316563593 and parameters: {'criterion': 'entropy', 'max_depth': 20, 'max_features': 'auto', 'min_samples_leaf': 2, 'min_samples_split': 7, 'n_estimators': 295}. Best is trial 49 with value: 0.9119226777658795.[0m
[32m[I 2021-06-01 14:42:45,908][0m Trial 62 finished with value: 0.9096235475895282 and parameters: {'criterion': 'entropy', 'max_depth': 20, 'max_features': 'auto', 'min_samples_leaf': 2, 'min_samples_split': 7, 'n_estimators': 300}. Best is trial 49 with value: 0.9119226777658795.[0m
[32m[I 2021-06-01 14:42:46,361][0m Trial 126 finished with value: 0.9109421518297534 and parameters: {'criterion': 'gini', 'max_depth': None, 'max_features': 'auto', 'min_samples_leaf': 1, 'min_samples_split': 8, 'n_estimators': 10}. Best is trial 49 with value: 0.9119226777658795.[0m
