[32m[I 2021-06-01 14:43:39,109][0m Trial 193 finished with value: 0.9130745692494205 and parameters: {'criterion': 'gini', 'max_depth': 45, 'max_features': 'log2', 'min_samples_leaf': 1, 'min_samples_split': 3, 'n_estimators': 15}. Best is trial 135 with value: 0.9139234933666023.[0m
[32m[I 2021-06-01 14:43:39,496][0m Trial 189 finished with value: 0.9124466966983661 and parameters: {'criterion': 'gini', 'max_depth': 45, 'max_features': 'log2', 'min_samples_leaf': 1, 'min_samples_split': 3, 'n_estimators': 20}. Best is trial 135 with value: 0.9139234933666023.[0m
[32m[I 2021-06-01 14:43:39,674][0m Trial 180 finished with value: 0.9109637271516334 and parameters: {'criterion': 'gini', 'max_depth': 45, 'max_features': 'log2', 'min_samples_leaf': 1, 'min_samples_split': 4, 'n_estimators': 45}. Best is trial 135 with value: 0.9139234933666023.[0m
[32m[I 2021-06-01 14:43:39,856][0m Trial 179 finished with value: 0.9107316246976239 and parameters: {'criterion': 'gini', 'max_depth': 45, 'max_features': 'log2', 'min_samples_leaf': 1, 'min_samples_split': 4, 'n_estimators': 50}. Best is trial 135 with value: 0.9139234933666023.[0m
[32m[I 2021-06-01 14:43:40,588][0m Trial 195 finished with value: 0.9133039258137557 and parameters: {'criterion': 'gini', 'max_depth': 45, 'max_features': 'log2', 'min_samples_leaf': 1, 'min_samples_split': 3, 'n_estimators': 15}. Best is trial 135 with value: 0.9139234933666023.[0m
[32m[I 2021-06-01 14:43:40,691][0m Trial 196 finished with value: 0.91292753311699 and parameters: {'criterion': 'gini', 'max_depth': 45, 'max_features': 'log2', 'min_samples_leaf': 1, 'min_samples_split': 3, 'n_estimators': 15}. Best is trial 135 with value: 0.9139234933666023.[0m
[32m[I 2021-06-01 14:43:40,741][0m Trial 201 finished with value: 0.9083737637509269 and parameters: {'criterion': 'gini', 'max_depth': 5, 'max_features': 'log2', 'min_samples_leaf': 1, 'min_samples_split': 3, 'n_estimators': 15}. Best is trial 135 with value: 0.9139234933666023.[0m
[32m[I 2021-06-01 14:43:41,089][0m Trial 106 finished with value: 0.9098419366138122 and parameters: {'criterion': 'gini', 'max_depth': None, 'max_features': 'auto', 'min_samples_leaf': 1, 'min_samples_split': 8, 'n_estimators': 240}. Best is trial 135 with value: 0.9139234933666023.[0m
[32m[I 2021-06-01 14:43:41,093][0m Trial 197 finished with value: 0.913594311722955 and parameters: {'criterion': 'gini', 'max_depth': 45, 'max_features': 'log2', 'min_samples_leaf': 1, 'min_samples_split': 3, 'n_estimators': 15}. Best is trial 135 with value: 0.9139234933666023.[0m
[32m[I 2021-06-01 14:43:41,176][0m Trial 198 finished with value: 0.9132263104993352 and parameters: {'criterion': 'gini', 'max_depth': 45, 'max_features': 'log2', 'min_samples_leaf': 1, 'min_samples_split': 3, 'n_estimators': 15}. Best is trial 135 with value: 0.9139234933666023.[0m
[32m[I 2021-06-01 14:43:41,202][0m Trial 202 finished with value: 0.9083747512923861 and parameters: {'criterion': 'gini', 'max_depth': 5, 'max_features': 'log2', 'min_samples_leaf': 1, 'min_samples_split': 3, 'n_estimators': 15}. Best is trial 135 with value: 0.9139234933666023.[0m
[32m[I 2021-06-01 14:43:41,919][0m Trial 205 finished with value: 0.9083737402380351 and parameters: {'criterion': 'gini', 'max_depth': 5, 'max_features': 'log2', 'min_samples_leaf': 1, 'min_samples_split': 3, 'n_estimators': 15}. Best is trial 135 with value: 0.9139234933666023.[0m
[32m[I 2021-06-01 14:43:42,123][0m Trial 199 finished with value: 0.9135121670144585 and parameters: {'criterion': 'gini', 'max_depth': 45, 'max_features': 'log2', 'min_samples_leaf': 1, 'min_samples_split': 3, 'n_estimators': 15}. Best is trial 135 with value: 0.9139234933666023.[0m
[32m[I 2021-06-01 14:43:42,391][0m Trial 109 finished with value: 0.9097166455841533 and parameters: {'criterion': 'gini', 'max_depth': None, 'max_features': 'auto', 'min_samples_leaf': 1, 'min_samples_split': 8, 'n_estimators': 240}. Best is trial 135 with value: 0.9139234933666023.[0m
[32m[I 2021-06-01 14:43:42,460][0m Trial 207 finished with value: 0.9083738578024946 and parameters: {'criterion': 'gini', 'max_depth': 5, 'max_features': 'log2', 'min_samples_leaf': 1, 'min_samples_split': 3, 'n_estimators': 15}. Best is trial 135 with value: 0.9139234933666023.[0m
[32m[I 2021-06-01 14:43:42,656][0m Trial 191 finished with value: 0.9083737872638189 and parameters: {'criterion': 'gini', 'max_depth': 5, 'max_features': 'log2', 'min_samples_leaf': 1, 'min_samples_split': 3, 'n_estimators': 15}. Best is trial 135 with value: 0.9139234933666023.[0m
[32m[I 2021-06-01 14:43:42,660][0m Trial 200 finished with value: 0.912893812487504 and parameters: {'criterion': 'gini', 'max_depth': 45, 'max_features': 'log2', 'min_samples_leaf': 1, 'min_samples_split': 3, 'n_estimators': 15}. Best is trial 135 with value: 0.9139234933666023.[0m
[32m[I 2021-06-01 14:43:43,956][0m Trial 82 finished with value: 0.9093299844052478 and parameters: {'criterion': 'entropy', 'max_depth': None, 'max_features': 'auto', 'min_samples_leaf': 2, 'min_samples_split': 9, 'n_estimators': 275}. Best is trial 135 with value: 0.9139234933666023.[0m
[32m[I 2021-06-01 14:43:44,031][0m Trial 206 finished with value: 0.910251830276159 and parameters: {'criterion': 'gini', 'max_depth': 15, 'max_features': 'log2', 'min_samples_leaf': 1, 'min_samples_split': 3, 'n_estimators': 15}. Best is trial 135 with value: 0.9139234933666023.[0m
[32m[I 2021-06-01 14:43:44,922][0m Trial 188 finished with value: 0.9120485578384555 and parameters: {'criterion': 'gini', 'max_depth': 45, 'max_features': 'log2', 'min_samples_leaf': 1, 'min_samples_split': 3, 'n_estimators': 20}. Best is trial 135 with value: 0.9139234933666023.[0m
[32m[I 2021-06-01 14:43:45,643][0m Trial 216 finished with value: 0.9105867187215001 and parameters: {'criterion': 'gini', 'max_depth': 15, 'max_features': 'log2', 'min_samples_leaf': 1, 'min_samples_split': 3, 'n_estimators': 10}. Best is trial 135 with value: 0.9139234933666023.[0m
[32m[I 2021-06-01 14:43:45,753][0m Trial 214 finished with value: 0.9102453591124979 and parameters: {'criterion': 'gini', 'max_depth': 15, 'max_features': 'log2', 'min_samples_leaf': 1, 'min_samples_split': 3, 'n_estimators': 15}. Best is trial 135 with value: 0.9139234933666023.[0m
[32m[I 2021-06-01 14:43:45,892][0m Trial 209 finished with value: 0.9125511096462342 and parameters: {'criterion': 'gini', 'max_depth': 45, 'max_features': 'log2', 'min_samples_leaf': 1, 'min_samples_split': 3, 'n_estimators': 15}. Best is trial 135 with value: 0.9139234933666023.[0m
[32m[I 2021-06-01 14:43:46,515][0m Trial 212 finished with value: 0.9123629062330577 and parameters: {'criterion': 'gini', 'max_depth': 40, 'max_features': 'log2', 'min_samples_leaf': 1, 'min_samples_split': 3, 'n_estimators': 15}. Best is trial 135 with value: 0.9139234933666023.[0m
[32m[I 2021-06-01 14:43:46,525][0m Trial 213 finished with value: 0.9123221737203645 and parameters: {'criterion': 'gini', 'max_depth': 40, 'max_features': 'log2', 'min_samples_leaf': 1, 'min_samples_split': 3, 'n_estimators': 15}. Best is trial 135 with value: 0.9139234933666023.[0m
[32m[I 2021-06-01 14:43:46,678][0m Trial 211 finished with value: 0.910285605577565 and parameters: {'criterion': 'gini', 'max_depth': 15, 'max_features': 'log2', 'min_samples_leaf': 1, 'min_samples_split': 3, 'n_estimators': 15}. Best is trial 135 with value: 0.9139234933666023.[0m
[32m[I 2021-06-01 14:43:46,931][0m Trial 194 finished with value: 0.9126954104134619 and parameters: {'criterion': 'gini', 'max_depth': 45, 'max_features': 'log2', 'min_samples_leaf': 1, 'min_samples_split': 3, 'n_estimators': 15}. Best is trial 135 with value: 0.9139234933666023.[0m
[32m[I 2021-06-01 14:43:48,440][0m Trial 218 finished with value: 0.9137359188328068 and parameters: {'criterion': 'gini', 'max_depth': 45, 'max_features': 'log2', 'min_samples_leaf': 1, 'min_samples_split': 3, 'n_estimators': 10}. Best is trial 135 with value: 0.9139234933666023.[0m
[32m[I 2021-06-01 14:43:49,389][0m Trial 220 finished with value: 0.9146550735006576 and parameters: {'criterion': 'gini', 'max_depth': 45, 'max_features': 'log2', 'min_samples_leaf': 1, 'min_samples_split': 3, 'n_estimators': 10}. Best is trial 220 with value: 0.9146550735006576.[0m
[32m[I 2021-06-01 14:43:49,564][0m Trial 219 finished with value: 0.9137892700316049 and parameters: {'criterion': 'gini', 'max_depth': 45, 'max_features': 'log2', 'min_samples_leaf': 1, 'min_samples_split': 3, 'n_estimators': 10}. Best is trial 220 with value: 0.9146550735006576.[0m
[32m[I 2021-06-01 14:43:49,629][0m Trial 221 finished with value: 0.9149209508315035 and parameters: {'criterion': 'gini', 'max_depth': 40, 'max_features': 'log2', 'min_samples_leaf': 1, 'min_samples_split': 3, 'n_estimators': 10}. Best is trial 221 with value: 0.9149209508315035.[0m
[32m[I 2021-06-01 14:43:50,091][0m Trial 223 finished with value: 0.9132466894195606 and parameters: {'criterion': 'gini', 'max_depth': 45, 'max_features': 'log2', 'min_samples_leaf': 1, 'min_samples_split': 3, 'n_estimators': 10}. Best is trial 221 with value: 0.9149209508315035.[0m
[32m[I 2021-06-01 14:43:50,205][0m Trial 208 finished with value: 0.9083741634700889 and parameters: {'criterion': 'gini', 'max_depth': 5, 'max_features': 'log2', 'min_samples_leaf': 1, 'min_samples_split': 3, 'n_estimators': 85}. Best is trial 221 with value: 0.9149209508315035.[0m
[32m[I 2021-06-01 14:43:50,213][0m Trial 224 finished with value: 0.9141075521437954 and parameters: {'criterion': 'gini', 'max_depth': 45, 'max_features': 'log2', 'min_samples_leaf': 1, 'min_samples_split': 3, 'n_estimators': 10}. Best is trial 221 with value: 0.9149209508315035.[0m
[32m[I 2021-06-01 14:43:50,746][0m Trial 107 finished with value: 0.9097294655524568 and parameters: {'criterion': 'gini', 'max_depth': None, 'max_features': 'auto', 'min_samples_leaf': 1, 'min_samples_split': 8, 'n_estimators': 250}. Best is trial 221 with value: 0.9149209508315035.[0m
[32m[I 2021-06-01 14:43:51,187][0m Trial 222 finished with value: 0.9144582603209722 and parameters: {'criterion': 'gini', 'max_depth': 45, 'max_features': 'log2', 'min_samples_leaf': 1, 'min_samples_split': 3, 'n_estimators': 10}. Best is trial 221 with value: 0.9149209508315035.[0m
[32m[I 2021-06-01 14:43:51,894][0m Trial 225 finished with value: 0.9134934497348475 and parameters: {'criterion': 'gini', 'max_depth': 45, 'max_features': 'log2', 'min_samples_leaf': 1, 'min_samples_split': 3, 'n_estimators': 10}. Best is trial 221 with value: 0.9149209508315035.[0m
[32m[I 2021-06-01 14:43:53,458][0m Trial 123 finished with value: 0.9099755862052887 and parameters: {'criterion': 'gini', 'max_depth': None, 'max_features': 'auto', 'min_samples_leaf': 1, 'min_samples_split': 8, 'n_estimators': 155}. Best is trial 221 with value: 0.9149209508315035.[0m
[32m[I 2021-06-01 14:43:53,461][0m Trial 217 finished with value: 0.9143793151886852 and parameters: {'criterion': 'gini', 'max_depth': 45, 'max_features': 'log2', 'min_samples_leaf': 1, 'min_samples_split': 3, 'n_estimators': 10}. Best is trial 221 with value: 0.9149209508315035.[0m
[32m[I 2021-06-01 14:43:53,483][0m Trial 226 finished with value: 0.9142068084427837 and parameters: {'criterion': 'gini', 'max_depth': 40, 'max_features': 'log2', 'min_samples_leaf': 1, 'min_samples_split': 3, 'n_estimators': 10}. Best is trial 221 with value: 0.9149209508315035.[0m
[32m[I 2021-06-01 14:43:53,591][0m Trial 149 finished with value: 0.9104856928771687 and parameters: {'criterion': 'gini', 'max_depth': 45, 'max_features': 'log2', 'min_samples_leaf': 1, 'min_samples_split': 3, 'n_estimators': 160}. Best is trial 221 with value: 0.9149209508315035.[0m
[32m[I 2021-06-01 14:43:53,595][0m Trial 228 finished with value: 0.9148284397404657 and parameters: {'criterion': 'gini', 'max_depth': 40, 'max_features': 'log2', 'min_samples_leaf': 1, 'min_samples_split': 3, 'n_estimators': 10}. Best is trial 221 with value: 0.9149209508315035.[0m
[32m[I 2021-06-01 14:43:53,978][0m Trial 227 finished with value: 0.9150887222791914 and parameters: {'criterion': 'gini', 'max_depth': 40, 'max_features': 'log2', 'min_samples_leaf': 1, 'min_samples_split': 3, 'n_estimators': 10}. Best is trial 227 with value: 0.9150887222791914.[0m
[32m[I 2021-06-01 14:43:55,428][0m Trial 203 finished with value: 0.90932918054193 and parameters: {'criterion': 'gini', 'max_depth': 15, 'max_features': 'log2', 'min_samples_leaf': 1, 'min_samples_split': 3, 'n_estimators': 75}. Best is trial 227 with value: 0.9150887222791914.[0m
[32m[I 2021-06-01 14:43:55,855][0m Trial 111 finished with value: 0.9101871301630554 and parameters: {'criterion': 'gini', 'max_depth': None, 'max_features': 'auto', 'min_samples_leaf': 1, 'min_samples_split': 8, 'n_estimators': 250}. Best is trial 227 with value: 0.9150887222791914.[0m
[32m[I 2021-06-01 14:43:57,080][0m Trial 231 finished with value: 0.9149348211498708 and parameters: {'criterion': 'gini', 'max_depth': 40, 'max_features': 'sqrt', 'min_samples_leaf': 1, 'min_samples_split': 3, 'n_estimators': 10}. Best is trial 227 with value: 0.9150887222791914.[0m
[32m[I 2021-06-01 14:43:57,305][0m Trial 230 finished with value: 0.9143815508873375 and parameters: {'criterion': 'gini', 'max_depth': 40, 'max_features': 'sqrt', 'min_samples_leaf': 1, 'min_samples_split': 3, 'n_estimators': 10}. Best is trial 227 with value: 0.9150887222791914.[0m
[32m[I 2021-06-01 14:43:57,648][0m Trial 90 finished with value: 0.909133343781394 and parameters: {'criterion': 'entropy', 'max_depth': 35, 'max_features': 'auto', 'min_samples_leaf': 2, 'min_samples_split': 9, 'n_estimators': 250}. Best is trial 227 with value: 0.9150887222791914.[0m
[32m[I 2021-06-01 14:43:59,439][0m Trial 204 finished with value: 0.9111078919528726 and parameters: {'criterion': 'gini', 'max_depth': 45, 'max_features': 'log2', 'min_samples_leaf': 1, 'min_samples_split': 3, 'n_estimators': 70}. Best is trial 227 with value: 0.9150887222791914.[0m
[32m[I 2021-06-01 14:43:59,611][0m Trial 215 finished with value: 0.9092659245654519 and parameters: {'criterion': 'gini', 'max_depth': 15, 'max_features': 'log2', 'min_samples_leaf': 1, 'min_samples_split': 3, 'n_estimators': 85}. Best is trial 227 with value: 0.9150887222791914.[0m
[32m[I 2021-06-01 14:43:59,624][0m Trial 233 finished with value: 0.9137454910976853 and parameters: {'criterion': 'gini', 'max_depth': 40, 'max_features': 'sqrt', 'min_samples_leaf': 1, 'min_samples_split': 3, 'n_estimators': 10}. Best is trial 227 with value: 0.9150887222791914.[0m
[32m[I 2021-06-01 14:43:59,669][0m Trial 232 finished with value: 0.9145951724519568 and parameters: {'criterion': 'gini', 'max_depth': 40, 'max_features': 'sqrt', 'min_samples_leaf': 1, 'min_samples_split': 3, 'n_estimators': 10}. Best is trial 227 with value: 0.9150887222791914.[0m
[32m[I 2021-06-01 14:44:00,662][0m Trial 229 finished with value: 0.914798474247602 and parameters: {'criterion': 'gini', 'max_depth': 40, 'max_features': 'sqrt', 'min_samples_leaf': 1, 'min_samples_split': 3, 'n_estimators': 10}. Best is trial 227 with value: 0.9150887222791914.[0m
[32m[I 2021-06-01 14:44:01,069][0m Trial 210 finished with value: 0.9107904995608666 and parameters: {'criterion': 'gini', 'max_depth': 45, 'max_features': 'log2', 'min_samples_leaf': 1, 'min_samples_split': 3, 'n_estimators': 80}. Best is trial 227 with value: 0.9150887222791914.[0m
[32m[I 2021-06-01 14:44:02,756][0m Trial 234 finished with value: 0.9157152387746089 and parameters: {'criterion': 'gini', 'max_depth': 40, 'max_features': 'sqrt', 'min_samples_leaf': 1, 'min_samples_split': 3, 'n_estimators': 10}. Best is trial 234 with value: 0.9157152387746089.[0m
[32m[I 2021-06-01 14:44:03,356][0m Trial 235 finished with value: 0.9146349635029567 and parameters: {'criterion': 'gini', 'max_depth': 40, 'max_features': 'sqrt', 'min_samples_leaf': 1, 'min_samples_split': 3, 'n_estimators': 10}. Best is trial 234 with value: 0.9157152387746089.[0m
[32m[I 2021-06-01 14:44:04,441][0m Trial 237 finished with value: 0.9149949312676273 and parameters: {'criterion': 'gini', 'max_depth': 40, 'max_features': 'sqrt', 'min_samples_leaf': 1, 'min_samples_split': 3, 'n_estimators': 10}. Best is trial 234 with value: 0.9157152387746089.[0m
[32m[I 2021-06-01 14:44:04,820][0m Trial 241 finished with value: 0.9141708597364262 and parameters: {'criterion': 'gini', 'max_depth': 40, 'max_features': 'sqrt', 'min_samples_leaf': 1, 'min_samples_split': 3, 'n_estimators': 10}. Best is trial 234 with value: 0.9157152387746089.[0m
[32m[I 2021-06-01 14:44:04,826][0m Trial 239 finished with value: 0.9143190137058899 and parameters: {'criterion': 'gini', 'max_depth': 40, 'max_features': 'sqrt', 'min_samples_leaf': 1, 'min_samples_split': 3, 'n_estimators': 10}. Best is trial 234 with value: 0.9157152387746089.[0m
[32m[I 2021-06-01 14:44:05,222][0m Trial 127 finished with value: 0.9104542805931354 and parameters: {'criterion': 'gini', 'max_depth': 45, 'max_features': 'auto', 'min_samples_leaf': 1, 'min_samples_split': 8, 'n_estimators': 160}. Best is trial 234 with value: 0.9157152387746089.[0m
[32m[I 2021-06-01 14:44:05,499][0m Trial 238 finished with value: 0.9141092768873673 and parameters: {'criterion': 'gini', 'max_depth': 40, 'max_features': 'sqrt', 'min_samples_leaf': 1, 'min_samples_split': 3, 'n_estimators': 10}. Best is trial 234 with value: 0.9157152387746089.[0m
[32m[I 2021-06-01 14:44:05,727][0m Trial 240 finished with value: 0.9154882214025823 and parameters: {'criterion': 'gini', 'max_depth': 40, 'max_features': 'sqrt', 'min_samples_leaf': 1, 'min_samples_split': 3, 'n_estimators': 10}. Best is trial 234 with value: 0.9157152387746089.[0m
[32m[I 2021-06-01 14:44:06,212][0m Trial 243 finished with value: 0.9143992737829933 and parameters: {'criterion': 'gini', 'max_depth': 40, 'max_features': 'sqrt', 'min_samples_leaf': 1, 'min_samples_split': 3, 'n_estimators': 10}. Best is trial 234 with value: 0.9157152387746089.[0m
[32m[I 2021-06-01 14:44:06,593][0m Trial 242 finished with value: 0.9149987596893736 and parameters: {'criterion': 'gini', 'max_depth': 40, 'max_features': 'sqrt', 'min_samples_leaf': 1, 'min_samples_split': 3, 'n_estimators': 10}. Best is trial 234 with value: 0.9157152387746089.[0m
[32m[I 2021-06-01 14:44:07,545][0m Trial 236 finished with value: 0.9149868322345789 and parameters: {'criterion': 'gini', 'max_depth': 40, 'max_features': 'sqrt', 'min_samples_leaf': 1, 'min_samples_split': 3, 'n_estimators': 10}. Best is trial 234 with value: 0.9157152387746089.[0m
[32m[I 2021-06-01 14:44:08,658][0m Trial 244 finished with value: 0.9147711775207528 and parameters: {'criterion': 'gini', 'max_depth': 40, 'max_features': 'sqrt', 'min_samples_leaf': 1, 'min_samples_split': 3, 'n_estimators': 10}. Best is trial 234 with value: 0.9157152387746089.[0m
[32m[I 2021-06-01 14:44:09,321][0m Trial 245 finished with value: 0.9146414104698243 and parameters: {'criterion': 'gini', 'max_depth': 40, 'max_features': 'sqrt', 'min_samples_leaf': 1, 'min_samples_split': 3, 'n_estimators': 10}. Best is trial 234 with value: 0.9157152387746089.[0m
[32m[I 2021-06-01 14:44:09,810][0m Trial 247 finished with value: 0.9145916754847294 and parameters: {'criterion': 'gini', 'max_depth': 40, 'max_features': 'sqrt', 'min_samples_leaf': 1, 'min_samples_split': 3, 'n_estimators': 10}. Best is trial 234 with value: 0.9157152387746089.[0m
[32m[I 2021-06-01 14:44:10,530][0m Trial 246 finished with value: 0.9138227240518001 and parameters: {'criterion': 'gini', 'max_depth': 40, 'max_features': 'sqrt', 'min_samples_leaf': 1, 'min_samples_split': 3, 'n_estimators': 10}. Best is trial 234 with value: 0.9157152387746089.[0m
[32m[I 2021-06-01 14:44:11,154][0m Trial 252 finished with value: 0.9085427122340409 and parameters: {'criterion': 'gini', 'max_depth': 40, 'max_features': 'sqrt', 'min_samples_leaf': 8, 'min_samples_split': 3, 'n_estimators': 10}. Best is trial 234 with value: 0.9157152387746089.[0m
[32m[I 2021-06-01 14:44:11,216][0m Trial 248 finished with value: 0.9143961854162519 and parameters: {'criterion': 'gini', 'max_depth': 40, 'max_features': 'sqrt', 'min_samples_leaf': 1, 'min_samples_split': 3, 'n_estimators': 10}. Best is trial 234 with value: 0.9157152387746089.[0m
[32m[I 2021-06-01 14:44:11,267][0m Trial 251 finished with value: 0.914579585656725 and parameters: {'criterion': 'gini', 'max_depth': 40, 'max_features': 'sqrt', 'min_samples_leaf': 1, 'min_samples_split': 3, 'n_estimators': 10}. Best is trial 234 with value: 0.9157152387746089.[0m
[32m[I 2021-06-01 14:44:11,653][0m Trial 250 finished with value: 0.9155480866404717 and parameters: {'criterion': 'gini', 'max_depth': 40, 'max_features': 'sqrt', 'min_samples_leaf': 1, 'min_samples_split': 3, 'n_estimators': 10}. Best is trial 234 with value: 0.9157152387746089.[0m
[32m[I 2021-06-01 14:44:11,680][0m Trial 249 finished with value: 0.9145167730347625 and parameters: {'criterion': 'gini', 'max_depth': 40, 'max_features': 'sqrt', 'min_samples_leaf': 1, 'min_samples_split': 3, 'n_estimators': 10}. Best is trial 234 with value: 0.9157152387746089.[0m
[32m[I 2021-06-01 14:44:13,395][0m Trial 253 finished with value: 0.9149863714115891 and parameters: {'criterion': 'gini', 'max_depth': 40, 'max_features': 'sqrt', 'min_samples_leaf': 1, 'min_samples_split': 3, 'n_estimators': 10}. Best is trial 234 with value: 0.9157152387746089.[0m
[32m[I 2021-06-01 14:44:14,558][0m Trial 254 finished with value: 0.9140917194008106 and parameters: {'criterion': 'gini', 'max_depth': 40, 'max_features': 'sqrt', 'min_samples_leaf': 1, 'min_samples_split': 3, 'n_estimators': 10}. Best is trial 234 with value: 0.9157152387746089.[0m
