[32m[I 2021-06-01 14:42:46,732][0m Trial 72 finished with value: 0.908966824843152 and parameters: {'criterion': 'entropy', 'max_depth': 20, 'max_features': 'auto', 'min_samples_leaf': 2, 'min_samples_split': 9, 'n_estimators': 295}. Best is trial 49 with value: 0.9119226777658795.[0m
[32m[I 2021-06-01 14:42:47,454][0m Trial 121 finished with value: 0.9104683118780572 and parameters: {'criterion': 'gini', 'max_depth': None, 'max_features': 'auto', 'min_samples_leaf': 1, 'min_samples_split': 7, 'n_estimators': 35}. Best is trial 49 with value: 0.9119226777658795.[0m
[32m[I 2021-06-01 14:42:47,602][0m Trial 120 finished with value: 0.9097046600167815 and parameters: {'criterion': 'gini', 'max_depth': None, 'max_features': 'auto', 'min_samples_leaf': 1, 'min_samples_split': 8, 'n_estimators': 40}. Best is trial 49 with value: 0.9119226777658795.[0m
[32m[I 2021-06-01 14:42:48,937][0m Trial 96 finished with value: 0.9090052413104728 and parameters: {'criterion': 'gini', 'max_depth': 35, 'max_features': 'auto', 'min_samples_leaf': 3, 'min_samples_split': 8, 'n_estimators': 255}. Best is trial 49 with value: 0.9119226777658795.[0m
[32m[I 2021-06-01 14:42:51,971][0m Trial 80 finished with value: 0.9094287793981563 and parameters: {'criterion': 'entropy', 'max_depth': None, 'max_features': 'auto', 'min_samples_leaf': 2, 'min_samples_split': 9, 'n_estimators': 280}. Best is trial 49 with value: 0.9119226777658795.[0m
[32m[I 2021-06-01 14:42:52,418][0m Trial 134 finished with value: 0.9105194243655174 and parameters: {'criterion': 'gini', 'max_depth': 25, 'max_features': 'log2', 'min_samples_leaf': 1, 'min_samples_split': 8, 'n_estimators': 10}. Best is trial 49 with value: 0.9119226777658795.[0m
[32m[I 2021-06-01 14:42:52,583][0m Trial 128 finished with value: 0.9120815596786409 and parameters: {'criterion': 'gini', 'max_depth': None, 'max_features': 'auto', 'min_samples_leaf': 1, 'min_samples_split': 8, 'n_estimators': 10}. Best is trial 128 with value: 0.9120815596786409.[0m
[32m[I 2021-06-01 14:42:54,999][0m Trial 129 finished with value: 0.9118551178033437 and parameters: {'criterion': 'gini', 'max_depth': None, 'max_features': 'auto', 'min_samples_leaf': 1, 'min_samples_split': 8, 'n_estimators': 10}. Best is trial 128 with value: 0.9120815596786409.[0m
[32m[I 2021-06-01 14:42:55,098][0m Trial 124 finished with value: 0.9101118220955469 and parameters: {'criterion': 'gini', 'max_depth': None, 'max_features': 'auto', 'min_samples_leaf': 1, 'min_samples_split': 8, 'n_estimators': 35}. Best is trial 128 with value: 0.9120815596786409.[0m
[32m[I 2021-06-01 14:42:56,131][0m Trial 136 finished with value: 0.9138869812196881 and parameters: {'criterion': 'gini', 'max_depth': 45, 'max_features': 'log2', 'min_samples_leaf': 1, 'min_samples_split': 3, 'n_estimators': 10}. Best is trial 136 with value: 0.9138869812196881.[0m
[32m[I 2021-06-01 14:42:56,637][0m Trial 130 finished with value: 0.9098833175006364 and parameters: {'criterion': 'gini', 'max_depth': None, 'max_features': 'log2', 'min_samples_leaf': 1, 'min_samples_split': 8, 'n_estimators': 35}. Best is trial 136 with value: 0.9138869812196881.[0m
[32m[I 2021-06-01 14:42:59,535][0m Trial 73 finished with value: 0.9095333647764703 and parameters: {'criterion': 'entropy', 'max_depth': 20, 'max_features': 'auto', 'min_samples_leaf': 2, 'min_samples_split': 9, 'n_estimators': 300}. Best is trial 136 with value: 0.9138869812196881.[0m
[32m[I 2021-06-01 14:43:00,658][0m Trial 135 finished with value: 0.9139234933666023 and parameters: {'criterion': 'gini', 'max_depth': 45, 'max_features': 'log2', 'min_samples_leaf': 1, 'min_samples_split': 3, 'n_estimators': 10}. Best is trial 135 with value: 0.9139234933666023.[0m
[32m[I 2021-06-01 14:43:01,067][0m Trial 89 finished with value: 0.9095473852990986 and parameters: {'criterion': 'entropy', 'max_depth': None, 'max_features': 'auto', 'min_samples_leaf': 2, 'min_samples_split': 9, 'n_estimators': 200}. Best is trial 135 with value: 0.9139234933666023.[0m
[32m[I 2021-06-01 14:43:01,365][0m Trial 137 finished with value: 0.9118874641004153 and parameters: {'criterion': 'gini', 'max_depth': 45, 'max_features': 'log2', 'min_samples_leaf': 1, 'min_samples_split': 3, 'n_estimators': 25}. Best is trial 135 with value: 0.9139234933666023.[0m
[32m[I 2021-06-01 14:43:02,518][0m Trial 98 finished with value: 0.9092019698643927 and parameters: {'criterion': 'gini', 'max_depth': None, 'max_features': 'auto', 'min_samples_leaf': 3, 'min_samples_split': 8, 'n_estimators': 250}. Best is trial 135 with value: 0.9139234933666023.[0m
[32m[I 2021-06-01 14:43:02,788][0m Trial 125 finished with value: 0.9104383072914424 and parameters: {'criterion': 'gini', 'max_depth': None, 'max_features': 'auto', 'min_samples_leaf': 1, 'min_samples_split': 8, 'n_estimators': 40}. Best is trial 135 with value: 0.9139234933666023.[0m
[32m[I 2021-06-01 14:43:02,899][0m Trial 131 finished with value: 0.9095479677383445 and parameters: {'criterion': 'gini', 'max_depth': None, 'max_features': 'log2', 'min_samples_leaf': 1, 'min_samples_split': 8, 'n_estimators': 35}. Best is trial 135 with value: 0.9139234933666023.[0m
[32m[I 2021-06-01 14:43:03,197][0m Trial 99 finished with value: 0.9090905766118343 and parameters: {'criterion': 'gini', 'max_depth': None, 'max_features': 'auto', 'min_samples_leaf': 3, 'min_samples_split': 8, 'n_estimators': 245}. Best is trial 135 with value: 0.9139234933666023.[0m
[32m[I 2021-06-01 14:43:04,100][0m Trial 140 finished with value: 0.9114183940232288 and parameters: {'criterion': 'gini', 'max_depth': 45, 'max_features': 'log2', 'min_samples_leaf': 1, 'min_samples_split': 3, 'n_estimators': 25}. Best is trial 135 with value: 0.9139234933666023.[0m
[32m[I 2021-06-01 14:43:04,374][0m Trial 110 finished with value: 0.9099064422787835 and parameters: {'criterion': 'gini', 'max_depth': None, 'max_features': 'auto', 'min_samples_leaf': 1, 'min_samples_split': 8, 'n_estimators': 160}. Best is trial 135 with value: 0.9139234933666023.[0m
[32m[I 2021-06-01 14:43:04,624][0m Trial 141 finished with value: 0.9119446216017959 and parameters: {'criterion': 'gini', 'max_depth': 45, 'max_features': 'log2', 'min_samples_leaf': 1, 'min_samples_split': 3, 'n_estimators': 25}. Best is trial 135 with value: 0.9139234933666023.[0m
[32m[I 2021-06-01 14:43:04,620][0m Trial 77 finished with value: 0.9091986475223433 and parameters: {'criterion': 'entropy', 'max_depth': 35, 'max_features': 'auto', 'min_samples_leaf': 2, 'min_samples_split': 9, 'n_estimators': 300}. Best is trial 135 with value: 0.9139234933666023.[0m
[32m[I 2021-06-01 14:43:08,403][0m Trial 142 finished with value: 0.9123055365068218 and parameters: {'criterion': 'gini', 'max_depth': 45, 'max_features': 'log2', 'min_samples_leaf': 1, 'min_samples_split': 2, 'n_estimators': 25}. Best is trial 135 with value: 0.9139234933666023.[0m
[32m[I 2021-06-01 14:43:08,670][0m Trial 143 finished with value: 0.9124962494604363 and parameters: {'criterion': 'gini', 'max_depth': 45, 'max_features': 'log2', 'min_samples_leaf': 1, 'min_samples_split': 3, 'n_estimators': 25}. Best is trial 135 with value: 0.9139234933666023.[0m
[32m[I 2021-06-01 14:43:09,030][0m Trial 138 finished with value: 0.9099122598351185 and parameters: {'criterion': 'gini', 'max_depth': 45, 'max_features': 'auto', 'min_samples_leaf': 1, 'min_samples_split': 8, 'n_estimators': 25}. Best is trial 135 with value: 0.9139234933666023.[0m
[32m[I 2021-06-01 14:43:09,063][0m Trial 139 finished with value: 0.9105032627603629 and parameters: {'criterion': 'gini', 'max_depth': 45, 'max_features': 'auto', 'min_samples_leaf': 1, 'min_samples_split': 8, 'n_estimators': 25}. Best is trial 135 with value: 0.9139234933666023.[0m
[32m[I 2021-06-01 14:43:09,346][0m Trial 145 finished with value: 0.9116684117261318 and parameters: {'criterion': 'gini', 'max_depth': 45, 'max_features': 'log2', 'min_samples_leaf': 1, 'min_samples_split': 3, 'n_estimators': 25}. Best is trial 135 with value: 0.9139234933666023.[0m
[32m[I 2021-06-01 14:43:09,431][0m Trial 101 finished with value: 0.9091057538749888 and parameters: {'criterion': 'gini', 'max_depth': None, 'max_features': 'auto', 'min_samples_leaf': 3, 'min_samples_split': 8, 'n_estimators': 235}. Best is trial 135 with value: 0.9139234933666023.[0m
[32m[I 2021-06-01 14:43:10,865][0m Trial 147 finished with value: 0.9116226678623743 and parameters: {'criterion': 'gini', 'max_depth': 45, 'max_features': 'log2', 'min_samples_leaf': 1, 'min_samples_split': 3, 'n_estimators': 25}. Best is trial 135 with value: 0.9139234933666023.[0m
[32m[I 2021-06-01 14:43:10,917][0m Trial 146 finished with value: 0.912288730681718 and parameters: {'criterion': 'gini', 'max_depth': 45, 'max_features': 'log2', 'min_samples_leaf': 1, 'min_samples_split': 3, 'n_estimators': 25}. Best is trial 135 with value: 0.9139234933666023.[0m
[32m[I 2021-06-01 14:43:11,159][0m Trial 148 finished with value: 0.9123212579354911 and parameters: {'criterion': 'gini', 'max_depth': 45, 'max_features': 'log2', 'min_samples_leaf': 1, 'min_samples_split': 3, 'n_estimators': 25}. Best is trial 135 with value: 0.9139234933666023.[0m
[32m[I 2021-06-01 14:43:11,382][0m Trial 81 finished with value: 0.9096736229513157 and parameters: {'criterion': 'entropy', 'max_depth': None, 'max_features': 'auto', 'min_samples_leaf': 2, 'min_samples_split': 9, 'n_estimators': 250}. Best is trial 135 with value: 0.9139234933666023.[0m
[32m[I 2021-06-01 14:43:12,125][0m Trial 150 finished with value: 0.9112575852180207 and parameters: {'criterion': 'gini', 'max_depth': 45, 'max_features': 'log2', 'min_samples_leaf': 1, 'min_samples_split': 3, 'n_estimators': 25}. Best is trial 135 with value: 0.9139234933666023.[0m
[32m[I 2021-06-01 14:43:12,449][0m Trial 151 finished with value: 0.9118621160875625 and parameters: {'criterion': 'gini', 'max_depth': 45, 'max_features': 'log2', 'min_samples_leaf': 1, 'min_samples_split': 4, 'n_estimators': 25}. Best is trial 135 with value: 0.9139234933666023.[0m
[32m[I 2021-06-01 14:43:12,562][0m Trial 152 finished with value: 0.9114357397022064 and parameters: {'criterion': 'gini', 'max_depth': 45, 'max_features': 'log2', 'min_samples_leaf': 1, 'min_samples_split': 3, 'n_estimators': 25}. Best is trial 135 with value: 0.9139234933666023.[0m
[32m[I 2021-06-01 14:43:13,043][0m Trial 144 finished with value: 0.9116752514829557 and parameters: {'criterion': 'gini', 'max_depth': 45, 'max_features': 'log2', 'min_samples_leaf': 1, 'min_samples_split': 3, 'n_estimators': 25}. Best is trial 135 with value: 0.9139234933666023.[0m
[32m[I 2021-06-01 14:43:14,479][0m Trial 154 finished with value: 0.9127343312079341 and parameters: {'criterion': 'gini', 'max_depth': 45, 'max_features': 'log2', 'min_samples_leaf': 1, 'min_samples_split': 3, 'n_estimators': 15}. Best is trial 135 with value: 0.9139234933666023.[0m
[32m[I 2021-06-01 14:43:14,494][0m Trial 155 finished with value: 0.913317526831167 and parameters: {'criterion': 'gini', 'max_depth': 45, 'max_features': 'log2', 'min_samples_leaf': 1, 'min_samples_split': 3, 'n_estimators': 15}. Best is trial 135 with value: 0.9139234933666023.[0m
[32m[I 2021-06-01 14:43:14,630][0m Trial 156 finished with value: 0.9132018110901343 and parameters: {'criterion': 'gini', 'max_depth': 45, 'max_features': 'log2', 'min_samples_leaf': 1, 'min_samples_split': 3, 'n_estimators': 15}. Best is trial 135 with value: 0.9139234933666023.[0m
[32m[I 2021-06-01 14:43:16,703][0m Trial 153 finished with value: 0.9122022380536642 and parameters: {'criterion': 'gini', 'max_depth': 45, 'max_features': 'log2', 'min_samples_leaf': 1, 'min_samples_split': 3, 'n_estimators': 25}. Best is trial 135 with value: 0.9139234933666023.[0m
[32m[I 2021-06-01 14:43:19,856][0m Trial 168 finished with value: 0.912418212357785 and parameters: {'criterion': 'gini', 'max_depth': 45, 'max_features': 'log2', 'min_samples_leaf': 1, 'min_samples_split': 4, 'n_estimators': 15}. Best is trial 135 with value: 0.9139234933666023.[0m
[32m[I 2021-06-01 14:43:19,929][0m Trial 170 finished with value: 0.9127081566294919 and parameters: {'criterion': 'gini', 'max_depth': 45, 'max_features': 'log2', 'min_samples_leaf': 1, 'min_samples_split': 4, 'n_estimators': 15}. Best is trial 135 with value: 0.9139234933666023.[0m
[32m[I 2021-06-01 14:43:20,044][0m Trial 157 finished with value: 0.9129383516370003 and parameters: {'criterion': 'gini', 'max_depth': 45, 'max_features': 'log2', 'min_samples_leaf': 1, 'min_samples_split': 3, 'n_estimators': 15}. Best is trial 135 with value: 0.9139234933666023.[0m
[32m[I 2021-06-01 14:43:20,489][0m Trial 158 finished with value: 0.9112400898293138 and parameters: {'criterion': 'gini', 'max_depth': 45, 'max_features': 'log2', 'min_samples_leaf': 1, 'min_samples_split': 3, 'n_estimators': 30}. Best is trial 135 with value: 0.9139234933666023.[0m
[32m[I 2021-06-01 14:43:21,297][0m Trial 159 finished with value: 0.911354086817318 and parameters: {'criterion': 'gini', 'max_depth': 45, 'max_features': 'log2', 'min_samples_leaf': 1, 'min_samples_split': 3, 'n_estimators': 30}. Best is trial 135 with value: 0.9139234933666023.[0m
[32m[I 2021-06-01 14:43:21,741][0m Trial 160 finished with value: 0.9119991215337659 and parameters: {'criterion': 'gini', 'max_depth': 45, 'max_features': 'log2', 'min_samples_leaf': 1, 'min_samples_split': 3, 'n_estimators': 30}. Best is trial 135 with value: 0.9139234933666023.[0m
[32m[I 2021-06-01 14:43:24,015][0m Trial 172 finished with value: 0.9083995541484956 and parameters: {'criterion': 'gini', 'max_depth': 45, 'max_features': 'log2', 'min_samples_leaf': 7, 'min_samples_split': 2, 'n_estimators': 15}. Best is trial 135 with value: 0.9139234933666023.[0m
[32m[I 2021-06-01 14:43:24,939][0m Trial 163 finished with value: 0.9085670116831335 and parameters: {'criterion': 'gini', 'max_depth': 45, 'max_features': 'log2', 'min_samples_leaf': 5, 'min_samples_split': 2, 'n_estimators': 30}. Best is trial 135 with value: 0.9139234933666023.[0m
[32m[I 2021-06-01 14:43:26,082][0m Trial 177 finished with value: 0.9092980566542959 and parameters: {'criterion': 'gini', 'max_depth': 45, 'max_features': 'log2', 'min_samples_leaf': 5, 'min_samples_split': 2, 'n_estimators': 15}. Best is trial 135 with value: 0.9139234933666023.[0m
[32m[I 2021-06-01 14:43:26,977][0m Trial 166 finished with value: 0.9108650958372804 and parameters: {'criterion': 'gini', 'max_depth': 45, 'max_features': 'log2', 'min_samples_leaf': 1, 'min_samples_split': 4, 'n_estimators': 45}. Best is trial 135 with value: 0.9139234933666023.[0m
[32m[I 2021-06-01 14:43:27,681][0m Trial 161 finished with value: 0.9107294390486731 and parameters: {'criterion': 'gini', 'max_depth': 45, 'max_features': 'log2', 'min_samples_leaf': 1, 'min_samples_split': 4, 'n_estimators': 50}. Best is trial 135 with value: 0.9139234933666023.[0m
[32m[I 2021-06-01 14:43:27,820][0m Trial 103 finished with value: 0.9099409663118291 and parameters: {'criterion': 'gini', 'max_depth': None, 'max_features': 'auto', 'min_samples_leaf': 1, 'min_samples_split': 7, 'n_estimators': 235}. Best is trial 135 with value: 0.9139234933666023.[0m
[32m[I 2021-06-01 14:43:29,153][0m Trial 164 finished with value: 0.9104113873103664 and parameters: {'criterion': 'gini', 'max_depth': 45, 'max_features': 'log2', 'min_samples_leaf': 1, 'min_samples_split': 4, 'n_estimators': 55}. Best is trial 135 with value: 0.9139234933666023.[0m
[32m[I 2021-06-01 14:43:29,370][0m Trial 165 finished with value: 0.9107862896806924 and parameters: {'criterion': 'gini', 'max_depth': 45, 'max_features': 'log2', 'min_samples_leaf': 1, 'min_samples_split': 4, 'n_estimators': 55}. Best is trial 135 with value: 0.9139234933666023.[0m
[32m[I 2021-06-01 14:43:29,988][0m Trial 167 finished with value: 0.9111992585856903 and parameters: {'criterion': 'gini', 'max_depth': 45, 'max_features': 'log2', 'min_samples_leaf': 1, 'min_samples_split': 4, 'n_estimators': 50}. Best is trial 135 with value: 0.9139234933666023.[0m
[32m[I 2021-06-01 14:43:30,250][0m Trial 169 finished with value: 0.9111522793884491 and parameters: {'criterion': 'gini', 'max_depth': 45, 'max_features': 'log2', 'min_samples_leaf': 1, 'min_samples_split': 4, 'n_estimators': 50}. Best is trial 135 with value: 0.9139234933666023.[0m
[32m[I 2021-06-01 14:43:32,031][0m Trial 171 finished with value: 0.9128717661290973 and parameters: {'criterion': 'gini', 'max_depth': 45, 'max_features': 'log2', 'min_samples_leaf': 1, 'min_samples_split': 2, 'n_estimators': 50}. Best is trial 135 with value: 0.9139234933666023.[0m
[32m[I 2021-06-01 14:43:32,450][0m Trial 133 finished with value: 0.9092227943754605 and parameters: {'criterion': 'gini', 'max_depth': 25, 'max_features': 'log2', 'min_samples_leaf': 1, 'min_samples_split': 8, 'n_estimators': 160}. Best is trial 135 with value: 0.9139234933666023.[0m
[32m[I 2021-06-01 14:43:32,772][0m Trial 176 finished with value: 0.9083676268861455 and parameters: {'criterion': 'gini', 'max_depth': 45, 'max_features': 'log2', 'min_samples_leaf': 7, 'min_samples_split': 2, 'n_estimators': 50}. Best is trial 135 with value: 0.9139234933666023.[0m
[32m[I 2021-06-01 14:43:33,009][0m Trial 132 finished with value: 0.909353414311829 and parameters: {'criterion': 'gini', 'max_depth': 45, 'max_features': 'log2', 'min_samples_leaf': 1, 'min_samples_split': 8, 'n_estimators': 160}. Best is trial 135 with value: 0.9139234933666023.[0m
[32m[I 2021-06-01 14:43:33,020][0m Trial 182 finished with value: 0.9129327723485072 and parameters: {'criterion': 'gini', 'max_depth': 45, 'max_features': 'log2', 'min_samples_leaf': 1, 'min_samples_split': 3, 'n_estimators': 15}. Best is trial 135 with value: 0.9139234933666023.[0m
[32m[I 2021-06-01 14:43:33,799][0m Trial 162 finished with value: 0.9119370769503898 and parameters: {'criterion': 'gini', 'max_depth': 45, 'max_features': 'log2', 'min_samples_leaf': 1, 'min_samples_split': 2, 'n_estimators': 50}. Best is trial 135 with value: 0.9139234933666023.[0m
[32m[I 2021-06-01 14:43:33,807][0m Trial 181 finished with value: 0.9125718383959581 and parameters: {'criterion': 'gini', 'max_depth': 45, 'max_features': 'log2', 'min_samples_leaf': 1, 'min_samples_split': 3, 'n_estimators': 20}. Best is trial 135 with value: 0.9139234933666023.[0m
[32m[I 2021-06-01 14:43:34,867][0m Trial 105 finished with value: 0.9097557396793576 and parameters: {'criterion': 'gini', 'max_depth': None, 'max_features': 'auto', 'min_samples_leaf': 1, 'min_samples_split': 8, 'n_estimators': 240}. Best is trial 135 with value: 0.9139234933666023.[0m
[32m[I 2021-06-01 14:43:35,289][0m Trial 185 finished with value: 0.9129075658721681 and parameters: {'criterion': 'gini', 'max_depth': 45, 'max_features': 'log2', 'min_samples_leaf': 1, 'min_samples_split': 3, 'n_estimators': 15}. Best is trial 135 with value: 0.9139234933666023.[0m
[32m[I 2021-06-01 14:43:35,428][0m Trial 173 finished with value: 0.9121172764881897 and parameters: {'criterion': 'gini', 'max_depth': 45, 'max_features': 'log2', 'min_samples_leaf': 1, 'min_samples_split': 2, 'n_estimators': 50}. Best is trial 135 with value: 0.9139234933666023.[0m
[32m[I 2021-06-01 14:43:35,729][0m Trial 175 finished with value: 0.9125855250425818 and parameters: {'criterion': 'gini', 'max_depth': 45, 'max_features': 'log2', 'min_samples_leaf': 1, 'min_samples_split': 2, 'n_estimators': 50}. Best is trial 135 with value: 0.9139234933666023.[0m
[32m[I 2021-06-01 14:43:35,794][0m Trial 184 finished with value: 0.9131001908636275 and parameters: {'criterion': 'gini', 'max_depth': 45, 'max_features': 'log2', 'min_samples_leaf': 1, 'min_samples_split': 3, 'n_estimators': 20}. Best is trial 135 with value: 0.9139234933666023.[0m
[32m[I 2021-06-01 14:43:35,796][0m Trial 174 finished with value: 0.9121130976378657 and parameters: {'criterion': 'gini', 'max_depth': 45, 'max_features': 'log2', 'min_samples_leaf': 1, 'min_samples_split': 2, 'n_estimators': 50}. Best is trial 135 with value: 0.9139234933666023.[0m
[32m[I 2021-06-01 14:43:36,891][0m Trial 186 finished with value: 0.9123141751979157 and parameters: {'criterion': 'gini', 'max_depth': 45, 'max_features': 'log2', 'min_samples_leaf': 1, 'min_samples_split': 3, 'n_estimators': 20}. Best is trial 135 with value: 0.9139234933666023.[0m
[32m[I 2021-06-01 14:43:37,423][0m Trial 178 finished with value: 0.9109612325052876 and parameters: {'criterion': 'gini', 'max_depth': 45, 'max_features': 'log2', 'min_samples_leaf': 1, 'min_samples_split': 4, 'n_estimators': 45}. Best is trial 135 with value: 0.9139234933666023.[0m
[32m[I 2021-06-01 14:43:38,060][0m Trial 183 finished with value: 0.9127473073999408 and parameters: {'criterion': 'gini', 'max_depth': 45, 'max_features': 'log2', 'min_samples_leaf': 1, 'min_samples_split': 3, 'n_estimators': 15}. Best is trial 135 with value: 0.9139234933666023.[0m
[32m[I 2021-06-01 14:43:38,270][0m Trial 190 finished with value: 0.9124220485259545 and parameters: {'criterion': 'gini', 'max_depth': 45, 'max_features': 'log2', 'min_samples_leaf': 1, 'min_samples_split': 3, 'n_estimators': 15}. Best is trial 135 with value: 0.9139234933666023.[0m
[32m[I 2021-06-01 14:43:38,810][0m Trial 187 finished with value: 0.9130457537069917 and parameters: {'criterion': 'gini', 'max_depth': 45, 'max_features': 'log2', 'min_samples_leaf': 1, 'min_samples_split': 3, 'n_estimators': 20}. Best is trial 135 with value: 0.9139234933666023.[0m
[32m[I 2021-06-01 14:43:39,093][0m Trial 192 finished with value: 0.9128292346693044 and parameters: {'criterion': 'gini', 'max_depth': 45, 'max_features': 'log2', 'min_samples_leaf': 1, 'min_samples_split': 3, 'n_estimators': 15}. Best is trial 135 with value: 0.9139234933666023.[0m
