2021-06-01 14:33:52.506803: W tensorflow/stream_executor/platform/default/dso_loader.cc:64] Could not load dynamic library 'libcudart.so.11.0'; dlerror: libcudart.so.11.0: cannot open shared object file: No such file or directory; LD_LIBRARY_PATH: /sw/ompi/4.1.1/lib:/sw/ompi/4.1.1/include:/sw/ucx/1.10.0/lib:/sw/gcc/10.2.0/lib64:/sw/gcc/10.2.0/lib
2021-06-01 14:33:52.506853: I tensorflow/stream_executor/cuda/cudart_stub.cc:29] Ignore above cudart dlerror if you do not have a GPU set up on your machine.
2021-06-01 14:33:52.506879: W tensorflow/stream_executor/platform/default/dso_loader.cc:64] Could not load dynamic library 'libcudart.so.11.0'; dlerror: libcudart.so.11.0: cannot open shared object file: No such file or directory; LD_LIBRARY_PATH: /sw/ompi/4.1.1/lib:/sw/ompi/4.1.1/include:/sw/ucx/1.10.0/lib:/sw/gcc/10.2.0/lib64:/sw/gcc/10.2.0/lib
2021-06-01 14:33:52.506922: I tensorflow/stream_executor/cuda/cudart_stub.cc:29] Ignore above cudart dlerror if you do not have a GPU set up on your machine.
2021-06-01 14:33:52.506796: W tensorflow/stream_executor/platform/default/dso_loader.cc:64] Could not load dynamic library 'libcudart.so.11.0'; dlerror: libcudart.so.11.0: cannot open shared object file: No such file or directory; LD_LIBRARY_PATH: /sw/ompi/4.1.1/lib:/sw/ompi/4.1.1/include:/sw/ucx/1.10.0/lib:/sw/gcc/10.2.0/lib64:/sw/gcc/10.2.0/lib
2021-06-01 14:33:52.506852: I tensorflow/stream_executor/cuda/cudart_stub.cc:29] Ignore above cudart dlerror if you do not have a GPU set up on your machine.
2021-06-01 14:33:52.506816: W tensorflow/stream_executor/platform/default/dso_loader.cc:64] Could not load dynamic library 'libcudart.so.11.0'; dlerror: libcudart.so.11.0: cannot open shared object file: No such file or directory; LD_LIBRARY_PATH: /sw/ompi/4.1.1/lib:/sw/ompi/4.1.1/include:/sw/ucx/1.10.0/lib:/sw/gcc/10.2.0/lib64:/sw/gcc/10.2.0/lib
2021-06-01 14:33:52.506862: I tensorflow/stream_executor/cuda/cudart_stub.cc:29] Ignore above cudart dlerror if you do not have a GPU set up on your machine.
2021-06-01 14:33:52.507060: W tensorflow/stream_executor/platform/default/dso_loader.cc:64] Could not load dynamic library 'libcudart.so.11.0'; dlerror: libcudart.so.11.0: cannot open shared object file: No such file or directory; LD_LIBRARY_PATH: /sw/ompi/4.1.1/lib:/sw/ompi/4.1.1/include:/sw/ucx/1.10.0/lib:/sw/gcc/10.2.0/lib64:/sw/gcc/10.2.0/lib
2021-06-01 14:33:52.507099: I tensorflow/stream_executor/cuda/cudart_stub.cc:29] Ignore above cudart dlerror if you do not have a GPU set up on your machine.
2021-06-01 14:33:52.507068: W tensorflow/stream_executor/platform/default/dso_loader.cc:64] Could not load dynamic library 'libcudart.so.11.0'; dlerror: libcudart.so.11.0: cannot open shared object file: No such file or directory; LD_LIBRARY_PATH: /sw/ompi/4.1.1/lib:/sw/ompi/4.1.1/include:/sw/ucx/1.10.0/lib:/sw/gcc/10.2.0/lib64:/sw/gcc/10.2.0/lib
2021-06-01 14:33:52.507108: I tensorflow/stream_executor/cuda/cudart_stub.cc:29] Ignore above cudart dlerror if you do not have a GPU set up on your machine.
2021-06-01 14:33:52.507063: W tensorflow/stream_executor/platform/default/dso_loader.cc:64] Could not load dynamic library 'libcudart.so.11.0'; dlerror: libcudart.so.11.0: cannot open shared object file: No such file or directory; LD_LIBRARY_PATH: /sw/ompi/4.1.1/lib:/sw/ompi/4.1.1/include:/sw/ucx/1.10.0/lib:/sw/gcc/10.2.0/lib64:/sw/gcc/10.2.0/lib
2021-06-01 14:33:52.507101: I tensorflow/stream_executor/cuda/cudart_stub.cc:29] Ignore above cudart dlerror if you do not have a GPU set up on your machine.
2021-06-01 14:33:52.507077: W tensorflow/stream_executor/platform/default/dso_loader.cc:64] Could not load dynamic library 'libcudart.so.11.0'; dlerror: libcudart.so.11.0: cannot open shared object file: No such file or directory; LD_LIBRARY_PATH: /sw/ompi/4.1.1/lib:/sw/ompi/4.1.1/include:/sw/ucx/1.10.0/lib:/sw/gcc/10.2.0/lib64:/sw/gcc/10.2.0/lib
2021-06-01 14:33:52.507112: I tensorflow/stream_executor/cuda/cudart_stub.cc:29] Ignore above cudart dlerror if you do not have a GPU set up on your machine.
2021-06-01 14:33:52.507440: W tensorflow/stream_executor/platform/default/dso_loader.cc:64] Could not load dynamic library 'libcudart.so.11.0'; dlerror: libcudart.so.11.0: cannot open shared object file: No such file or directory; LD_LIBRARY_PATH: /sw/ompi/4.1.1/lib:/sw/ompi/4.1.1/include:/sw/ucx/1.10.0/lib:/sw/gcc/10.2.0/lib64:/sw/gcc/10.2.0/lib
2021-06-01 14:33:52.507488: I tensorflow/stream_executor/cuda/cudart_stub.cc:29] Ignore above cudart dlerror if you do not have a GPU set up on your machine.
2021-06-01 14:33:52.507096: W tensorflow/stream_executor/platform/default/dso_loader.cc:64] Could not load dynamic library 'libcudart.so.11.0'; dlerror: libcudart.so.11.0: cannot open shared object file: No such file or directory; LD_LIBRARY_PATH: /sw/ompi/4.1.1/lib:/sw/ompi/4.1.1/include:/sw/ucx/1.10.0/lib:/sw/gcc/10.2.0/lib64:/sw/gcc/10.2.0/lib
2021-06-01 14:33:52.507140: I tensorflow/stream_executor/cuda/cudart_stub.cc:29] Ignore above cudart dlerror if you do not have a GPU set up on your machine.
2021-06-01 14:33:52.507366: W tensorflow/stream_executor/platform/default/dso_loader.cc:64] Could not load dynamic library 'libcudart.so.11.0'; dlerror: libcudart.so.11.0: cannot open shared object file: No such file or directory; LD_LIBRARY_PATH: /sw/ompi/4.1.1/lib:/sw/ompi/4.1.1/include:/sw/ucx/1.10.0/lib:/sw/gcc/10.2.0/lib64:/sw/gcc/10.2.0/lib
2021-06-01 14:33:52.507407: I tensorflow/stream_executor/cuda/cudart_stub.cc:29] Ignore above cudart dlerror if you do not have a GPU set up on your machine.
2021-06-01 14:33:52.507410: W tensorflow/stream_executor/platform/default/dso_loader.cc:64] Could not load dynamic library 'libcudart.so.11.0'; dlerror: libcudart.so.11.0: cannot open shared object file: No such file or directory; LD_LIBRARY_PATH: /sw/ompi/4.1.1/lib:/sw/ompi/4.1.1/include:/sw/ucx/1.10.0/lib:/sw/gcc/10.2.0/lib64:/sw/gcc/10.2.0/lib
2021-06-01 14:33:52.507451: I tensorflow/stream_executor/cuda/cudart_stub.cc:29] Ignore above cudart dlerror if you do not have a GPU set up on your machine.
2021-06-01 14:33:52.507390: W tensorflow/stream_executor/platform/default/dso_loader.cc:64] Could not load dynamic library 'libcudart.so.11.0'; dlerror: libcudart.so.11.0: cannot open shared object file: No such file or directory; LD_LIBRARY_PATH: /sw/ompi/4.1.1/lib:/sw/ompi/4.1.1/include:/sw/ucx/1.10.0/lib:/sw/gcc/10.2.0/lib64:/sw/gcc/10.2.0/lib
2021-06-01 14:33:52.507431: I tensorflow/stream_executor/cuda/cudart_stub.cc:29] Ignore above cudart dlerror if you do not have a GPU set up on your machine.
2021-06-01 14:33:52.507308: W tensorflow/stream_executor/platform/default/dso_loader.cc:64] Could not load dynamic library 'libcudart.so.11.0'; dlerror: libcudart.so.11.0: cannot open shared object file: No such file or directory; LD_LIBRARY_PATH: /sw/ompi/4.1.1/lib:/sw/ompi/4.1.1/include:/sw/ucx/1.10.0/lib:/sw/gcc/10.2.0/lib64:/sw/gcc/10.2.0/lib
2021-06-01 14:33:52.507348: I tensorflow/stream_executor/cuda/cudart_stub.cc:29] Ignore above cudart dlerror if you do not have a GPU set up on your machine.
2021-06-01 14:33:52.507136: W tensorflow/stream_executor/platform/default/dso_loader.cc:64] Could not load dynamic library 'libcudart.so.11.0'; dlerror: libcudart.so.11.0: cannot open shared object file: No such file or directory; LD_LIBRARY_PATH: /sw/ompi/4.1.1/lib:/sw/ompi/4.1.1/include:/sw/ucx/1.10.0/lib:/sw/gcc/10.2.0/lib64:/sw/gcc/10.2.0/lib
2021-06-01 14:33:52.507180: I tensorflow/stream_executor/cuda/cudart_stub.cc:29] Ignore above cudart dlerror if you do not have a GPU set up on your machine.
2021-06-01 14:33:52.507257: W tensorflow/stream_executor/platform/default/dso_loader.cc:64] Could not load dynamic library 'libcudart.so.11.0'; dlerror: libcudart.so.11.0: cannot open shared object file: No such file or directory; LD_LIBRARY_PATH: /sw/ompi/4.1.1/lib:/sw/ompi/4.1.1/include:/sw/ucx/1.10.0/lib:/sw/gcc/10.2.0/lib64:/sw/gcc/10.2.0/lib
2021-06-01 14:33:52.507296: I tensorflow/stream_executor/cuda/cudart_stub.cc:29] Ignore above cudart dlerror if you do not have a GPU set up on your machine.
2021-06-01 14:33:52.507294: W tensorflow/stream_executor/platform/default/dso_loader.cc:64] Could not load dynamic library 'libcudart.so.11.0'; dlerror: libcudart.so.11.0: cannot open shared object file: No such file or directory; LD_LIBRARY_PATH: /sw/ompi/4.1.1/lib:/sw/ompi/4.1.1/include:/sw/ucx/1.10.0/lib:/sw/gcc/10.2.0/lib64:/sw/gcc/10.2.0/lib
2021-06-01 14:33:52.507333: I tensorflow/stream_executor/cuda/cudart_stub.cc:29] Ignore above cudart dlerror if you do not have a GPU set up on your machine.
2021-06-01 14:33:52.507285: W tensorflow/stream_executor/platform/default/dso_loader.cc:64] Could not load dynamic library 'libcudart.so.11.0'; dlerror: libcudart.so.11.0: cannot open shared object file: No such file or directory; LD_LIBRARY_PATH: /sw/ompi/4.1.1/lib:/sw/ompi/4.1.1/include:/sw/ucx/1.10.0/lib:/sw/gcc/10.2.0/lib64:/sw/gcc/10.2.0/lib
2021-06-01 14:33:52.507327: I tensorflow/stream_executor/cuda/cudart_stub.cc:29] Ignore above cudart dlerror if you do not have a GPU set up on your machine.
2021-06-01 14:33:52.507402: W tensorflow/stream_executor/platform/default/dso_loader.cc:64] Could not load dynamic library 'libcudart.so.11.0'; dlerror: libcudart.so.11.0: cannot open shared object file: No such file or directory; LD_LIBRARY_PATH: /sw/ompi/4.1.1/lib:/sw/ompi/4.1.1/include:/sw/ucx/1.10.0/lib:/sw/gcc/10.2.0/lib64:/sw/gcc/10.2.0/lib
2021-06-01 14:33:52.507442: I tensorflow/stream_executor/cuda/cudart_stub.cc:29] Ignore above cudart dlerror if you do not have a GPU set up on your machine.
2021-06-01 14:33:52.507377: W tensorflow/stream_executor/platform/default/dso_loader.cc:64] Could not load dynamic library 'libcudart.so.11.0'; dlerror: libcudart.so.11.0: cannot open shared object file: No such file or directory; LD_LIBRARY_PATH: /sw/ompi/4.1.1/lib:/sw/ompi/4.1.1/include:/sw/ucx/1.10.0/lib:/sw/gcc/10.2.0/lib64:/sw/gcc/10.2.0/lib
2021-06-01 14:33:52.507418: I tensorflow/stream_executor/cuda/cudart_stub.cc:29] Ignore above cudart dlerror if you do not have a GPU set up on your machine.
2021-06-01 14:33:52.507231: W tensorflow/stream_executor/platform/default/dso_loader.cc:64] Could not load dynamic library 'libcudart.so.11.0'; dlerror: libcudart.so.11.0: cannot open shared object file: No such file or directory; LD_LIBRARY_PATH: /sw/ompi/4.1.1/lib:/sw/ompi/4.1.1/include:/sw/ucx/1.10.0/lib:/sw/gcc/10.2.0/lib64:/sw/gcc/10.2.0/lib
2021-06-01 14:33:52.507269: I tensorflow/stream_executor/cuda/cudart_stub.cc:29] Ignore above cudart dlerror if you do not have a GPU set up on your machine.
2021-06-01 14:33:52.507253: W tensorflow/stream_executor/platform/default/dso_loader.cc:64] Could not load dynamic library 'libcudart.so.11.0'; dlerror: libcudart.so.11.0: cannot open shared object file: No such file or directory; LD_LIBRARY_PATH: /sw/ompi/4.1.1/lib:/sw/ompi/4.1.1/include:/sw/ucx/1.10.0/lib:/sw/gcc/10.2.0/lib64:/sw/gcc/10.2.0/lib
2021-06-01 14:33:52.507292: I tensorflow/stream_executor/cuda/cudart_stub.cc:29] Ignore above cudart dlerror if you do not have a GPU set up on your machine.
2021-06-01 14:33:52.507371: W tensorflow/stream_executor/platform/default/dso_loader.cc:64] Could not load dynamic library 'libcudart.so.11.0'; dlerror: libcudart.so.11.0: cannot open shared object file: No such file or directory; LD_LIBRARY_PATH: /sw/ompi/4.1.1/lib:/sw/ompi/4.1.1/include:/sw/ucx/1.10.0/lib:/sw/gcc/10.2.0/lib64:/sw/gcc/10.2.0/lib
2021-06-01 14:33:52.507412: I tensorflow/stream_executor/cuda/cudart_stub.cc:29] Ignore above cudart dlerror if you do not have a GPU set up on your machine.
2021-06-01 14:33:52.507362: W tensorflow/stream_executor/platform/default/dso_loader.cc:64] Could not load dynamic library 'libcudart.so.11.0'; dlerror: libcudart.so.11.0: cannot open shared object file: No such file or directory; LD_LIBRARY_PATH: /sw/ompi/4.1.1/lib:/sw/ompi/4.1.1/include:/sw/ucx/1.10.0/lib:/sw/gcc/10.2.0/lib64:/sw/gcc/10.2.0/lib
2021-06-01 14:33:52.507402: I tensorflow/stream_executor/cuda/cudart_stub.cc:29] Ignore above cudart dlerror if you do not have a GPU set up on your machine.
2021-06-01 14:33:52.507202: W tensorflow/stream_executor/platform/default/dso_loader.cc:64] Could not load dynamic library 'libcudart.so.11.0'; dlerror: libcudart.so.11.0: cannot open shared object file: No such file or directory; LD_LIBRARY_PATH: /sw/ompi/4.1.1/lib:/sw/ompi/4.1.1/include:/sw/ucx/1.10.0/lib:/sw/gcc/10.2.0/lib64:/sw/gcc/10.2.0/lib
2021-06-01 14:33:52.507241: I tensorflow/stream_executor/cuda/cudart_stub.cc:29] Ignore above cudart dlerror if you do not have a GPU set up on your machine.
2021-06-01 14:33:52.507347: W tensorflow/stream_executor/platform/default/dso_loader.cc:64] Could not load dynamic library 'libcudart.so.11.0'; dlerror: libcudart.so.11.0: cannot open shared object file: No such file or directory; LD_LIBRARY_PATH: /sw/ompi/4.1.1/lib:/sw/ompi/4.1.1/include:/sw/ucx/1.10.0/lib:/sw/gcc/10.2.0/lib64:/sw/gcc/10.2.0/lib
2021-06-01 14:33:52.507386: I tensorflow/stream_executor/cuda/cudart_stub.cc:29] Ignore above cudart dlerror if you do not have a GPU set up on your machine.
2021-06-01 14:33:52.507204: W tensorflow/stream_executor/platform/default/dso_loader.cc:64] Could not load dynamic library 'libcudart.so.11.0'; dlerror: libcudart.so.11.0: cannot open shared object file: No such file or directory; LD_LIBRARY_PATH: /sw/ompi/4.1.1/lib:/sw/ompi/4.1.1/include:/sw/ucx/1.10.0/lib:/sw/gcc/10.2.0/lib64:/sw/gcc/10.2.0/lib
2021-06-01 14:33:52.507243: I tensorflow/stream_executor/cuda/cudart_stub.cc:29] Ignore above cudart dlerror if you do not have a GPU set up on your machine.
2021-06-01 14:33:52.507281: W tensorflow/stream_executor/platform/default/dso_loader.cc:64] Could not load dynamic library 'libcudart.so.11.0'; dlerror: libcudart.so.11.0: cannot open shared object file: No such file or directory; LD_LIBRARY_PATH: /sw/ompi/4.1.1/lib:/sw/ompi/4.1.1/include:/sw/ucx/1.10.0/lib:/sw/gcc/10.2.0/lib64:/sw/gcc/10.2.0/lib
2021-06-01 14:33:52.507320: I tensorflow/stream_executor/cuda/cudart_stub.cc:29] Ignore above cudart dlerror if you do not have a GPU set up on your machine.
[32m[I 2021-06-01 14:36:01,371][0m Trial 19 finished with value: 0.9083732464673056 and parameters: {'criterion': 'gini', 'max_depth': 5, 'max_features': 'log2', 'min_samples_leaf': 7, 'min_samples_split': 3, 'n_estimators': 35}. Best is trial 19 with value: 0.9083732464673056.[0m
[32m[I 2021-06-01 14:36:14,043][0m Trial 21 finished with value: 0.9083733405188731 and parameters: {'criterion': 'gini', 'max_depth': 5, 'max_features': 'auto', 'min_samples_leaf': 4, 'min_samples_split': 2, 'n_estimators': 95}. Best is trial 21 with value: 0.9083733405188731.[0m
[32m[I 2021-06-01 14:36:23,467][0m Trial 25 finished with value: 0.9083745161634672 and parameters: {'criterion': 'gini', 'max_depth': 45, 'max_features': 'log2', 'min_samples_leaf': 10, 'min_samples_split': 8, 'n_estimators': 130}. Best is trial 25 with value: 0.9083745161634672.[0m
[32m[I 2021-06-01 14:36:24,464][0m Trial 3 finished with value: 0.9083738578024946 and parameters: {'criterion': 'gini', 'max_depth': 5, 'max_features': 'sqrt', 'min_samples_leaf': 5, 'min_samples_split': 5, 'n_estimators': 170}. Best is trial 25 with value: 0.9083745161634672.[0m
[32m[I 2021-06-01 14:36:25,208][0m Trial 15 finished with value: 0.9083739283411703 and parameters: {'criterion': 'gini', 'max_depth': 45, 'max_features': 'log2', 'min_samples_leaf': 9, 'min_samples_split': 10, 'n_estimators': 145}. Best is trial 25 with value: 0.9083745161634672.[0m
[32m[I 2021-06-01 14:36:30,630][0m Trial 12 finished with value: 0.9097707979510293 and parameters: {'criterion': 'entropy', 'max_depth': None, 'max_features': 'log2', 'min_samples_leaf': 2, 'min_samples_split': 6, 'n_estimators': 65}. Best is trial 12 with value: 0.9097707979510293.[0m
[32m[I 2021-06-01 14:36:30,692][0m Trial 32 finished with value: 0.9084300493874219 and parameters: {'criterion': 'gini', 'max_depth': 45, 'max_features': 'log2', 'min_samples_leaf': 10, 'min_samples_split': 2, 'n_estimators': 10}. Best is trial 12 with value: 0.9097707979510293.[0m
[32m[I 2021-06-01 14:36:36,911][0m Trial 27 finished with value: 0.908373951854062 and parameters: {'criterion': 'gini', 'max_depth': 5, 'max_features': 'sqrt', 'min_samples_leaf': 10, 'min_samples_split': 10, 'n_estimators': 215}. Best is trial 12 with value: 0.9097707979510293.[0m
[32m[I 2021-06-01 14:36:37,590][0m Trial 18 finished with value: 0.9083739753669541 and parameters: {'criterion': 'gini', 'max_depth': 30, 'max_features': 'auto', 'min_samples_leaf': 9, 'min_samples_split': 3, 'n_estimators': 105}. Best is trial 12 with value: 0.9097707979510293.[0m
[32m[I 2021-06-01 14:36:40,364][0m Trial 17 finished with value: 0.909097222014166 and parameters: {'criterion': 'entropy', 'max_depth': 40, 'max_features': 'log2', 'min_samples_leaf': 3, 'min_samples_split': 4, 'n_estimators': 85}. Best is trial 12 with value: 0.9097707979510293.[0m
[32m[I 2021-06-01 14:36:44,592][0m Trial 11 finished with value: 0.9089395837323657 and parameters: {'criterion': 'gini', 'max_depth': 30, 'max_features': 'log2', 'min_samples_leaf': 2, 'min_samples_split': 7, 'n_estimators': 185}. Best is trial 12 with value: 0.9097707979510293.[0m
[32m[I 2021-06-01 14:36:45,526][0m Trial 16 finished with value: 0.9083742340087646 and parameters: {'criterion': 'gini', 'max_depth': 5, 'max_features': 'sqrt', 'min_samples_leaf': 8, 'min_samples_split': 10, 'n_estimators': 270}. Best is trial 12 with value: 0.9097707979510293.[0m
[32m[I 2021-06-01 14:36:47,959][0m Trial 8 finished with value: 0.9084360213231811 and parameters: {'criterion': 'gini', 'max_depth': 40, 'max_features': 'log2', 'min_samples_leaf': 6, 'min_samples_split': 3, 'n_estimators': 230}. Best is trial 12 with value: 0.9097707979510293.[0m
[32m[I 2021-06-01 14:36:54,300][0m Trial 36 finished with value: 0.9083739753669541 and parameters: {'criterion': 'gini', 'max_depth': 25, 'max_features': 'sqrt', 'min_samples_leaf': 10, 'min_samples_split': 2, 'n_estimators': 45}. Best is trial 12 with value: 0.9097707979510293.[0m
[32m[I 2021-06-01 14:36:54,854][0m Trial 23 finished with value: 0.9091464466330923 and parameters: {'criterion': 'gini', 'max_depth': 40, 'max_features': 'log2', 'min_samples_leaf': 3, 'min_samples_split': 2, 'n_estimators': 235}. Best is trial 12 with value: 0.9097707979510293.[0m
[32m[I 2021-06-01 14:36:58,463][0m Trial 0 finished with value: 0.9083669875048758 and parameters: {'criterion': 'gini', 'max_depth': 20, 'max_features': 'auto', 'min_samples_leaf': 8, 'min_samples_split': 2, 'n_estimators': 170}. Best is trial 12 with value: 0.9097707979510293.[0m
[32m[I 2021-06-01 14:37:06,003][0m Trial 14 finished with value: 0.9088293364422919 and parameters: {'criterion': 'entropy', 'max_depth': 35, 'max_features': 'sqrt', 'min_samples_leaf': 4, 'min_samples_split': 10, 'n_estimators': 80}. Best is trial 12 with value: 0.9097707979510293.[0m
[32m[I 2021-06-01 14:37:13,531][0m Trial 34 finished with value: 0.9097317283717727 and parameters: {'criterion': 'entropy', 'max_depth': 30, 'max_features': 'auto', 'min_samples_leaf': 2, 'min_samples_split': 7, 'n_estimators': 45}. Best is trial 12 with value: 0.9097707979510293.[0m
[32m[I 2021-06-01 14:37:15,991][0m Trial 38 finished with value: 0.9102754593069214 and parameters: {'criterion': 'entropy', 'max_depth': 40, 'max_features': 'log2', 'min_samples_leaf': 1, 'min_samples_split': 5, 'n_estimators': 50}. Best is trial 38 with value: 0.9102754593069214.[0m
[32m[I 2021-06-01 14:37:16,225][0m Trial 33 finished with value: 0.9084730752038533 and parameters: {'criterion': 'entropy', 'max_depth': 30, 'max_features': 'log2', 'min_samples_leaf': 4, 'min_samples_split': 10, 'n_estimators': 95}. Best is trial 38 with value: 0.9102754593069214.[0m
[32m[I 2021-06-01 14:37:16,238][0m Trial 28 finished with value: 0.9088107140525388 and parameters: {'criterion': 'gini', 'max_depth': 30, 'max_features': 'sqrt', 'min_samples_leaf': 4, 'min_samples_split': 5, 'n_estimators': 170}. Best is trial 38 with value: 0.9102754593069214.[0m
[32m[I 2021-06-01 14:37:23,359][0m Trial 40 finished with value: 0.9105296895642994 and parameters: {'criterion': 'entropy', 'max_depth': None, 'max_features': 'log2', 'min_samples_leaf': 1, 'min_samples_split': 5, 'n_estimators': 60}. Best is trial 40 with value: 0.9105296895642994.[0m
[32m[I 2021-06-01 14:37:26,196][0m Trial 39 finished with value: 0.9104943715903306 and parameters: {'criterion': 'entropy', 'max_depth': None, 'max_features': 'log2', 'min_samples_leaf': 1, 'min_samples_split': 5, 'n_estimators': 70}. Best is trial 40 with value: 0.9105296895642994.[0m
[32m[I 2021-06-01 14:37:26,699][0m Trial 46 finished with value: 0.9114280742548546 and parameters: {'criterion': 'entropy', 'max_depth': None, 'max_features': 'auto', 'min_samples_leaf': 1, 'min_samples_split': 7, 'n_estimators': 10}. Best is trial 46 with value: 0.9114280742548546.[0m
[32m[I 2021-06-01 14:37:29,301][0m Trial 49 finished with value: 0.9119226777658795 and parameters: {'criterion': 'entropy', 'max_depth': None, 'max_features': 'log2', 'min_samples_leaf': 1, 'min_samples_split': 6, 'n_estimators': 10}. Best is trial 49 with value: 0.9119226777658795.[0m
[32m[I 2021-06-01 14:37:36,254][0m Trial 41 finished with value: 0.91032721045298 and parameters: {'criterion': 'entropy', 'max_depth': None, 'max_features': 'log2', 'min_samples_leaf': 1, 'min_samples_split': 6, 'n_estimators': 70}. Best is trial 49 with value: 0.9119226777658795.[0m
[32m[I 2021-06-01 14:37:37,059][0m Trial 51 finished with value: 0.9114245777899977 and parameters: {'criterion': 'entropy', 'max_depth': None, 'max_features': 'auto', 'min_samples_leaf': 1, 'min_samples_split': 8, 'n_estimators': 10}. Best is trial 49 with value: 0.9119226777658795.[0m
