[32m[I 2021-06-01 14:41:42,360][0m Trial 221 finished with value: 0.9574150791027807 and parameters: {'criterion': 'gini', 'max_depth': 30, 'max_features': 'auto', 'min_samples_leaf': 2, 'min_samples_split': 3, 'n_estimators': 20}. Best is trial 184 with value: 0.9598840528678435.[0m
[32m[I 2021-06-01 14:41:43,129][0m Trial 225 finished with value: 0.9582388583789003 and parameters: {'criterion': 'gini', 'max_depth': 25, 'max_features': 'auto', 'min_samples_leaf': 1, 'min_samples_split': 3, 'n_estimators': 20}. Best is trial 184 with value: 0.9598840528678435.[0m
[32m[I 2021-06-01 14:41:43,181][0m Trial 223 finished with value: 0.957879264972558 and parameters: {'criterion': 'gini', 'max_depth': 30, 'max_features': 'auto', 'min_samples_leaf': 1, 'min_samples_split': 3, 'n_estimators': 20}. Best is trial 184 with value: 0.9598840528678435.[0m
[32m[I 2021-06-01 14:41:44,056][0m Trial 224 finished with value: 0.9580562713218075 and parameters: {'criterion': 'gini', 'max_depth': 30, 'max_features': 'auto', 'min_samples_leaf': 1, 'min_samples_split': 3, 'n_estimators': 20}. Best is trial 184 with value: 0.9598840528678435.[0m
[32m[I 2021-06-01 14:41:44,171][0m Trial 227 finished with value: 0.9581964559563595 and parameters: {'criterion': 'gini', 'max_depth': 30, 'max_features': 'auto', 'min_samples_leaf': 1, 'min_samples_split': 3, 'n_estimators': 20}. Best is trial 184 with value: 0.9598840528678435.[0m
[32m[I 2021-06-01 14:41:44,447][0m Trial 228 finished with value: 0.9577790834509823 and parameters: {'criterion': 'gini', 'max_depth': 30, 'max_features': 'auto', 'min_samples_leaf': 1, 'min_samples_split': 3, 'n_estimators': 20}. Best is trial 184 with value: 0.9598840528678435.[0m
[32m[I 2021-06-01 14:41:44,669][0m Trial 217 finished with value: 0.9572204079717069 and parameters: {'criterion': 'gini', 'max_depth': 30, 'max_features': 'auto', 'min_samples_leaf': 2, 'min_samples_split': 3, 'n_estimators': 20}. Best is trial 184 with value: 0.9598840528678435.[0m
[32m[I 2021-06-01 14:41:44,695][0m Trial 229 finished with value: 0.9581474319553566 and parameters: {'criterion': 'gini', 'max_depth': 30, 'max_features': 'auto', 'min_samples_leaf': 1, 'min_samples_split': 3, 'n_estimators': 20}. Best is trial 184 with value: 0.9598840528678435.[0m
[32m[I 2021-06-01 14:41:45,432][0m Trial 230 finished with value: 0.9581735510717818 and parameters: {'criterion': 'gini', 'max_depth': 30, 'max_features': 'auto', 'min_samples_leaf': 1, 'min_samples_split': 3, 'n_estimators': 20}. Best is trial 184 with value: 0.9598840528678435.[0m
[32m[I 2021-06-01 14:41:45,867][0m Trial 216 finished with value: 0.957908840057885 and parameters: {'criterion': 'gini', 'max_depth': 30, 'max_features': 'auto', 'min_samples_leaf': 1, 'min_samples_split': 3, 'n_estimators': 20}. Best is trial 184 with value: 0.9598840528678435.[0m
[32m[I 2021-06-01 14:41:46,471][0m Trial 208 finished with value: 0.9581379030362992 and parameters: {'criterion': 'entropy', 'max_depth': 25, 'max_features': 'auto', 'min_samples_leaf': 1, 'min_samples_split': 3, 'n_estimators': 15}. Best is trial 184 with value: 0.9598840528678435.[0m
[32m[I 2021-06-01 14:41:48,579][0m Trial 218 finished with value: 0.9577946465038197 and parameters: {'criterion': 'gini', 'max_depth': 30, 'max_features': 'auto', 'min_samples_leaf': 1, 'min_samples_split': 3, 'n_estimators': 20}. Best is trial 184 with value: 0.9598840528678435.[0m
[32m[I 2021-06-01 14:41:48,917][0m Trial 214 finished with value: 0.9581090874582827 and parameters: {'criterion': 'gini', 'max_depth': 30, 'max_features': 'auto', 'min_samples_leaf': 1, 'min_samples_split': 3, 'n_estimators': 20}. Best is trial 184 with value: 0.9598840528678435.[0m
[32m[I 2021-06-01 14:41:49,224][0m Trial 210 finished with value: 0.9574648169345445 and parameters: {'criterion': 'entropy', 'max_depth': 30, 'max_features': 'auto', 'min_samples_leaf': 1, 'min_samples_split': 3, 'n_estimators': 20}. Best is trial 184 with value: 0.9598840528678435.[0m
[32m[I 2021-06-01 14:41:49,299][0m Trial 220 finished with value: 0.9579487433418039 and parameters: {'criterion': 'entropy', 'max_depth': 30, 'max_features': 'auto', 'min_samples_leaf': 2, 'min_samples_split': 3, 'n_estimators': 20}. Best is trial 184 with value: 0.9598840528678435.[0m
[32m[I 2021-06-01 14:41:49,505][0m Trial 215 finished with value: 0.9582260588697397 and parameters: {'criterion': 'entropy', 'max_depth': 25, 'max_features': 'auto', 'min_samples_leaf': 2, 'min_samples_split': 3, 'n_estimators': 20}. Best is trial 184 with value: 0.9598840528678435.[0m
[32m[I 2021-06-01 14:41:49,526][0m Trial 178 finished with value: 0.9575365877043914 and parameters: {'criterion': 'entropy', 'max_depth': 25, 'max_features': 'auto', 'min_samples_leaf': 1, 'min_samples_split': 3, 'n_estimators': 45}. Best is trial 184 with value: 0.9598840528678435.[0m
[32m[I 2021-06-01 14:41:50,379][0m Trial 213 finished with value: 0.9578312087174948 and parameters: {'criterion': 'gini', 'max_depth': 30, 'max_features': 'auto', 'min_samples_leaf': 1, 'min_samples_split': 3, 'n_estimators': 20}. Best is trial 184 with value: 0.9598840528678435.[0m
[32m[I 2021-06-01 14:41:50,444][0m Trial 219 finished with value: 0.9583040961273609 and parameters: {'criterion': 'gini', 'max_depth': 30, 'max_features': 'auto', 'min_samples_leaf': 1, 'min_samples_split': 3, 'n_estimators': 20}. Best is trial 184 with value: 0.9598840528678435.[0m
[32m[I 2021-06-01 14:41:50,636][0m Trial 226 finished with value: 0.9579107815044265 and parameters: {'criterion': 'gini', 'max_depth': 30, 'max_features': 'auto', 'min_samples_leaf': 1, 'min_samples_split': 3, 'n_estimators': 20}. Best is trial 184 with value: 0.9598840528678435.[0m
[32m[I 2021-06-01 14:41:51,421][0m Trial 212 finished with value: 0.9576038959101314 and parameters: {'criterion': 'gini', 'max_depth': 30, 'max_features': 'auto', 'min_samples_leaf': 1, 'min_samples_split': 3, 'n_estimators': 20}. Best is trial 184 with value: 0.9598840528678435.[0m
[32m[I 2021-06-01 14:41:52,494][0m Trial 235 finished with value: 0.9592427174911957 and parameters: {'criterion': 'entropy', 'max_depth': 25, 'max_features': 'auto', 'min_samples_leaf': 1, 'min_samples_split': 3, 'n_estimators': 10}. Best is trial 184 with value: 0.9598840528678435.[0m
[32m[I 2021-06-01 14:41:53,416][0m Trial 237 finished with value: 0.9587574211614525 and parameters: {'criterion': 'entropy', 'max_depth': 25, 'max_features': 'auto', 'min_samples_leaf': 1, 'min_samples_split': 3, 'n_estimators': 10}. Best is trial 184 with value: 0.9598840528678435.[0m
[32m[I 2021-06-01 14:41:53,666][0m Trial 236 finished with value: 0.9595029246863348 and parameters: {'criterion': 'entropy', 'max_depth': 25, 'max_features': 'auto', 'min_samples_leaf': 1, 'min_samples_split': 3, 'n_estimators': 10}. Best is trial 184 with value: 0.9598840528678435.[0m
[32m[I 2021-06-01 14:41:54,134][0m Trial 238 finished with value: 0.9588245200655605 and parameters: {'criterion': 'entropy', 'max_depth': 25, 'max_features': 'auto', 'min_samples_leaf': 1, 'min_samples_split': 3, 'n_estimators': 10}. Best is trial 184 with value: 0.9598840528678435.[0m
[32m[I 2021-06-01 14:41:54,752][0m Trial 240 finished with value: 0.958867745278204 and parameters: {'criterion': 'entropy', 'max_depth': 25, 'max_features': 'auto', 'min_samples_leaf': 1, 'min_samples_split': 3, 'n_estimators': 10}. Best is trial 184 with value: 0.9598840528678435.[0m
[32m[I 2021-06-01 14:41:55,194][0m Trial 241 finished with value: 0.9592493837160114 and parameters: {'criterion': 'entropy', 'max_depth': 25, 'max_features': 'auto', 'min_samples_leaf': 1, 'min_samples_split': 3, 'n_estimators': 10}. Best is trial 184 with value: 0.9598840528678435.[0m
[32m[I 2021-06-01 14:41:55,678][0m Trial 242 finished with value: 0.9582362259143832 and parameters: {'criterion': 'entropy', 'max_depth': 25, 'max_features': 'auto', 'min_samples_leaf': 1, 'min_samples_split': 3, 'n_estimators': 10}. Best is trial 184 with value: 0.9598840528678435.[0m
[32m[I 2021-06-01 14:41:56,059][0m Trial 239 finished with value: 0.9593019340490745 and parameters: {'criterion': 'entropy', 'max_depth': 25, 'max_features': 'auto', 'min_samples_leaf': 1, 'min_samples_split': 3, 'n_estimators': 10}. Best is trial 184 with value: 0.9598840528678435.[0m
[32m[I 2021-06-01 14:41:57,163][0m Trial 244 finished with value: 0.9570834790820479 and parameters: {'criterion': 'entropy', 'max_depth': 25, 'max_features': 'auto', 'min_samples_leaf': 5, 'min_samples_split': 3, 'n_estimators': 10}. Best is trial 184 with value: 0.9598840528678435.[0m
[32m[I 2021-06-01 14:41:57,724][0m Trial 231 finished with value: 0.9579653130077 and parameters: {'criterion': 'entropy', 'max_depth': 30, 'max_features': 'auto', 'min_samples_leaf': 2, 'min_samples_split': 3, 'n_estimators': 20}. Best is trial 184 with value: 0.9598840528678435.[0m
[32m[I 2021-06-01 14:41:57,865][0m Trial 243 finished with value: 0.9585691264289851 and parameters: {'criterion': 'entropy', 'max_depth': 25, 'max_features': 'auto', 'min_samples_leaf': 1, 'min_samples_split': 3, 'n_estimators': 10}. Best is trial 184 with value: 0.9598840528678435.[0m
[32m[I 2021-06-01 14:41:58,116][0m Trial 232 finished with value: 0.9570415364529461 and parameters: {'criterion': 'entropy', 'max_depth': 30, 'max_features': 'auto', 'min_samples_leaf': 2, 'min_samples_split': 3, 'n_estimators': 20}. Best is trial 184 with value: 0.9598840528678435.[0m
[32m[I 2021-06-01 14:41:58,686][0m Trial 245 finished with value: 0.9581342627780529 and parameters: {'criterion': 'entropy', 'max_depth': 25, 'max_features': 'auto', 'min_samples_leaf': 1, 'min_samples_split': 3, 'n_estimators': 10}. Best is trial 184 with value: 0.9598840528678435.[0m
[32m[I 2021-06-01 14:41:59,765][0m Trial 250 finished with value: 0.9593066575412823 and parameters: {'criterion': 'entropy', 'max_depth': 25, 'max_features': 'auto', 'min_samples_leaf': 1, 'min_samples_split': 3, 'n_estimators': 10}. Best is trial 184 with value: 0.9598840528678435.[0m
[32m[I 2021-06-01 14:41:59,904][0m Trial 234 finished with value: 0.9582319619724913 and parameters: {'criterion': 'entropy', 'max_depth': 25, 'max_features': 'auto', 'min_samples_leaf': 1, 'min_samples_split': 3, 'n_estimators': 20}. Best is trial 184 with value: 0.9598840528678435.[0m
[32m[I 2021-06-01 14:41:59,920][0m Trial 247 finished with value: 0.9586706484052989 and parameters: {'criterion': 'entropy', 'max_depth': 25, 'max_features': 'auto', 'min_samples_leaf': 1, 'min_samples_split': 3, 'n_estimators': 10}. Best is trial 184 with value: 0.9598840528678435.[0m
[32m[I 2021-06-01 14:42:00,124][0m Trial 249 finished with value: 0.9587492911442805 and parameters: {'criterion': 'entropy', 'max_depth': 25, 'max_features': 'auto', 'min_samples_leaf': 1, 'min_samples_split': 3, 'n_estimators': 10}. Best is trial 184 with value: 0.9598840528678435.[0m
[32m[I 2021-06-01 14:42:00,127][0m Trial 251 finished with value: 0.9590823299910187 and parameters: {'criterion': 'entropy', 'max_depth': 25, 'max_features': 'auto', 'min_samples_leaf': 1, 'min_samples_split': 3, 'n_estimators': 10}. Best is trial 184 with value: 0.9598840528678435.[0m
[32m[I 2021-06-01 14:42:00,477][0m Trial 248 finished with value: 0.9584728793532411 and parameters: {'criterion': 'entropy', 'max_depth': 25, 'max_features': 'auto', 'min_samples_leaf': 1, 'min_samples_split': 3, 'n_estimators': 10}. Best is trial 184 with value: 0.9598840528678435.[0m
[32m[I 2021-06-01 14:42:00,860][0m Trial 246 finished with value: 0.9591647302717531 and parameters: {'criterion': 'entropy', 'max_depth': 25, 'max_features': 'auto', 'min_samples_leaf': 1, 'min_samples_split': 3, 'n_estimators': 10}. Best is trial 184 with value: 0.9598840528678435.[0m
[32m[I 2021-06-01 14:42:00,983][0m Trial 252 finished with value: 0.9585163840147827 and parameters: {'criterion': 'entropy', 'max_depth': 25, 'max_features': 'auto', 'min_samples_leaf': 1, 'min_samples_split': 3, 'n_estimators': 10}. Best is trial 184 with value: 0.9598840528678435.[0m
[32m[I 2021-06-01 14:42:01,820][0m Trial 253 finished with value: 0.9590852002768286 and parameters: {'criterion': 'entropy', 'max_depth': 25, 'max_features': 'auto', 'min_samples_leaf': 1, 'min_samples_split': 3, 'n_estimators': 10}. Best is trial 184 with value: 0.9598840528678435.[0m
[32m[I 2021-06-01 14:42:02,696][0m Trial 254 finished with value: 0.9592629041533952 and parameters: {'criterion': 'entropy', 'max_depth': 25, 'max_features': 'auto', 'min_samples_leaf': 1, 'min_samples_split': 3, 'n_estimators': 10}. Best is trial 184 with value: 0.9598840528678435.[0m
[32m[I 2021-06-01 14:42:02,874][0m Trial 255 finished with value: 0.9590207158328623 and parameters: {'criterion': 'entropy', 'max_depth': 25, 'max_features': 'auto', 'min_samples_leaf': 1, 'min_samples_split': 3, 'n_estimators': 10}. Best is trial 184 with value: 0.9598840528678435.[0m
[32m[I 2021-06-01 14:42:03,380][0m Trial 256 finished with value: 0.9592014840502712 and parameters: {'criterion': 'entropy', 'max_depth': 25, 'max_features': 'auto', 'min_samples_leaf': 1, 'min_samples_split': 3, 'n_estimators': 10}. Best is trial 184 with value: 0.9598840528678435.[0m
[32m[I 2021-06-01 14:42:04,063][0m Trial 257 finished with value: 0.9591763428379055 and parameters: {'criterion': 'entropy', 'max_depth': 25, 'max_features': 'auto', 'min_samples_leaf': 1, 'min_samples_split': 3, 'n_estimators': 10}. Best is trial 184 with value: 0.9598840528678435.[0m
[32m[I 2021-06-01 14:42:04,538][0m Trial 258 finished with value: 0.958516802224025 and parameters: {'criterion': 'entropy', 'max_depth': 25, 'max_features': 'auto', 'min_samples_leaf': 1, 'min_samples_split': 3, 'n_estimators': 10}. Best is trial 184 with value: 0.9598840528678435.[0m
[32m[I 2021-06-01 14:42:04,786][0m Trial 259 finished with value: 0.9583146749041657 and parameters: {'criterion': 'entropy', 'max_depth': 25, 'max_features': 'auto', 'min_samples_leaf': 1, 'min_samples_split': 3, 'n_estimators': 10}. Best is trial 184 with value: 0.9598840528678435.[0m
[32m[I 2021-06-01 14:42:05,147][0m Trial 260 finished with value: 0.9593817028643461 and parameters: {'criterion': 'entropy', 'max_depth': 25, 'max_features': 'auto', 'min_samples_leaf': 1, 'min_samples_split': 3, 'n_estimators': 10}. Best is trial 184 with value: 0.9598840528678435.[0m
[32m[I 2021-06-01 14:42:06,833][0m Trial 262 finished with value: 0.9585366719405102 and parameters: {'criterion': 'entropy', 'max_depth': 25, 'max_features': 'auto', 'min_samples_leaf': 1, 'min_samples_split': 3, 'n_estimators': 10}. Best is trial 184 with value: 0.9598840528678435.[0m
[32m[I 2021-06-01 14:42:06,910][0m Trial 261 finished with value: 0.9581986230654916 and parameters: {'criterion': 'entropy', 'max_depth': 25, 'max_features': 'auto', 'min_samples_leaf': 1, 'min_samples_split': 3, 'n_estimators': 10}. Best is trial 184 with value: 0.9598840528678435.[0m
[32m[I 2021-06-01 14:42:08,690][0m Trial 265 finished with value: 0.9593198469546996 and parameters: {'criterion': 'entropy', 'max_depth': 40, 'max_features': 'auto', 'min_samples_leaf': 1, 'min_samples_split': 3, 'n_estimators': 10}. Best is trial 184 with value: 0.9598840528678435.[0m
[32m[I 2021-06-01 14:42:08,806][0m Trial 267 finished with value: 0.9586636676472491 and parameters: {'criterion': 'entropy', 'max_depth': 40, 'max_features': 'auto', 'min_samples_leaf': 1, 'min_samples_split': 3, 'n_estimators': 10}. Best is trial 184 with value: 0.9598840528678435.[0m
[32m[I 2021-06-01 14:42:08,928][0m Trial 263 finished with value: 0.9583916456182481 and parameters: {'criterion': 'entropy', 'max_depth': 40, 'max_features': 'auto', 'min_samples_leaf': 1, 'min_samples_split': 3, 'n_estimators': 10}. Best is trial 184 with value: 0.9598840528678435.[0m
[32m[I 2021-06-01 14:42:08,988][0m Trial 264 finished with value: 0.9586401308369892 and parameters: {'criterion': 'entropy', 'max_depth': 25, 'max_features': 'auto', 'min_samples_leaf': 1, 'min_samples_split': 3, 'n_estimators': 10}. Best is trial 184 with value: 0.9598840528678435.[0m
[32m[I 2021-06-01 14:42:09,462][0m Trial 266 finished with value: 0.9591794210124369 and parameters: {'criterion': 'entropy', 'max_depth': 40, 'max_features': 'auto', 'min_samples_leaf': 1, 'min_samples_split': 3, 'n_estimators': 10}. Best is trial 184 with value: 0.9598840528678435.[0m
[32m[I 2021-06-01 14:42:09,517][0m Trial 268 finished with value: 0.9591573478859063 and parameters: {'criterion': 'entropy', 'max_depth': 40, 'max_features': 'auto', 'min_samples_leaf': 1, 'min_samples_split': 3, 'n_estimators': 10}. Best is trial 184 with value: 0.9598840528678435.[0m
[32m[I 2021-06-01 14:42:11,651][0m Trial 272 finished with value: 0.9565073436660677 and parameters: {'criterion': 'entropy', 'max_depth': 25, 'max_features': 'sqrt', 'min_samples_leaf': 6, 'min_samples_split': 3, 'n_estimators': 10}. Best is trial 184 with value: 0.9598840528678435.[0m
[32m[I 2021-06-01 14:42:15,447][0m Trial 274 finished with value: 0.9591808187558886 and parameters: {'criterion': 'entropy', 'max_depth': 25, 'max_features': 'auto', 'min_samples_leaf': 1, 'min_samples_split': 3, 'n_estimators': 10}. Best is trial 184 with value: 0.9598840528678435.[0m
[32m[I 2021-06-01 14:42:27,906][0m Trial 275 finished with value: 0.9579686011633859 and parameters: {'criterion': 'entropy', 'max_depth': 25, 'max_features': 'sqrt', 'min_samples_leaf': 1, 'min_samples_split': 3, 'n_estimators': 25}. Best is trial 184 with value: 0.9598840528678435.[0m
[32m[I 2021-06-01 14:42:28,618][0m Trial 276 finished with value: 0.9580273472713052 and parameters: {'criterion': 'entropy', 'max_depth': 40, 'max_features': 'sqrt', 'min_samples_leaf': 1, 'min_samples_split': 3, 'n_estimators': 25}. Best is trial 184 with value: 0.9598840528678435.[0m
[32m[I 2021-06-01 14:42:30,736][0m Trial 277 finished with value: 0.958191462610279 and parameters: {'criterion': 'entropy', 'max_depth': 40, 'max_features': 'auto', 'min_samples_leaf': 1, 'min_samples_split': 3, 'n_estimators': 25}. Best is trial 184 with value: 0.9598840528678435.[0m
[32m[I 2021-06-01 14:43:22,463][0m Trial 273 finished with value: 0.9578141992995508 and parameters: {'criterion': 'entropy', 'max_depth': 25, 'max_features': 'auto', 'min_samples_leaf': 1, 'min_samples_split': 3, 'n_estimators': 110}. Best is trial 184 with value: 0.9598840528678435.[0m
[32m[I 2021-06-01 14:43:23,839][0m Trial 233 finished with value: 0.9572526935764817 and parameters: {'criterion': 'entropy', 'max_depth': 30, 'max_features': 'auto', 'min_samples_leaf': 2, 'min_samples_split': 3, 'n_estimators': 150}. Best is trial 184 with value: 0.9598840528678435.[0m
[32m[I 2021-06-01 14:43:34,776][0m Trial 278 finished with value: 0.9578914281360476 and parameters: {'criterion': 'entropy', 'max_depth': 40, 'max_features': 'auto', 'min_samples_leaf': 1, 'min_samples_split': 3, 'n_estimators': 15}. Best is trial 184 with value: 0.9598840528678435.[0m
[32m[I 2021-06-01 14:43:43,646][0m Trial 269 finished with value: 0.9574422169720682 and parameters: {'criterion': 'entropy', 'max_depth': 25, 'max_features': 'auto', 'min_samples_leaf': 1, 'min_samples_split': 3, 'n_estimators': 145}. Best is trial 184 with value: 0.9598840528678435.[0m
[32m[I 2021-06-01 14:43:46,079][0m Trial 271 finished with value: 0.9576165849926802 and parameters: {'criterion': 'entropy', 'max_depth': 40, 'max_features': 'sqrt', 'min_samples_leaf': 1, 'min_samples_split': 3, 'n_estimators': 150}. Best is trial 184 with value: 0.9598840528678435.[0m
[32m[I 2021-06-01 14:43:51,658][0m Trial 270 finished with value: 0.9575659006845996 and parameters: {'criterion': 'entropy', 'max_depth': 40, 'max_features': 'sqrt', 'min_samples_leaf': 1, 'min_samples_split': 3, 'n_estimators': 155}. Best is trial 184 with value: 0.9598840528678435.[0m
[32m[I 2021-06-01 14:43:54,862][0m Trial 279 finished with value: 0.9587902604341771 and parameters: {'criterion': 'entropy', 'max_depth': 25, 'max_features': 'auto', 'min_samples_leaf': 1, 'min_samples_split': 3, 'n_estimators': 15}. Best is trial 184 with value: 0.9598840528678435.[0m
