2021-06-01 14:33:52.505012: W tensorflow/stream_executor/platform/default/dso_loader.cc:64] Could not load dynamic library 'libcudart.so.11.0'; dlerror: libcudart.so.11.0: cannot open shared object file: No such file or directory; LD_LIBRARY_PATH: /sw/ompi/4.1.1/lib:/sw/ompi/4.1.1/include:/sw/ucx/1.10.0/lib:/sw/gcc/10.2.0/lib64:/sw/gcc/10.2.0/lib
2021-06-01 14:33:52.505069: I tensorflow/stream_executor/cuda/cudart_stub.cc:29] Ignore above cudart dlerror if you do not have a GPU set up on your machine.
2021-06-01 14:33:52.505021: W tensorflow/stream_executor/platform/default/dso_loader.cc:64] Could not load dynamic library 'libcudart.so.11.0'; dlerror: libcudart.so.11.0: cannot open shared object file: No such file or directory; LD_LIBRARY_PATH: /sw/ompi/4.1.1/lib:/sw/ompi/4.1.1/include:/sw/ucx/1.10.0/lib:/sw/gcc/10.2.0/lib64:/sw/gcc/10.2.0/lib
2021-06-01 14:33:52.505069: I tensorflow/stream_executor/cuda/cudart_stub.cc:29] Ignore above cudart dlerror if you do not have a GPU set up on your machine.
2021-06-01 14:33:52.505486: W tensorflow/stream_executor/platform/default/dso_loader.cc:64] Could not load dynamic library 'libcudart.so.11.0'; dlerror: libcudart.so.11.0: cannot open shared object file: No such file or directory; LD_LIBRARY_PATH: /sw/ompi/4.1.1/lib:/sw/ompi/4.1.1/include:/sw/ucx/1.10.0/lib:/sw/gcc/10.2.0/lib64:/sw/gcc/10.2.0/lib
2021-06-01 14:33:52.505528: I tensorflow/stream_executor/cuda/cudart_stub.cc:29] Ignore above cudart dlerror if you do not have a GPU set up on your machine.
2021-06-01 14:33:52.505594: W tensorflow/stream_executor/platform/default/dso_loader.cc:64] Could not load dynamic library 'libcudart.so.11.0'; dlerror: libcudart.so.11.0: cannot open shared object file: No such file or directory; LD_LIBRARY_PATH: /sw/ompi/4.1.1/lib:/sw/ompi/4.1.1/include:/sw/ucx/1.10.0/lib:/sw/gcc/10.2.0/lib64:/sw/gcc/10.2.0/lib
2021-06-01 14:33:52.505635: I tensorflow/stream_executor/cuda/cudart_stub.cc:29] Ignore above cudart dlerror if you do not have a GPU set up on your machine.
2021-06-01 14:33:52.505509: W tensorflow/stream_executor/platform/default/dso_loader.cc:64] Could not load dynamic library 'libcudart.so.11.0'; dlerror: libcudart.so.11.0: cannot open shared object file: No such file or directory; LD_LIBRARY_PATH: /sw/ompi/4.1.1/lib:/sw/ompi/4.1.1/include:/sw/ucx/1.10.0/lib:/sw/gcc/10.2.0/lib64:/sw/gcc/10.2.0/lib
2021-06-01 14:33:52.505548: I tensorflow/stream_executor/cuda/cudart_stub.cc:29] Ignore above cudart dlerror if you do not have a GPU set up on your machine.
2021-06-01 14:33:52.505394: W tensorflow/stream_executor/platform/default/dso_loader.cc:64] Could not load dynamic library 'libcudart.so.11.0'; dlerror: libcudart.so.11.0: cannot open shared object file: No such file or directory; LD_LIBRARY_PATH: /sw/ompi/4.1.1/lib:/sw/ompi/4.1.1/include:/sw/ucx/1.10.0/lib:/sw/gcc/10.2.0/lib64:/sw/gcc/10.2.0/lib
2021-06-01 14:33:52.505432: I tensorflow/stream_executor/cuda/cudart_stub.cc:29] Ignore above cudart dlerror if you do not have a GPU set up on your machine.
2021-06-01 14:33:52.505477: W tensorflow/stream_executor/platform/default/dso_loader.cc:64] Could not load dynamic library 'libcudart.so.11.0'; dlerror: libcudart.so.11.0: cannot open shared object file: No such file or directory; LD_LIBRARY_PATH: /sw/ompi/4.1.1/lib:/sw/ompi/4.1.1/include:/sw/ucx/1.10.0/lib:/sw/gcc/10.2.0/lib64:/sw/gcc/10.2.0/lib
2021-06-01 14:33:52.505515: I tensorflow/stream_executor/cuda/cudart_stub.cc:29] Ignore above cudart dlerror if you do not have a GPU set up on your machine.
2021-06-01 14:33:52.505630: W tensorflow/stream_executor/platform/default/dso_loader.cc:64] Could not load dynamic library 'libcudart.so.11.0'; dlerror: libcudart.so.11.0: cannot open shared object file: No such file or directory; LD_LIBRARY_PATH: /sw/ompi/4.1.1/lib:/sw/ompi/4.1.1/include:/sw/ucx/1.10.0/lib:/sw/gcc/10.2.0/lib64:/sw/gcc/10.2.0/lib
2021-06-01 14:33:52.505670: I tensorflow/stream_executor/cuda/cudart_stub.cc:29] Ignore above cudart dlerror if you do not have a GPU set up on your machine.
2021-06-01 14:33:52.505493: W tensorflow/stream_executor/platform/default/dso_loader.cc:64] Could not load dynamic library 'libcudart.so.11.0'; dlerror: libcudart.so.11.0: cannot open shared object file: No such file or directory; LD_LIBRARY_PATH: /sw/ompi/4.1.1/lib:/sw/ompi/4.1.1/include:/sw/ucx/1.10.0/lib:/sw/gcc/10.2.0/lib64:/sw/gcc/10.2.0/lib
2021-06-01 14:33:52.505533: I tensorflow/stream_executor/cuda/cudart_stub.cc:29] Ignore above cudart dlerror if you do not have a GPU set up on your machine.
2021-06-01 14:33:52.505628: W tensorflow/stream_executor/platform/default/dso_loader.cc:64] Could not load dynamic library 'libcudart.so.11.0'; dlerror: libcudart.so.11.0: cannot open shared object file: No such file or directory; LD_LIBRARY_PATH: /sw/ompi/4.1.1/lib:/sw/ompi/4.1.1/include:/sw/ucx/1.10.0/lib:/sw/gcc/10.2.0/lib64:/sw/gcc/10.2.0/lib
2021-06-01 14:33:52.505669: I tensorflow/stream_executor/cuda/cudart_stub.cc:29] Ignore above cudart dlerror if you do not have a GPU set up on your machine.
2021-06-01 14:33:52.505621: W tensorflow/stream_executor/platform/default/dso_loader.cc:64] Could not load dynamic library 'libcudart.so.11.0'; dlerror: libcudart.so.11.0: cannot open shared object file: No such file or directory; LD_LIBRARY_PATH: /sw/ompi/4.1.1/lib:/sw/ompi/4.1.1/include:/sw/ucx/1.10.0/lib:/sw/gcc/10.2.0/lib64:/sw/gcc/10.2.0/lib
2021-06-01 14:33:52.505660: I tensorflow/stream_executor/cuda/cudart_stub.cc:29] Ignore above cudart dlerror if you do not have a GPU set up on your machine.
2021-06-01 14:33:52.505667: W tensorflow/stream_executor/platform/default/dso_loader.cc:64] Could not load dynamic library 'libcudart.so.11.0'; dlerror: libcudart.so.11.0: cannot open shared object file: No such file or directory; LD_LIBRARY_PATH: /sw/ompi/4.1.1/lib:/sw/ompi/4.1.1/include:/sw/ucx/1.10.0/lib:/sw/gcc/10.2.0/lib64:/sw/gcc/10.2.0/lib
2021-06-01 14:33:52.505706: I tensorflow/stream_executor/cuda/cudart_stub.cc:29] Ignore above cudart dlerror if you do not have a GPU set up on your machine.
2021-06-01 14:33:52.505443: W tensorflow/stream_executor/platform/default/dso_loader.cc:64] Could not load dynamic library 'libcudart.so.11.0'; dlerror: libcudart.so.11.0: cannot open shared object file: No such file or directory; LD_LIBRARY_PATH: /sw/ompi/4.1.1/lib:/sw/ompi/4.1.1/include:/sw/ucx/1.10.0/lib:/sw/gcc/10.2.0/lib64:/sw/gcc/10.2.0/lib
2021-06-01 14:33:52.505482: I tensorflow/stream_executor/cuda/cudart_stub.cc:29] Ignore above cudart dlerror if you do not have a GPU set up on your machine.
2021-06-01 14:33:52.505553: W tensorflow/stream_executor/platform/default/dso_loader.cc:64] Could not load dynamic library 'libcudart.so.11.0'; dlerror: libcudart.so.11.0: cannot open shared object file: No such file or directory; LD_LIBRARY_PATH: /sw/ompi/4.1.1/lib:/sw/ompi/4.1.1/include:/sw/ucx/1.10.0/lib:/sw/gcc/10.2.0/lib64:/sw/gcc/10.2.0/lib
2021-06-01 14:33:52.505592: I tensorflow/stream_executor/cuda/cudart_stub.cc:29] Ignore above cudart dlerror if you do not have a GPU set up on your machine.
2021-06-01 14:33:52.505368: W tensorflow/stream_executor/platform/default/dso_loader.cc:64] Could not load dynamic library 'libcudart.so.11.0'; dlerror: libcudart.so.11.0: cannot open shared object file: No such file or directory; LD_LIBRARY_PATH: /sw/ompi/4.1.1/lib:/sw/ompi/4.1.1/include:/sw/ucx/1.10.0/lib:/sw/gcc/10.2.0/lib64:/sw/gcc/10.2.0/lib
2021-06-01 14:33:52.505410: I tensorflow/stream_executor/cuda/cudart_stub.cc:29] Ignore above cudart dlerror if you do not have a GPU set up on your machine.
2021-06-01 14:33:52.505509: W tensorflow/stream_executor/platform/default/dso_loader.cc:64] Could not load dynamic library 'libcudart.so.11.0'; dlerror: libcudart.so.11.0: cannot open shared object file: No such file or directory; LD_LIBRARY_PATH: /sw/ompi/4.1.1/lib:/sw/ompi/4.1.1/include:/sw/ucx/1.10.0/lib:/sw/gcc/10.2.0/lib64:/sw/gcc/10.2.0/lib
2021-06-01 14:33:52.505548: I tensorflow/stream_executor/cuda/cudart_stub.cc:29] Ignore above cudart dlerror if you do not have a GPU set up on your machine.
2021-06-01 14:33:52.505459: W tensorflow/stream_executor/platform/default/dso_loader.cc:64] Could not load dynamic library 'libcudart.so.11.0'; dlerror: libcudart.so.11.0: cannot open shared object file: No such file or directory; LD_LIBRARY_PATH: /sw/ompi/4.1.1/lib:/sw/ompi/4.1.1/include:/sw/ucx/1.10.0/lib:/sw/gcc/10.2.0/lib64:/sw/gcc/10.2.0/lib
2021-06-01 14:33:52.505496: I tensorflow/stream_executor/cuda/cudart_stub.cc:29] Ignore above cudart dlerror if you do not have a GPU set up on your machine.
2021-06-01 14:33:52.505532: W tensorflow/stream_executor/platform/default/dso_loader.cc:64] Could not load dynamic library 'libcudart.so.11.0'; dlerror: libcudart.so.11.0: cannot open shared object file: No such file or directory; LD_LIBRARY_PATH: /sw/ompi/4.1.1/lib:/sw/ompi/4.1.1/include:/sw/ucx/1.10.0/lib:/sw/gcc/10.2.0/lib64:/sw/gcc/10.2.0/lib
2021-06-01 14:33:52.505572: I tensorflow/stream_executor/cuda/cudart_stub.cc:29] Ignore above cudart dlerror if you do not have a GPU set up on your machine.
2021-06-01 14:33:52.505658: W tensorflow/stream_executor/platform/default/dso_loader.cc:64] Could not load dynamic library 'libcudart.so.11.0'; dlerror: libcudart.so.11.0: cannot open shared object file: No such file or directory; LD_LIBRARY_PATH: /sw/ompi/4.1.1/lib:/sw/ompi/4.1.1/include:/sw/ucx/1.10.0/lib:/sw/gcc/10.2.0/lib64:/sw/gcc/10.2.0/lib
2021-06-01 14:33:52.505700: I tensorflow/stream_executor/cuda/cudart_stub.cc:29] Ignore above cudart dlerror if you do not have a GPU set up on your machine.
2021-06-01 14:33:52.505577: W tensorflow/stream_executor/platform/default/dso_loader.cc:64] Could not load dynamic library 'libcudart.so.11.0'; dlerror: libcudart.so.11.0: cannot open shared object file: No such file or directory; LD_LIBRARY_PATH: /sw/ompi/4.1.1/lib:/sw/ompi/4.1.1/include:/sw/ucx/1.10.0/lib:/sw/gcc/10.2.0/lib64:/sw/gcc/10.2.0/lib
2021-06-01 14:33:52.505613: I tensorflow/stream_executor/cuda/cudart_stub.cc:29] Ignore above cudart dlerror if you do not have a GPU set up on your machine.
2021-06-01 14:33:52.505672: W tensorflow/stream_executor/platform/default/dso_loader.cc:64] Could not load dynamic library 'libcudart.so.11.0'; dlerror: libcudart.so.11.0: cannot open shared object file: No such file or directory; LD_LIBRARY_PATH: /sw/ompi/4.1.1/lib:/sw/ompi/4.1.1/include:/sw/ucx/1.10.0/lib:/sw/gcc/10.2.0/lib64:/sw/gcc/10.2.0/lib
2021-06-01 14:33:52.505711: I tensorflow/stream_executor/cuda/cudart_stub.cc:29] Ignore above cudart dlerror if you do not have a GPU set up on your machine.
2021-06-01 14:33:52.505564: W tensorflow/stream_executor/platform/default/dso_loader.cc:64] Could not load dynamic library 'libcudart.so.11.0'; dlerror: libcudart.so.11.0: cannot open shared object file: No such file or directory; LD_LIBRARY_PATH: /sw/ompi/4.1.1/lib:/sw/ompi/4.1.1/include:/sw/ucx/1.10.0/lib:/sw/gcc/10.2.0/lib64:/sw/gcc/10.2.0/lib
2021-06-01 14:33:52.505603: I tensorflow/stream_executor/cuda/cudart_stub.cc:29] Ignore above cudart dlerror if you do not have a GPU set up on your machine.
2021-06-01 14:33:52.505670: W tensorflow/stream_executor/platform/default/dso_loader.cc:64] Could not load dynamic library 'libcudart.so.11.0'; dlerror: libcudart.so.11.0: cannot open shared object file: No such file or directory; LD_LIBRARY_PATH: /sw/ompi/4.1.1/lib:/sw/ompi/4.1.1/include:/sw/ucx/1.10.0/lib:/sw/gcc/10.2.0/lib64:/sw/gcc/10.2.0/lib
2021-06-01 14:33:52.505708: I tensorflow/stream_executor/cuda/cudart_stub.cc:29] Ignore above cudart dlerror if you do not have a GPU set up on your machine.
2021-06-01 14:33:52.505482: W tensorflow/stream_executor/platform/default/dso_loader.cc:64] Could not load dynamic library 'libcudart.so.11.0'; dlerror: libcudart.so.11.0: cannot open shared object file: No such file or directory; LD_LIBRARY_PATH: /sw/ompi/4.1.1/lib:/sw/ompi/4.1.1/include:/sw/ucx/1.10.0/lib:/sw/gcc/10.2.0/lib64:/sw/gcc/10.2.0/lib
2021-06-01 14:33:52.505520: I tensorflow/stream_executor/cuda/cudart_stub.cc:29] Ignore above cudart dlerror if you do not have a GPU set up on your machine.
2021-06-01 14:33:52.505520: W tensorflow/stream_executor/platform/default/dso_loader.cc:64] Could not load dynamic library 'libcudart.so.11.0'; dlerror: libcudart.so.11.0: cannot open shared object file: No such file or directory; LD_LIBRARY_PATH: /sw/ompi/4.1.1/lib:/sw/ompi/4.1.1/include:/sw/ucx/1.10.0/lib:/sw/gcc/10.2.0/lib64:/sw/gcc/10.2.0/lib
2021-06-01 14:33:52.505559: I tensorflow/stream_executor/cuda/cudart_stub.cc:29] Ignore above cudart dlerror if you do not have a GPU set up on your machine.
2021-06-01 14:33:52.505354: W tensorflow/stream_executor/platform/default/dso_loader.cc:64] Could not load dynamic library 'libcudart.so.11.0'; dlerror: libcudart.so.11.0: cannot open shared object file: No such file or directory; LD_LIBRARY_PATH: /sw/ompi/4.1.1/lib:/sw/ompi/4.1.1/include:/sw/ucx/1.10.0/lib:/sw/gcc/10.2.0/lib64:/sw/gcc/10.2.0/lib
2021-06-01 14:33:52.505396: I tensorflow/stream_executor/cuda/cudart_stub.cc:29] Ignore above cudart dlerror if you do not have a GPU set up on your machine.
2021-06-01 14:33:52.505638: W tensorflow/stream_executor/platform/default/dso_loader.cc:64] Could not load dynamic library 'libcudart.so.11.0'; dlerror: libcudart.so.11.0: cannot open shared object file: No such file or directory; LD_LIBRARY_PATH: /sw/ompi/4.1.1/lib:/sw/ompi/4.1.1/include:/sw/ucx/1.10.0/lib:/sw/gcc/10.2.0/lib64:/sw/gcc/10.2.0/lib
2021-06-01 14:33:52.505678: I tensorflow/stream_executor/cuda/cudart_stub.cc:29] Ignore above cudart dlerror if you do not have a GPU set up on your machine.
2021-06-01 14:33:52.505544: W tensorflow/stream_executor/platform/default/dso_loader.cc:64] Could not load dynamic library 'libcudart.so.11.0'; dlerror: libcudart.so.11.0: cannot open shared object file: No such file or directory; LD_LIBRARY_PATH: /sw/ompi/4.1.1/lib:/sw/ompi/4.1.1/include:/sw/ucx/1.10.0/lib:/sw/gcc/10.2.0/lib64:/sw/gcc/10.2.0/lib
2021-06-01 14:33:52.505584: I tensorflow/stream_executor/cuda/cudart_stub.cc:29] Ignore above cudart dlerror if you do not have a GPU set up on your machine.
/gscratch/davinci/usr/evankomp/miniconda3/envs/cytoxnet/lib/python3.7/site-packages/sklearn/metrics/_classification.py:1248: UndefinedMetricWarning: Precision is ill-defined and being set to 0.0 due to no predicted samples. Use `zero_division` parameter to control this behavior.
  _warn_prf(average, modifier, msg_start, len(result))
[32m[I 2021-06-01 14:35:59,723][0m Trial 27 finished with value: 0.9564470917960295 and parameters: {'criterion': 'entropy', 'max_depth': 20, 'max_features': 'log2', 'min_samples_leaf': 8, 'min_samples_split': 8, 'n_estimators': 10}. Best is trial 27 with value: 0.9564470917960295.[0m
/gscratch/davinci/usr/evankomp/miniconda3/envs/cytoxnet/lib/python3.7/site-packages/sklearn/metrics/_classification.py:1248: UndefinedMetricWarning: Precision is ill-defined and being set to 0.0 due to no predicted samples. Use `zero_division` parameter to control this behavior.
  _warn_prf(average, modifier, msg_start, len(result))
/gscratch/davinci/usr/evankomp/miniconda3/envs/cytoxnet/lib/python3.7/site-packages/sklearn/metrics/_classification.py:1248: UndefinedMetricWarning: Precision is ill-defined and being set to 0.0 due to no predicted samples. Use `zero_division` parameter to control this behavior.
  _warn_prf(average, modifier, msg_start, len(result))
[32m[I 2021-06-01 14:36:04,510][0m Trial 3 finished with value: 0.9564503386561818 and parameters: {'criterion': 'entropy', 'max_depth': None, 'max_features': 'sqrt', 'min_samples_leaf': 8, 'min_samples_split': 8, 'n_estimators': 15}. Best is trial 3 with value: 0.9564503386561818.[0m
[32m[I 2021-06-01 14:36:05,659][0m Trial 26 finished with value: 0.9570025077305034 and parameters: {'criterion': 'gini', 'max_depth': 35, 'max_features': 'auto', 'min_samples_leaf': 3, 'min_samples_split': 4, 'n_estimators': 25}. Best is trial 26 with value: 0.9570025077305034.[0m
[32m[I 2021-06-01 14:36:06,934][0m Trial 12 finished with value: 0.9571920287880433 and parameters: {'criterion': 'entropy', 'max_depth': 40, 'max_features': 'log2', 'min_samples_leaf': 2, 'min_samples_split': 5, 'n_estimators': 25}. Best is trial 12 with value: 0.9571920287880433.[0m
/gscratch/davinci/usr/evankomp/miniconda3/envs/cytoxnet/lib/python3.7/site-packages/sklearn/metrics/_classification.py:1248: UndefinedMetricWarning: Precision is ill-defined and being set to 0.0 due to no predicted samples. Use `zero_division` parameter to control this behavior.
  _warn_prf(average, modifier, msg_start, len(result))
/gscratch/davinci/usr/evankomp/miniconda3/envs/cytoxnet/lib/python3.7/site-packages/sklearn/metrics/_classification.py:1248: UndefinedMetricWarning: Precision is ill-defined and being set to 0.0 due to no predicted samples. Use `zero_division` parameter to control this behavior.
  _warn_prf(average, modifier, msg_start, len(result))
[32m[I 2021-06-01 14:36:10,312][0m Trial 4 finished with value: 0.9565126221450472 and parameters: {'criterion': 'gini', 'max_depth': 40, 'max_features': 'log2', 'min_samples_leaf': 4, 'min_samples_split': 10, 'n_estimators': 70}. Best is trial 12 with value: 0.9571920287880433.[0m
/gscratch/davinci/usr/evankomp/miniconda3/envs/cytoxnet/lib/python3.7/site-packages/sklearn/metrics/_classification.py:1248: UndefinedMetricWarning: Precision is ill-defined and being set to 0.0 due to no predicted samples. Use `zero_division` parameter to control this behavior.
  _warn_prf(average, modifier, msg_start, len(result))
/gscratch/davinci/usr/evankomp/miniconda3/envs/cytoxnet/lib/python3.7/site-packages/sklearn/metrics/_classification.py:1248: UndefinedMetricWarning: Precision is ill-defined and being set to 0.0 due to no predicted samples. Use `zero_division` parameter to control this behavior.
  _warn_prf(average, modifier, msg_start, len(result))
[32m[I 2021-06-01 14:36:14,326][0m Trial 15 finished with value: 0.9564500565014791 and parameters: {'criterion': 'entropy', 'max_depth': 40, 'max_features': 'log2', 'min_samples_leaf': 9, 'min_samples_split': 5, 'n_estimators': 50}. Best is trial 12 with value: 0.9571920287880433.[0m
/gscratch/davinci/usr/evankomp/miniconda3/envs/cytoxnet/lib/python3.7/site-packages/sklearn/metrics/_classification.py:1248: UndefinedMetricWarning: Precision is ill-defined and being set to 0.0 due to no predicted samples. Use `zero_division` parameter to control this behavior.
  _warn_prf(average, modifier, msg_start, len(result))
/gscratch/davinci/usr/evankomp/miniconda3/envs/cytoxnet/lib/python3.7/site-packages/sklearn/metrics/_classification.py:1248: UndefinedMetricWarning: Precision is ill-defined and being set to 0.0 due to no predicted samples. Use `zero_division` parameter to control this behavior.
  _warn_prf(average, modifier, msg_start, len(result))
[32m[I 2021-06-01 14:36:17,976][0m Trial 25 finished with value: 0.9564501975788305 and parameters: {'criterion': 'entropy', 'max_depth': 5, 'max_features': 'log2', 'min_samples_leaf': 5, 'min_samples_split': 8, 'n_estimators': 105}. Best is trial 12 with value: 0.9571920287880433.[0m
[32m[I 2021-06-01 14:36:19,247][0m Trial 31 finished with value: 0.9564505972979926 and parameters: {'criterion': 'gini', 'max_depth': 35, 'max_features': 'log2', 'min_samples_leaf': 10, 'min_samples_split': 2, 'n_estimators': 60}. Best is trial 12 with value: 0.9571920287880433.[0m
[32m[I 2021-06-01 14:36:22,998][0m Trial 0 finished with value: 0.9564501270401549 and parameters: {'criterion': 'gini', 'max_depth': 40, 'max_features': 'log2', 'min_samples_leaf': 7, 'min_samples_split': 4, 'n_estimators': 135}. Best is trial 12 with value: 0.9571920287880433.[0m
/gscratch/davinci/usr/evankomp/miniconda3/envs/cytoxnet/lib/python3.7/site-packages/sklearn/metrics/_classification.py:1248: UndefinedMetricWarning: Precision is ill-defined and being set to 0.0 due to no predicted samples. Use `zero_division` parameter to control this behavior.
  _warn_prf(average, modifier, msg_start, len(result))
[32m[I 2021-06-01 14:36:27,631][0m Trial 6 finished with value: 0.956966461379551 and parameters: {'criterion': 'gini', 'max_depth': 25, 'max_features': 'log2', 'min_samples_leaf': 2, 'min_samples_split': 7, 'n_estimators': 140}. Best is trial 12 with value: 0.9571920287880433.[0m
/gscratch/davinci/usr/evankomp/miniconda3/envs/cytoxnet/lib/python3.7/site-packages/sklearn/metrics/_classification.py:1248: UndefinedMetricWarning: Precision is ill-defined and being set to 0.0 due to no predicted samples. Use `zero_division` parameter to control this behavior.
  _warn_prf(average, modifier, msg_start, len(result))
[32m[I 2021-06-01 14:36:33,750][0m Trial 22 finished with value: 0.9564503856819655 and parameters: {'criterion': 'entropy', 'max_depth': 5, 'max_features': 'log2', 'min_samples_leaf': 2, 'min_samples_split': 6, 'n_estimators': 190}. Best is trial 12 with value: 0.9571920287880433.[0m
[32m[I 2021-06-01 14:36:39,428][0m Trial 1 finished with value: 0.9565040084874117 and parameters: {'criterion': 'entropy', 'max_depth': 25, 'max_features': 'log2', 'min_samples_leaf': 3, 'min_samples_split': 7, 'n_estimators': 105}. Best is trial 12 with value: 0.9571920287880433.[0m
[32m[I 2021-06-01 14:36:41,086][0m Trial 20 finished with value: 0.9564501270401549 and parameters: {'criterion': 'gini', 'max_depth': None, 'max_features': 'log2', 'min_samples_leaf': 10, 'min_samples_split': 7, 'n_estimators': 240}. Best is trial 12 with value: 0.9571920287880433.[0m
[32m[I 2021-06-01 14:36:43,636][0m Trial 23 finished with value: 0.956450526759317 and parameters: {'criterion': 'gini', 'max_depth': 25, 'max_features': 'auto', 'min_samples_leaf': 7, 'min_samples_split': 4, 'n_estimators': 135}. Best is trial 12 with value: 0.9571920287880433.[0m
