[32m[I 2021-06-01 14:40:53,952][0m Trial 140 finished with value: 0.9578508799274574 and parameters: {'criterion': 'entropy', 'max_depth': None, 'max_features': 'auto', 'min_samples_leaf': 1, 'min_samples_split': 3, 'n_estimators': 30}. Best is trial 41 with value: 0.9592627631176829.[0m
[32m[I 2021-06-01 14:40:55,345][0m Trial 138 finished with value: 0.9576186986166668 and parameters: {'criterion': 'entropy', 'max_depth': None, 'max_features': 'auto', 'min_samples_leaf': 1, 'min_samples_split': 3, 'n_estimators': 35}. Best is trial 41 with value: 0.9592627631176829.[0m
[32m[I 2021-06-01 14:40:56,708][0m Trial 134 finished with value: 0.9574132428296774 and parameters: {'criterion': 'entropy', 'max_depth': 20, 'max_features': 'auto', 'min_samples_leaf': 1, 'min_samples_split': 3, 'n_estimators': 55}. Best is trial 41 with value: 0.9592627631176829.[0m
[32m[I 2021-06-01 14:40:58,054][0m Trial 139 finished with value: 0.9579753843457481 and parameters: {'criterion': 'entropy', 'max_depth': None, 'max_features': 'auto', 'min_samples_leaf': 1, 'min_samples_split': 3, 'n_estimators': 35}. Best is trial 41 with value: 0.9592627631176829.[0m
[32m[I 2021-06-01 14:40:58,118][0m Trial 153 finished with value: 0.957114048732652 and parameters: {'criterion': 'entropy', 'max_depth': 20, 'max_features': 'log2', 'min_samples_leaf': 1, 'min_samples_split': 3, 'n_estimators': 35}. Best is trial 41 with value: 0.9592627631176829.[0m
[32m[I 2021-06-01 14:40:58,691][0m Trial 141 finished with value: 0.9574192663560869 and parameters: {'criterion': 'entropy', 'max_depth': 20, 'max_features': 'auto', 'min_samples_leaf': 1, 'min_samples_split': 3, 'n_estimators': 35}. Best is trial 41 with value: 0.9592627631176829.[0m
[32m[I 2021-06-01 14:40:59,243][0m Trial 137 finished with value: 0.9579381902299321 and parameters: {'criterion': 'entropy', 'max_depth': None, 'max_features': 'auto', 'min_samples_leaf': 1, 'min_samples_split': 3, 'n_estimators': 35}. Best is trial 41 with value: 0.9592627631176829.[0m
[32m[I 2021-06-01 14:41:00,311][0m Trial 144 finished with value: 0.9580628242072416 and parameters: {'criterion': 'entropy', 'max_depth': 20, 'max_features': 'auto', 'min_samples_leaf': 1, 'min_samples_split': 3, 'n_estimators': 35}. Best is trial 41 with value: 0.9592627631176829.[0m
[32m[I 2021-06-01 14:41:02,422][0m Trial 159 finished with value: 0.9573764536375544 and parameters: {'criterion': 'entropy', 'max_depth': 20, 'max_features': 'log2', 'min_samples_leaf': 1, 'min_samples_split': 3, 'n_estimators': 35}. Best is trial 41 with value: 0.9592627631176829.[0m
[32m[I 2021-06-01 14:41:04,204][0m Trial 145 finished with value: 0.9576571286144935 and parameters: {'criterion': 'entropy', 'max_depth': 20, 'max_features': 'auto', 'min_samples_leaf': 1, 'min_samples_split': 3, 'n_estimators': 35}. Best is trial 41 with value: 0.9592627631176829.[0m
[32m[I 2021-06-01 14:41:05,309][0m Trial 143 finished with value: 0.9574733734653471 and parameters: {'criterion': 'entropy', 'max_depth': 20, 'max_features': 'auto', 'min_samples_leaf': 1, 'min_samples_split': 3, 'n_estimators': 35}. Best is trial 41 with value: 0.9592627631176829.[0m
[32m[I 2021-06-01 14:41:06,522][0m Trial 160 finished with value: 0.9575472096829378 and parameters: {'criterion': 'entropy', 'max_depth': 20, 'max_features': 'log2', 'min_samples_leaf': 1, 'min_samples_split': 3, 'n_estimators': 35}. Best is trial 41 with value: 0.9592627631176829.[0m
[32m[I 2021-06-01 14:41:06,752][0m Trial 142 finished with value: 0.9575289550623461 and parameters: {'criterion': 'entropy', 'max_depth': 20, 'max_features': 'auto', 'min_samples_leaf': 1, 'min_samples_split': 3, 'n_estimators': 35}. Best is trial 41 with value: 0.9592627631176829.[0m
[32m[I 2021-06-01 14:41:07,150][0m Trial 166 finished with value: 0.9572273608596433 and parameters: {'criterion': 'entropy', 'max_depth': 20, 'max_features': 'auto', 'min_samples_leaf': 1, 'min_samples_split': 9, 'n_estimators': 10}. Best is trial 41 with value: 0.9592627631176829.[0m
[32m[I 2021-06-01 14:41:07,350][0m Trial 156 finished with value: 0.9574011342216728 and parameters: {'criterion': 'entropy', 'max_depth': 20, 'max_features': 'log2', 'min_samples_leaf': 1, 'min_samples_split': 3, 'n_estimators': 35}. Best is trial 41 with value: 0.9592627631176829.[0m
[32m[I 2021-06-01 14:41:08,570][0m Trial 150 finished with value: 0.957739227805939 and parameters: {'criterion': 'entropy', 'max_depth': 20, 'max_features': 'auto', 'min_samples_leaf': 1, 'min_samples_split': 3, 'n_estimators': 35}. Best is trial 41 with value: 0.9592627631176829.[0m
[32m[I 2021-06-01 14:41:09,474][0m Trial 167 finished with value: 0.9589088962215879 and parameters: {'criterion': 'entropy', 'max_depth': 20, 'max_features': 'auto', 'min_samples_leaf': 1, 'min_samples_split': 3, 'n_estimators': 10}. Best is trial 41 with value: 0.9592627631176829.[0m
[32m[I 2021-06-01 14:41:10,496][0m Trial 168 finished with value: 0.9588124075866726 and parameters: {'criterion': 'entropy', 'max_depth': 20, 'max_features': 'auto', 'min_samples_leaf': 1, 'min_samples_split': 3, 'n_estimators': 10}. Best is trial 41 with value: 0.9592627631176829.[0m
[32m[I 2021-06-01 14:41:10,699][0m Trial 148 finished with value: 0.9580608535432786 and parameters: {'criterion': 'entropy', 'max_depth': 20, 'max_features': 'auto', 'min_samples_leaf': 1, 'min_samples_split': 3, 'n_estimators': 35}. Best is trial 41 with value: 0.9592627631176829.[0m
[32m[I 2021-06-01 14:41:11,029][0m Trial 135 finished with value: 0.9576021777129438 and parameters: {'criterion': 'entropy', 'max_depth': None, 'max_features': 'auto', 'min_samples_leaf': 1, 'min_samples_split': 3, 'n_estimators': 55}. Best is trial 41 with value: 0.9592627631176829.[0m
[32m[I 2021-06-01 14:41:11,706][0m Trial 147 finished with value: 0.957476842003735 and parameters: {'criterion': 'entropy', 'max_depth': 20, 'max_features': 'auto', 'min_samples_leaf': 1, 'min_samples_split': 3, 'n_estimators': 35}. Best is trial 41 with value: 0.9592627631176829.[0m
[32m[I 2021-06-01 14:41:12,154][0m Trial 162 finished with value: 0.9575610323454485 and parameters: {'criterion': 'entropy', 'max_depth': 20, 'max_features': 'log2', 'min_samples_leaf': 1, 'min_samples_split': 3, 'n_estimators': 35}. Best is trial 41 with value: 0.9592627631176829.[0m
[32m[I 2021-06-01 14:41:12,637][0m Trial 154 finished with value: 0.9577570825648797 and parameters: {'criterion': 'entropy', 'max_depth': 20, 'max_features': 'auto', 'min_samples_leaf': 1, 'min_samples_split': 3, 'n_estimators': 35}. Best is trial 41 with value: 0.9592627631176829.[0m
[32m[I 2021-06-01 14:41:12,700][0m Trial 163 finished with value: 0.9571593349356 and parameters: {'criterion': 'entropy', 'max_depth': 20, 'max_features': 'log2', 'min_samples_leaf': 1, 'min_samples_split': 3, 'n_estimators': 35}. Best is trial 41 with value: 0.9592627631176829.[0m
[32m[I 2021-06-01 14:41:13,055][0m Trial 158 finished with value: 0.9581059903263874 and parameters: {'criterion': 'entropy', 'max_depth': 20, 'max_features': 'auto', 'min_samples_leaf': 1, 'min_samples_split': 3, 'n_estimators': 30}. Best is trial 41 with value: 0.9592627631176829.[0m
[32m[I 2021-06-01 14:41:13,180][0m Trial 161 finished with value: 0.9572856890453648 and parameters: {'criterion': 'entropy', 'max_depth': 20, 'max_features': 'log2', 'min_samples_leaf': 1, 'min_samples_split': 3, 'n_estimators': 35}. Best is trial 41 with value: 0.9592627631176829.[0m
[32m[I 2021-06-01 14:41:13,246][0m Trial 151 finished with value: 0.957783565695793 and parameters: {'criterion': 'entropy', 'max_depth': 20, 'max_features': 'auto', 'min_samples_leaf': 1, 'min_samples_split': 3, 'n_estimators': 35}. Best is trial 41 with value: 0.9592627631176829.[0m
[32m[I 2021-06-01 14:41:14,442][0m Trial 170 finished with value: 0.9587553890274944 and parameters: {'criterion': 'entropy', 'max_depth': 20, 'max_features': 'auto', 'min_samples_leaf': 1, 'min_samples_split': 3, 'n_estimators': 10}. Best is trial 41 with value: 0.9592627631176829.[0m
[32m[I 2021-06-01 14:41:15,467][0m Trial 136 finished with value: 0.9575527394696668 and parameters: {'criterion': 'entropy', 'max_depth': None, 'max_features': 'auto', 'min_samples_leaf': 1, 'min_samples_split': 3, 'n_estimators': 55}. Best is trial 41 with value: 0.9592627631176829.[0m
[32m[I 2021-06-01 14:41:15,491][0m Trial 157 finished with value: 0.9576542857555446 and parameters: {'criterion': 'entropy', 'max_depth': 20, 'max_features': 'auto', 'min_samples_leaf': 1, 'min_samples_split': 3, 'n_estimators': 35}. Best is trial 41 with value: 0.9592627631176829.[0m
[32m[I 2021-06-01 14:41:15,900][0m Trial 149 finished with value: 0.9577529769844986 and parameters: {'criterion': 'entropy', 'max_depth': 20, 'max_features': 'auto', 'min_samples_leaf': 1, 'min_samples_split': 3, 'n_estimators': 35}. Best is trial 41 with value: 0.9592627631176829.[0m
[32m[I 2021-06-01 14:41:16,239][0m Trial 165 finished with value: 0.9572192738661542 and parameters: {'criterion': 'entropy', 'max_depth': 20, 'max_features': 'log2', 'min_samples_leaf': 1, 'min_samples_split': 3, 'n_estimators': 35}. Best is trial 41 with value: 0.9592627631176829.[0m
[32m[I 2021-06-01 14:41:16,693][0m Trial 176 finished with value: 0.9586876440154508 and parameters: {'criterion': 'entropy', 'max_depth': 30, 'max_features': 'auto', 'min_samples_leaf': 1, 'min_samples_split': 3, 'n_estimators': 10}. Best is trial 41 with value: 0.9592627631176829.[0m
[32m[I 2021-06-01 14:41:16,700][0m Trial 173 finished with value: 0.9574226946692879 and parameters: {'criterion': 'entropy', 'max_depth': 25, 'max_features': 'auto', 'min_samples_leaf': 1, 'min_samples_split': 9, 'n_estimators': 10}. Best is trial 41 with value: 0.9592627631176829.[0m
[32m[I 2021-06-01 14:41:17,260][0m Trial 171 finished with value: 0.9571161651666152 and parameters: {'criterion': 'entropy', 'max_depth': 20, 'max_features': 'auto', 'min_samples_leaf': 1, 'min_samples_split': 9, 'n_estimators': 10}. Best is trial 41 with value: 0.9592627631176829.[0m
[32m[I 2021-06-01 14:41:17,499][0m Trial 177 finished with value: 0.9585512676727788 and parameters: {'criterion': 'entropy', 'max_depth': 25, 'max_features': 'auto', 'min_samples_leaf': 1, 'min_samples_split': 3, 'n_estimators': 10}. Best is trial 41 with value: 0.9592627631176829.[0m
[32m[I 2021-06-01 14:41:18,209][0m Trial 175 finished with value: 0.9590530133936275 and parameters: {'criterion': 'entropy', 'max_depth': 25, 'max_features': 'auto', 'min_samples_leaf': 1, 'min_samples_split': 3, 'n_estimators': 10}. Best is trial 41 with value: 0.9592627631176829.[0m
[32m[I 2021-06-01 14:41:18,748][0m Trial 172 finished with value: 0.9568498866654724 and parameters: {'criterion': 'entropy', 'max_depth': 20, 'max_features': 'auto', 'min_samples_leaf': 1, 'min_samples_split': 9, 'n_estimators': 15}. Best is trial 41 with value: 0.9592627631176829.[0m
[32m[I 2021-06-01 14:41:18,760][0m Trial 179 finished with value: 0.9586346281789421 and parameters: {'criterion': 'entropy', 'max_depth': 20, 'max_features': 'auto', 'min_samples_leaf': 1, 'min_samples_split': 3, 'n_estimators': 10}. Best is trial 41 with value: 0.9592627631176829.[0m
[32m[I 2021-06-01 14:41:19,154][0m Trial 152 finished with value: 0.9577443456869817 and parameters: {'criterion': 'entropy', 'max_depth': 20, 'max_features': 'auto', 'min_samples_leaf': 1, 'min_samples_split': 3, 'n_estimators': 35}. Best is trial 41 with value: 0.9592627631176829.[0m
[32m[I 2021-06-01 14:41:19,511][0m Trial 174 finished with value: 0.9588527871617055 and parameters: {'criterion': 'entropy', 'max_depth': 25, 'max_features': 'auto', 'min_samples_leaf': 1, 'min_samples_split': 3, 'n_estimators': 10}. Best is trial 41 with value: 0.9592627631176829.[0m
[32m[I 2021-06-01 14:41:20,531][0m Trial 181 finished with value: 0.9587925825764945 and parameters: {'criterion': 'entropy', 'max_depth': 20, 'max_features': 'auto', 'min_samples_leaf': 1, 'min_samples_split': 3, 'n_estimators': 10}. Best is trial 41 with value: 0.9592627631176829.[0m
[32m[I 2021-06-01 14:41:22,155][0m Trial 182 finished with value: 0.9575245839380638 and parameters: {'criterion': 'entropy', 'max_depth': 25, 'max_features': 'auto', 'min_samples_leaf': 1, 'min_samples_split': 7, 'n_estimators': 10}. Best is trial 41 with value: 0.9592627631176829.[0m
[32m[I 2021-06-01 14:41:23,331][0m Trial 184 finished with value: 0.9598840528678435 and parameters: {'criterion': 'entropy', 'max_depth': 25, 'max_features': 'auto', 'min_samples_leaf': 1, 'min_samples_split': 3, 'n_estimators': 10}. Best is trial 184 with value: 0.9598840528678435.[0m
[32m[I 2021-06-01 14:41:23,935][0m Trial 187 finished with value: 0.958764488924599 and parameters: {'criterion': 'entropy', 'max_depth': 40, 'max_features': 'auto', 'min_samples_leaf': 1, 'min_samples_split': 3, 'n_estimators': 10}. Best is trial 184 with value: 0.9598840528678435.[0m
[32m[I 2021-06-01 14:41:24,180][0m Trial 185 finished with value: 0.9583436475343049 and parameters: {'criterion': 'entropy', 'max_depth': 40, 'max_features': 'auto', 'min_samples_leaf': 1, 'min_samples_split': 3, 'n_estimators': 10}. Best is trial 184 with value: 0.9598840528678435.[0m
[32m[I 2021-06-01 14:41:24,846][0m Trial 180 finished with value: 0.9586714177130794 and parameters: {'criterion': 'entropy', 'max_depth': 25, 'max_features': 'auto', 'min_samples_leaf': 1, 'min_samples_split': 3, 'n_estimators': 15}. Best is trial 184 with value: 0.9598840528678435.[0m
[32m[I 2021-06-01 14:41:25,654][0m Trial 202 finished with value: 0.9564503386561818 and parameters: {'criterion': 'gini', 'max_depth': 25, 'max_features': 'auto', 'min_samples_leaf': 8, 'min_samples_split': 7, 'n_estimators': 15}. Best is trial 184 with value: 0.9598840528678435.[0m
[32m[I 2021-06-01 14:41:25,670][0m Trial 193 finished with value: 0.958358850756369 and parameters: {'criterion': 'entropy', 'max_depth': 30, 'max_features': 'auto', 'min_samples_leaf': 1, 'min_samples_split': 5, 'n_estimators': 10}. Best is trial 184 with value: 0.9598840528678435.[0m
[32m[I 2021-06-01 14:41:30,648][0m Trial 203 finished with value: 0.9581552577002199 and parameters: {'criterion': 'gini', 'max_depth': 25, 'max_features': 'auto', 'min_samples_leaf': 1, 'min_samples_split': 3, 'n_estimators': 15}. Best is trial 184 with value: 0.9598840528678435.[0m
[32m[I 2021-06-01 14:41:30,687][0m Trial 183 finished with value: 0.959396715034378 and parameters: {'criterion': 'entropy', 'max_depth': 25, 'max_features': 'auto', 'min_samples_leaf': 1, 'min_samples_split': 3, 'n_estimators': 10}. Best is trial 184 with value: 0.9598840528678435.[0m
[32m[I 2021-06-01 14:41:30,795][0m Trial 201 finished with value: 0.9574109868659304 and parameters: {'criterion': 'gini', 'max_depth': 25, 'max_features': 'auto', 'min_samples_leaf': 1, 'min_samples_split': 7, 'n_estimators': 15}. Best is trial 184 with value: 0.9598840528678435.[0m
[32m[I 2021-06-01 14:41:30,844][0m Trial 200 finished with value: 0.9565729918055969 and parameters: {'criterion': 'entropy', 'max_depth': 25, 'max_features': 'auto', 'min_samples_leaf': 8, 'min_samples_split': 3, 'n_estimators': 10}. Best is trial 184 with value: 0.9598840528678435.[0m
[32m[I 2021-06-01 14:41:30,842][0m Trial 192 finished with value: 0.9579326158442925 and parameters: {'criterion': 'entropy', 'max_depth': 25, 'max_features': 'auto', 'min_samples_leaf': 1, 'min_samples_split': 5, 'n_estimators': 10}. Best is trial 184 with value: 0.9598840528678435.[0m
[32m[I 2021-06-01 14:41:30,846][0m Trial 204 finished with value: 0.9586407213614605 and parameters: {'criterion': 'gini', 'max_depth': 25, 'max_features': 'auto', 'min_samples_leaf': 1, 'min_samples_split': 3, 'n_estimators': 10}. Best is trial 184 with value: 0.9598840528678435.[0m
[32m[I 2021-06-01 14:41:30,857][0m Trial 195 finished with value: 0.9587587555670531 and parameters: {'criterion': 'entropy', 'max_depth': 30, 'max_features': 'auto', 'min_samples_leaf': 1, 'min_samples_split': 3, 'n_estimators': 10}. Best is trial 184 with value: 0.9598840528678435.[0m
[32m[I 2021-06-01 14:41:30,858][0m Trial 155 finished with value: 0.957986707930685 and parameters: {'criterion': 'entropy', 'max_depth': 20, 'max_features': 'auto', 'min_samples_leaf': 1, 'min_samples_split': 3, 'n_estimators': 35}. Best is trial 184 with value: 0.9598840528678435.[0m
[32m[I 2021-06-01 14:41:30,986][0m Trial 169 finished with value: 0.9569548694252484 and parameters: {'criterion': 'entropy', 'max_depth': 20, 'max_features': 'auto', 'min_samples_leaf': 1, 'min_samples_split': 9, 'n_estimators': 30}. Best is trial 184 with value: 0.9598840528678435.[0m
[32m[I 2021-06-01 14:41:31,007][0m Trial 191 finished with value: 0.9574645071610055 and parameters: {'criterion': 'entropy', 'max_depth': 40, 'max_features': 'auto', 'min_samples_leaf': 1, 'min_samples_split': 7, 'n_estimators': 10}. Best is trial 184 with value: 0.9598840528678435.[0m
[32m[I 2021-06-01 14:41:31,305][0m Trial 206 finished with value: 0.9578054896607494 and parameters: {'criterion': 'gini', 'max_depth': 25, 'max_features': 'auto', 'min_samples_leaf': 1, 'min_samples_split': 5, 'n_estimators': 15}. Best is trial 184 with value: 0.9598840528678435.[0m
[32m[I 2021-06-01 14:41:31,322][0m Trial 186 finished with value: 0.9592369165235454 and parameters: {'criterion': 'entropy', 'max_depth': 25, 'max_features': 'auto', 'min_samples_leaf': 1, 'min_samples_split': 3, 'n_estimators': 10}. Best is trial 184 with value: 0.9598840528678435.[0m
[32m[I 2021-06-01 14:41:31,345][0m Trial 197 finished with value: 0.9579855046585074 and parameters: {'criterion': 'entropy', 'max_depth': 30, 'max_features': 'auto', 'min_samples_leaf': 1, 'min_samples_split': 5, 'n_estimators': 15}. Best is trial 184 with value: 0.9598840528678435.[0m
[32m[I 2021-06-01 14:41:32,044][0m Trial 196 finished with value: 0.9585908062097687 and parameters: {'criterion': 'entropy', 'max_depth': 30, 'max_features': 'auto', 'min_samples_leaf': 1, 'min_samples_split': 3, 'n_estimators': 15}. Best is trial 184 with value: 0.9598840528678435.[0m
[32m[I 2021-06-01 14:41:32,343][0m Trial 199 finished with value: 0.9571084648957513 and parameters: {'criterion': 'entropy', 'max_depth': 25, 'max_features': 'auto', 'min_samples_leaf': 1, 'min_samples_split': 7, 'n_estimators': 15}. Best is trial 184 with value: 0.9598840528678435.[0m
[32m[I 2021-06-01 14:41:32,368][0m Trial 205 finished with value: 0.9580011620395059 and parameters: {'criterion': 'gini', 'max_depth': 25, 'max_features': 'auto', 'min_samples_leaf': 1, 'min_samples_split': 3, 'n_estimators': 15}. Best is trial 184 with value: 0.9598840528678435.[0m
[32m[I 2021-06-01 14:41:32,962][0m Trial 188 finished with value: 0.9594336362475765 and parameters: {'criterion': 'entropy', 'max_depth': 25, 'max_features': 'auto', 'min_samples_leaf': 1, 'min_samples_split': 3, 'n_estimators': 10}. Best is trial 184 with value: 0.9598840528678435.[0m
[32m[I 2021-06-01 14:41:33,400][0m Trial 194 finished with value: 0.9586993609492709 and parameters: {'criterion': 'entropy', 'max_depth': 25, 'max_features': 'auto', 'min_samples_leaf': 1, 'min_samples_split': 3, 'n_estimators': 10}. Best is trial 184 with value: 0.9598840528678435.[0m
[32m[I 2021-06-01 14:41:33,536][0m Trial 198 finished with value: 0.9584700990413287 and parameters: {'criterion': 'entropy', 'max_depth': 25, 'max_features': 'auto', 'min_samples_leaf': 1, 'min_samples_split': 3, 'n_estimators': 15}. Best is trial 184 with value: 0.9598840528678435.[0m
[32m[I 2021-06-01 14:41:33,947][0m Trial 190 finished with value: 0.9585898444732445 and parameters: {'criterion': 'entropy', 'max_depth': 25, 'max_features': 'auto', 'min_samples_leaf': 1, 'min_samples_split': 3, 'n_estimators': 10}. Best is trial 184 with value: 0.9598840528678435.[0m
[32m[I 2021-06-01 14:41:34,658][0m Trial 164 finished with value: 0.9576205047104154 and parameters: {'criterion': 'entropy', 'max_depth': 20, 'max_features': 'auto', 'min_samples_leaf': 1, 'min_samples_split': 3, 'n_estimators': 35}. Best is trial 184 with value: 0.9598840528678435.[0m
[32m[I 2021-06-01 14:41:40,462][0m Trial 209 finished with value: 0.9584128268903236 and parameters: {'criterion': 'gini', 'max_depth': 25, 'max_features': 'auto', 'min_samples_leaf': 1, 'min_samples_split': 3, 'n_estimators': 15}. Best is trial 184 with value: 0.9598840528678435.[0m
[32m[I 2021-06-01 14:41:40,590][0m Trial 189 finished with value: 0.9579504571758826 and parameters: {'criterion': 'entropy', 'max_depth': 25, 'max_features': 'auto', 'min_samples_leaf': 1, 'min_samples_split': 3, 'n_estimators': 20}. Best is trial 184 with value: 0.9598840528678435.[0m
[32m[I 2021-06-01 14:41:40,772][0m Trial 207 finished with value: 0.9580070522106915 and parameters: {'criterion': 'gini', 'max_depth': 30, 'max_features': 'auto', 'min_samples_leaf': 1, 'min_samples_split': 3, 'n_estimators': 15}. Best is trial 184 with value: 0.9598840528678435.[0m
[32m[I 2021-06-01 14:41:42,142][0m Trial 211 finished with value: 0.9577739389575856 and parameters: {'criterion': 'gini', 'max_depth': 30, 'max_features': 'auto', 'min_samples_leaf': 1, 'min_samples_split': 3, 'n_estimators': 20}. Best is trial 184 with value: 0.9598840528678435.[0m
[32m[I 2021-06-01 14:41:42,361][0m Trial 222 finished with value: 0.9582132119289989 and parameters: {'criterion': 'gini', 'max_depth': 25, 'max_features': 'auto', 'min_samples_leaf': 1, 'min_samples_split': 3, 'n_estimators': 20}. Best is trial 184 with value: 0.9598840528678435.[0m
