[32m[I 2021-06-01 14:39:31,193][0m Trial 93 finished with value: 0.9564495392178577 and parameters: {'criterion': 'entropy', 'max_depth': 10, 'max_features': 'auto', 'min_samples_leaf': 2, 'min_samples_split': 4, 'n_estimators': 25}. Best is trial 41 with value: 0.9592627631176829.[0m
[32m[I 2021-06-01 14:39:31,647][0m Trial 78 finished with value: 0.9575189806796415 and parameters: {'criterion': 'entropy', 'max_depth': 35, 'max_features': 'auto', 'min_samples_leaf': 2, 'min_samples_split': 4, 'n_estimators': 75}. Best is trial 41 with value: 0.9592627631176829.[0m
/gscratch/davinci/usr/evankomp/miniconda3/envs/cytoxnet/lib/python3.7/site-packages/sklearn/metrics/_classification.py:1248: UndefinedMetricWarning: Precision is ill-defined and being set to 0.0 due to no predicted samples. Use `zero_division` parameter to control this behavior.
  _warn_prf(average, modifier, msg_start, len(result))
/gscratch/davinci/usr/evankomp/miniconda3/envs/cytoxnet/lib/python3.7/site-packages/sklearn/metrics/_classification.py:1248: UndefinedMetricWarning: Precision is ill-defined and being set to 0.0 due to no predicted samples. Use `zero_division` parameter to control this behavior.
  _warn_prf(average, modifier, msg_start, len(result))
[32m[I 2021-06-01 14:39:32,143][0m Trial 95 finished with value: 0.9565787129478396 and parameters: {'criterion': 'entropy', 'max_depth': 10, 'max_features': 'auto', 'min_samples_leaf': 2, 'min_samples_split': 4, 'n_estimators': 25}. Best is trial 41 with value: 0.9592627631176829.[0m
/gscratch/davinci/usr/evankomp/miniconda3/envs/cytoxnet/lib/python3.7/site-packages/sklearn/metrics/_classification.py:1248: UndefinedMetricWarning: Precision is ill-defined and being set to 0.0 due to no predicted samples. Use `zero_division` parameter to control this behavior.
  _warn_prf(average, modifier, msg_start, len(result))
/gscratch/davinci/usr/evankomp/miniconda3/envs/cytoxnet/lib/python3.7/site-packages/sklearn/metrics/_classification.py:1248: UndefinedMetricWarning: Precision is ill-defined and being set to 0.0 due to no predicted samples. Use `zero_division` parameter to control this behavior.
  _warn_prf(average, modifier, msg_start, len(result))
[32m[I 2021-06-01 14:39:32,688][0m Trial 98 finished with value: 0.9564501270401549 and parameters: {'criterion': 'entropy', 'max_depth': 5, 'max_features': 'auto', 'min_samples_leaf': 1, 'min_samples_split': 2, 'n_estimators': 25}. Best is trial 41 with value: 0.9592627631176829.[0m
[32m[I 2021-06-01 14:39:34,084][0m Trial 45 finished with value: 0.9570156077321915 and parameters: {'criterion': 'entropy', 'max_depth': 15, 'max_features': 'auto', 'min_samples_leaf': 1, 'min_samples_split': 3, 'n_estimators': 190}. Best is trial 41 with value: 0.9592627631176829.[0m
/gscratch/davinci/usr/evankomp/miniconda3/envs/cytoxnet/lib/python3.7/site-packages/sklearn/metrics/_classification.py:1248: UndefinedMetricWarning: Precision is ill-defined and being set to 0.0 due to no predicted samples. Use `zero_division` parameter to control this behavior.
  _warn_prf(average, modifier, msg_start, len(result))
/gscratch/davinci/usr/evankomp/miniconda3/envs/cytoxnet/lib/python3.7/site-packages/sklearn/metrics/_classification.py:1248: UndefinedMetricWarning: Precision is ill-defined and being set to 0.0 due to no predicted samples. Use `zero_division` parameter to control this behavior.
  _warn_prf(average, modifier, msg_start, len(result))
/gscratch/davinci/usr/evankomp/miniconda3/envs/cytoxnet/lib/python3.7/site-packages/sklearn/metrics/_classification.py:1248: UndefinedMetricWarning: Precision is ill-defined and being set to 0.0 due to no predicted samples. Use `zero_division` parameter to control this behavior.
  _warn_prf(average, modifier, msg_start, len(result))
[32m[I 2021-06-01 14:39:35,308][0m Trial 47 finished with value: 0.9573705867108837 and parameters: {'criterion': 'entropy', 'max_depth': 45, 'max_features': 'auto', 'min_samples_leaf': 1, 'min_samples_split': 3, 'n_estimators': 175}. Best is trial 41 with value: 0.9592627631176829.[0m
[32m[I 2021-06-01 14:39:35,835][0m Trial 85 finished with value: 0.9570072000431733 and parameters: {'criterion': 'entropy', 'max_depth': 20, 'max_features': 'auto', 'min_samples_leaf': 2, 'min_samples_split': 4, 'n_estimators': 70}. Best is trial 41 with value: 0.9592627631176829.[0m
/gscratch/davinci/usr/evankomp/miniconda3/envs/cytoxnet/lib/python3.7/site-packages/sklearn/metrics/_classification.py:1248: UndefinedMetricWarning: Precision is ill-defined and being set to 0.0 due to no predicted samples. Use `zero_division` parameter to control this behavior.
  _warn_prf(average, modifier, msg_start, len(result))
/gscratch/davinci/usr/evankomp/miniconda3/envs/cytoxnet/lib/python3.7/site-packages/sklearn/metrics/_classification.py:1248: UndefinedMetricWarning: Precision is ill-defined and being set to 0.0 due to no predicted samples. Use `zero_division` parameter to control this behavior.
  _warn_prf(average, modifier, msg_start, len(result))
/gscratch/davinci/usr/evankomp/miniconda3/envs/cytoxnet/lib/python3.7/site-packages/sklearn/metrics/_classification.py:1248: UndefinedMetricWarning: Precision is ill-defined and being set to 0.0 due to no predicted samples. Use `zero_division` parameter to control this behavior.
  _warn_prf(average, modifier, msg_start, len(result))
[32m[I 2021-06-01 14:39:36,857][0m Trial 104 finished with value: 0.9564503856819655 and parameters: {'criterion': 'entropy', 'max_depth': 5, 'max_features': 'auto', 'min_samples_leaf': 1, 'min_samples_split': 2, 'n_estimators': 25}. Best is trial 41 with value: 0.9592627631176829.[0m
/gscratch/davinci/usr/evankomp/miniconda3/envs/cytoxnet/lib/python3.7/site-packages/sklearn/metrics/_classification.py:1248: UndefinedMetricWarning: Precision is ill-defined and being set to 0.0 due to no predicted samples. Use `zero_division` parameter to control this behavior.
  _warn_prf(average, modifier, msg_start, len(result))
/gscratch/davinci/usr/evankomp/miniconda3/envs/cytoxnet/lib/python3.7/site-packages/sklearn/metrics/_classification.py:1248: UndefinedMetricWarning: Precision is ill-defined and being set to 0.0 due to no predicted samples. Use `zero_division` parameter to control this behavior.
  _warn_prf(average, modifier, msg_start, len(result))
[32m[I 2021-06-01 14:39:38,359][0m Trial 105 finished with value: 0.9564500094756954 and parameters: {'criterion': 'entropy', 'max_depth': 5, 'max_features': 'auto', 'min_samples_leaf': 1, 'min_samples_split': 2, 'n_estimators': 25}. Best is trial 41 with value: 0.9592627631176829.[0m
/gscratch/davinci/usr/evankomp/miniconda3/envs/cytoxnet/lib/python3.7/site-packages/sklearn/metrics/_classification.py:1248: UndefinedMetricWarning: Precision is ill-defined and being set to 0.0 due to no predicted samples. Use `zero_division` parameter to control this behavior.
  _warn_prf(average, modifier, msg_start, len(result))
/gscratch/davinci/usr/evankomp/miniconda3/envs/cytoxnet/lib/python3.7/site-packages/sklearn/metrics/_classification.py:1248: UndefinedMetricWarning: Precision is ill-defined and being set to 0.0 due to no predicted samples. Use `zero_division` parameter to control this behavior.
  _warn_prf(average, modifier, msg_start, len(result))
[32m[I 2021-06-01 14:39:40,456][0m Trial 87 finished with value: 0.9564503386561818 and parameters: {'criterion': 'entropy', 'max_depth': 10, 'max_features': 'auto', 'min_samples_leaf': 2, 'min_samples_split': 4, 'n_estimators': 70}. Best is trial 41 with value: 0.9592627631176829.[0m
[32m[I 2021-06-01 14:39:40,468][0m Trial 35 finished with value: 0.9564505972979926 and parameters: {'criterion': 'entropy', 'max_depth': 15, 'max_features': 'sqrt', 'min_samples_leaf': 7, 'min_samples_split': 8, 'n_estimators': 265}. Best is trial 41 with value: 0.9592627631176829.[0m
[32m[I 2021-06-01 14:39:41,478][0m Trial 86 finished with value: 0.957333474374542 and parameters: {'criterion': 'entropy', 'max_depth': 20, 'max_features': 'auto', 'min_samples_leaf': 2, 'min_samples_split': 4, 'n_estimators': 75}. Best is trial 41 with value: 0.9592627631176829.[0m
/gscratch/davinci/usr/evankomp/miniconda3/envs/cytoxnet/lib/python3.7/site-packages/sklearn/metrics/_classification.py:1248: UndefinedMetricWarning: Precision is ill-defined and being set to 0.0 due to no predicted samples. Use `zero_division` parameter to control this behavior.
  _warn_prf(average, modifier, msg_start, len(result))
[32m[I 2021-06-01 14:39:41,673][0m Trial 106 finished with value: 0.9564503621690736 and parameters: {'criterion': 'entropy', 'max_depth': 5, 'max_features': 'auto', 'min_samples_leaf': 1, 'min_samples_split': 2, 'n_estimators': 20}. Best is trial 41 with value: 0.9592627631176829.[0m
[32m[I 2021-06-01 14:39:41,963][0m Trial 46 finished with value: 0.95743332678708 and parameters: {'criterion': 'entropy', 'max_depth': 45, 'max_features': 'auto', 'min_samples_leaf': 1, 'min_samples_split': 3, 'n_estimators': 190}. Best is trial 41 with value: 0.9592627631176829.[0m
[32m[I 2021-06-01 14:39:45,832][0m Trial 110 finished with value: 0.9577467764084219 and parameters: {'criterion': 'entropy', 'max_depth': 15, 'max_features': 'auto', 'min_samples_leaf': 1, 'min_samples_split': 2, 'n_estimators': 15}. Best is trial 41 with value: 0.9592627631176829.[0m
[32m[I 2021-06-01 14:39:46,031][0m Trial 101 finished with value: 0.9579709542413066 and parameters: {'criterion': 'entropy', 'max_depth': 20, 'max_features': 'auto', 'min_samples_leaf': 1, 'min_samples_split': 2, 'n_estimators': 25}. Best is trial 41 with value: 0.9592627631176829.[0m
/gscratch/davinci/usr/evankomp/miniconda3/envs/cytoxnet/lib/python3.7/site-packages/sklearn/metrics/_classification.py:1248: UndefinedMetricWarning: Precision is ill-defined and being set to 0.0 due to no predicted samples. Use `zero_division` parameter to control this behavior.
  _warn_prf(average, modifier, msg_start, len(result))
[32m[I 2021-06-01 14:39:46,211][0m Trial 37 finished with value: 0.9573340997103991 and parameters: {'criterion': 'entropy', 'max_depth': 15, 'max_features': 'sqrt', 'min_samples_leaf': 1, 'min_samples_split': 2, 'n_estimators': 230}. Best is trial 41 with value: 0.9592627631176829.[0m
[32m[I 2021-06-01 14:39:47,136][0m Trial 109 finished with value: 0.9575210035771778 and parameters: {'criterion': 'entropy', 'max_depth': 15, 'max_features': 'auto', 'min_samples_leaf': 1, 'min_samples_split': 2, 'n_estimators': 15}. Best is trial 41 with value: 0.9592627631176829.[0m
[32m[I 2021-06-01 14:39:49,334][0m Trial 103 finished with value: 0.9584711952918294 and parameters: {'criterion': 'entropy', 'max_depth': None, 'max_features': 'auto', 'min_samples_leaf': 1, 'min_samples_split': 2, 'n_estimators': 25}. Best is trial 41 with value: 0.9592627631176829.[0m
[32m[I 2021-06-01 14:39:49,983][0m Trial 108 finished with value: 0.9575514522458416 and parameters: {'criterion': 'entropy', 'max_depth': 15, 'max_features': 'auto', 'min_samples_leaf': 1, 'min_samples_split': 2, 'n_estimators': 20}. Best is trial 41 with value: 0.9592627631176829.[0m
[32m[I 2021-06-01 14:39:51,066][0m Trial 115 finished with value: 0.9578018078100492 and parameters: {'criterion': 'entropy', 'max_depth': 15, 'max_features': 'sqrt', 'min_samples_leaf': 1, 'min_samples_split': 2, 'n_estimators': 15}. Best is trial 41 with value: 0.9592627631176829.[0m
[32m[I 2021-06-01 14:39:52,189][0m Trial 102 finished with value: 0.9580433261688288 and parameters: {'criterion': 'entropy', 'max_depth': 20, 'max_features': 'auto', 'min_samples_leaf': 1, 'min_samples_split': 2, 'n_estimators': 25}. Best is trial 41 with value: 0.9592627631176829.[0m
[32m[I 2021-06-01 14:39:52,215][0m Trial 88 finished with value: 0.9568676855877337 and parameters: {'criterion': 'entropy', 'max_depth': 35, 'max_features': 'auto', 'min_samples_leaf': 2, 'min_samples_split': 4, 'n_estimators': 65}. Best is trial 41 with value: 0.9592627631176829.[0m
[32m[I 2021-06-01 14:39:52,945][0m Trial 113 finished with value: 0.9574337076967648 and parameters: {'criterion': 'entropy', 'max_depth': 15, 'max_features': 'auto', 'min_samples_leaf': 1, 'min_samples_split': 2, 'n_estimators': 20}. Best is trial 41 with value: 0.9592627631176829.[0m
/gscratch/davinci/usr/evankomp/miniconda3/envs/cytoxnet/lib/python3.7/site-packages/sklearn/metrics/_classification.py:1248: UndefinedMetricWarning: Precision is ill-defined and being set to 0.0 due to no predicted samples. Use `zero_division` parameter to control this behavior.
  _warn_prf(average, modifier, msg_start, len(result))
[32m[I 2021-06-01 14:39:57,067][0m Trial 89 finished with value: 0.9571756315050767 and parameters: {'criterion': 'entropy', 'max_depth': 35, 'max_features': 'auto', 'min_samples_leaf': 2, 'min_samples_split': 4, 'n_estimators': 65}. Best is trial 41 with value: 0.9592627631176829.[0m
/gscratch/davinci/usr/evankomp/miniconda3/envs/cytoxnet/lib/python3.7/site-packages/sklearn/metrics/_classification.py:1248: UndefinedMetricWarning: Precision is ill-defined and being set to 0.0 due to no predicted samples. Use `zero_division` parameter to control this behavior.
  _warn_prf(average, modifier, msg_start, len(result))
[32m[I 2021-06-01 14:40:00,956][0m Trial 100 finished with value: 0.956450291630398 and parameters: {'criterion': 'entropy', 'max_depth': 5, 'max_features': 'auto', 'min_samples_leaf': 1, 'min_samples_split': 2, 'n_estimators': 90}. Best is trial 41 with value: 0.9592627631176829.[0m
[32m[I 2021-06-01 14:40:04,984][0m Trial 91 finished with value: 0.9564501270401549 and parameters: {'criterion': 'entropy', 'max_depth': 10, 'max_features': 'auto', 'min_samples_leaf': 2, 'min_samples_split': 4, 'n_estimators': 90}. Best is trial 41 with value: 0.9592627631176829.[0m
[32m[I 2021-06-01 14:40:18,364][0m Trial 92 finished with value: 0.9564500565014791 and parameters: {'criterion': 'entropy', 'max_depth': 10, 'max_features': 'auto', 'min_samples_leaf': 2, 'min_samples_split': 4, 'n_estimators': 90}. Best is trial 41 with value: 0.9592627631176829.[0m
[32m[I 2021-06-01 14:40:20,615][0m Trial 112 finished with value: 0.9571237090039965 and parameters: {'criterion': 'entropy', 'max_depth': 15, 'max_features': 'auto', 'min_samples_leaf': 1, 'min_samples_split': 2, 'n_estimators': 55}. Best is trial 41 with value: 0.9592627631176829.[0m
[32m[I 2021-06-01 14:40:21,817][0m Trial 90 finished with value: 0.9575275270935315 and parameters: {'criterion': 'entropy', 'max_depth': 35, 'max_features': 'auto', 'min_samples_leaf': 2, 'min_samples_split': 4, 'n_estimators': 90}. Best is trial 41 with value: 0.9592627631176829.[0m
[32m[I 2021-06-01 14:40:24,662][0m Trial 97 finished with value: 0.9565153494953144 and parameters: {'criterion': 'entropy', 'max_depth': 10, 'max_features': 'auto', 'min_samples_leaf': 1, 'min_samples_split': 2, 'n_estimators': 95}. Best is trial 41 with value: 0.9592627631176829.[0m
[32m[I 2021-06-01 14:40:25,452][0m Trial 96 finished with value: 0.9564501740659386 and parameters: {'criterion': 'entropy', 'max_depth': 10, 'max_features': 'auto', 'min_samples_leaf': 1, 'min_samples_split': 4, 'n_estimators': 95}. Best is trial 41 with value: 0.9592627631176829.[0m
[32m[I 2021-06-01 14:40:26,324][0m Trial 111 finished with value: 0.9572452751740362 and parameters: {'criterion': 'entropy', 'max_depth': 15, 'max_features': 'sqrt', 'min_samples_leaf': 1, 'min_samples_split': 2, 'n_estimators': 55}. Best is trial 41 with value: 0.9592627631176829.[0m
[32m[I 2021-06-01 14:40:27,591][0m Trial 117 finished with value: 0.9576025816262428 and parameters: {'criterion': 'entropy', 'max_depth': None, 'max_features': 'auto', 'min_samples_leaf': 1, 'min_samples_split': 2, 'n_estimators': 55}. Best is trial 41 with value: 0.9592627631176829.[0m
[32m[I 2021-06-01 14:40:28,070][0m Trial 116 finished with value: 0.9571247438888288 and parameters: {'criterion': 'entropy', 'max_depth': 15, 'max_features': 'sqrt', 'min_samples_leaf': 1, 'min_samples_split': 2, 'n_estimators': 55}. Best is trial 41 with value: 0.9592627631176829.[0m
[32m[I 2021-06-01 14:40:28,203][0m Trial 121 finished with value: 0.9571103008589189 and parameters: {'criterion': 'entropy', 'max_depth': 15, 'max_features': 'auto', 'min_samples_leaf': 1, 'min_samples_split': 2, 'n_estimators': 55}. Best is trial 41 with value: 0.9592627631176829.[0m
[32m[I 2021-06-01 14:40:29,266][0m Trial 119 finished with value: 0.957815565160962 and parameters: {'criterion': 'entropy', 'max_depth': None, 'max_features': 'auto', 'min_samples_leaf': 1, 'min_samples_split': 2, 'n_estimators': 55}. Best is trial 41 with value: 0.9592627631176829.[0m
[32m[I 2021-06-01 14:40:29,994][0m Trial 114 finished with value: 0.9575516477782667 and parameters: {'criterion': 'entropy', 'max_depth': None, 'max_features': 'sqrt', 'min_samples_leaf': 1, 'min_samples_split': 2, 'n_estimators': 55}. Best is trial 41 with value: 0.9592627631176829.[0m
[32m[I 2021-06-01 14:40:31,761][0m Trial 120 finished with value: 0.9574992255606354 and parameters: {'criterion': 'entropy', 'max_depth': None, 'max_features': 'auto', 'min_samples_leaf': 1, 'min_samples_split': 2, 'n_estimators': 55}. Best is trial 41 with value: 0.9592627631176829.[0m
[32m[I 2021-06-01 14:40:32,089][0m Trial 118 finished with value: 0.9578083019170813 and parameters: {'criterion': 'entropy', 'max_depth': None, 'max_features': 'auto', 'min_samples_leaf': 1, 'min_samples_split': 2, 'n_estimators': 55}. Best is trial 41 with value: 0.9592627631176829.[0m
[32m[I 2021-06-01 14:40:33,512][0m Trial 122 finished with value: 0.9579872638801212 and parameters: {'criterion': 'entropy', 'max_depth': 20, 'max_features': 'auto', 'min_samples_leaf': 1, 'min_samples_split': 2, 'n_estimators': 55}. Best is trial 41 with value: 0.9592627631176829.[0m
[32m[I 2021-06-01 14:40:34,651][0m Trial 124 finished with value: 0.9576222593194782 and parameters: {'criterion': 'entropy', 'max_depth': 20, 'max_features': 'auto', 'min_samples_leaf': 1, 'min_samples_split': 2, 'n_estimators': 55}. Best is trial 41 with value: 0.9592627631176829.[0m
[32m[I 2021-06-01 14:40:36,905][0m Trial 128 finished with value: 0.9580410487431281 and parameters: {'criterion': 'entropy', 'max_depth': None, 'max_features': 'auto', 'min_samples_leaf': 1, 'min_samples_split': 2, 'n_estimators': 50}. Best is trial 41 with value: 0.9592627631176829.[0m
[32m[I 2021-06-01 14:40:37,203][0m Trial 123 finished with value: 0.957549666604707 and parameters: {'criterion': 'entropy', 'max_depth': 20, 'max_features': 'auto', 'min_samples_leaf': 1, 'min_samples_split': 2, 'n_estimators': 55}. Best is trial 41 with value: 0.9592627631176829.[0m
[32m[I 2021-06-01 14:40:38,701][0m Trial 99 finished with value: 0.95760573113295 and parameters: {'criterion': 'entropy', 'max_depth': 20, 'max_features': 'auto', 'min_samples_leaf': 1, 'min_samples_split': 2, 'n_estimators': 85}. Best is trial 41 with value: 0.9592627631176829.[0m
[32m[I 2021-06-01 14:40:39,453][0m Trial 126 finished with value: 0.9577388732668256 and parameters: {'criterion': 'entropy', 'max_depth': None, 'max_features': 'auto', 'min_samples_leaf': 1, 'min_samples_split': 2, 'n_estimators': 55}. Best is trial 41 with value: 0.9592627631176829.[0m
[32m[I 2021-06-01 14:40:40,399][0m Trial 130 finished with value: 0.9577740612957257 and parameters: {'criterion': 'entropy', 'max_depth': None, 'max_features': 'auto', 'min_samples_leaf': 1, 'min_samples_split': 2, 'n_estimators': 50}. Best is trial 41 with value: 0.9592627631176829.[0m
[32m[I 2021-06-01 14:40:40,999][0m Trial 125 finished with value: 0.9580557012111759 and parameters: {'criterion': 'entropy', 'max_depth': 20, 'max_features': 'auto', 'min_samples_leaf': 1, 'min_samples_split': 2, 'n_estimators': 55}. Best is trial 41 with value: 0.9592627631176829.[0m
[32m[I 2021-06-01 14:40:41,227][0m Trial 127 finished with value: 0.9577604218424854 and parameters: {'criterion': 'entropy', 'max_depth': None, 'max_features': 'auto', 'min_samples_leaf': 1, 'min_samples_split': 2, 'n_estimators': 55}. Best is trial 41 with value: 0.9592627631176829.[0m
[32m[I 2021-06-01 14:40:41,589][0m Trial 146 finished with value: 0.9587486036401577 and parameters: {'criterion': 'entropy', 'max_depth': 20, 'max_features': 'auto', 'min_samples_leaf': 1, 'min_samples_split': 3, 'n_estimators': 10}. Best is trial 41 with value: 0.9592627631176829.[0m
[32m[I 2021-06-01 14:40:42,412][0m Trial 129 finished with value: 0.9579170628482021 and parameters: {'criterion': 'entropy', 'max_depth': None, 'max_features': 'auto', 'min_samples_leaf': 1, 'min_samples_split': 2, 'n_estimators': 55}. Best is trial 41 with value: 0.9592627631176829.[0m
[32m[I 2021-06-01 14:40:44,704][0m Trial 131 finished with value: 0.9578106844903231 and parameters: {'criterion': 'entropy', 'max_depth': None, 'max_features': 'auto', 'min_samples_leaf': 1, 'min_samples_split': 2, 'n_estimators': 55}. Best is trial 41 with value: 0.9592627631176829.[0m
[32m[I 2021-06-01 14:40:47,217][0m Trial 132 finished with value: 0.9578498011843168 and parameters: {'criterion': 'entropy', 'max_depth': None, 'max_features': 'auto', 'min_samples_leaf': 1, 'min_samples_split': 2, 'n_estimators': 55}. Best is trial 41 with value: 0.9592627631176829.[0m
[32m[I 2021-06-01 14:40:51,289][0m Trial 107 finished with value: 0.957060744226451 and parameters: {'criterion': 'entropy', 'max_depth': 15, 'max_features': 'auto', 'min_samples_leaf': 1, 'min_samples_split': 2, 'n_estimators': 90}. Best is trial 41 with value: 0.9592627631176829.[0m
[32m[I 2021-06-01 14:40:52,866][0m Trial 133 finished with value: 0.9580730804199915 and parameters: {'criterion': 'entropy', 'max_depth': None, 'max_features': 'auto', 'min_samples_leaf': 1, 'min_samples_split': 3, 'n_estimators': 55}. Best is trial 41 with value: 0.9592627631176829.[0m
