[32m[I 2021-06-01 14:36:47,506][0m Trial 18 finished with value: 0.9564503621690736 and parameters: {'criterion': 'gini', 'max_depth': 25, 'max_features': 'log2', 'min_samples_leaf': 9, 'min_samples_split': 5, 'n_estimators': 255}. Best is trial 12 with value: 0.9571920287880433.[0m
/gscratch/davinci/usr/evankomp/miniconda3/envs/cytoxnet/lib/python3.7/site-packages/sklearn/metrics/_classification.py:1248: UndefinedMetricWarning: Precision is ill-defined and being set to 0.0 due to no predicted samples. Use `zero_division` parameter to control this behavior.
  _warn_prf(average, modifier, msg_start, len(result))
[32m[I 2021-06-01 14:36:50,729][0m Trial 8 finished with value: 0.9564500565014793 and parameters: {'criterion': 'entropy', 'max_depth': None, 'max_features': 'sqrt', 'min_samples_leaf': 10, 'min_samples_split': 9, 'n_estimators': 80}. Best is trial 12 with value: 0.9571920287880433.[0m
[32m[I 2021-06-01 14:36:52,685][0m Trial 7 finished with value: 0.9564500329885874 and parameters: {'criterion': 'gini', 'max_depth': 30, 'max_features': 'log2', 'min_samples_leaf': 8, 'min_samples_split': 2, 'n_estimators': 285}. Best is trial 12 with value: 0.9571920287880433.[0m
[32m[I 2021-06-01 14:36:56,121][0m Trial 41 finished with value: 0.9592627631176829 and parameters: {'criterion': 'entropy', 'max_depth': 35, 'max_features': 'auto', 'min_samples_leaf': 1, 'min_samples_split': 2, 'n_estimators': 10}. Best is trial 41 with value: 0.9592627631176829.[0m
[32m[I 2021-06-01 14:36:57,762][0m Trial 36 finished with value: 0.956515820075799 and parameters: {'criterion': 'gini', 'max_depth': 30, 'max_features': 'sqrt', 'min_samples_leaf': 6, 'min_samples_split': 4, 'n_estimators': 85}. Best is trial 41 with value: 0.9592627631176829.[0m
[32m[I 2021-06-01 14:37:02,485][0m Trial 19 finished with value: 0.9564500329885874 and parameters: {'criterion': 'gini', 'max_depth': 10, 'max_features': 'sqrt', 'min_samples_leaf': 9, 'min_samples_split': 3, 'n_estimators': 250}. Best is trial 41 with value: 0.9592627631176829.[0m
[32m[I 2021-06-01 14:37:03,591][0m Trial 42 finished with value: 0.9588770347151779 and parameters: {'criterion': 'entropy', 'max_depth': 35, 'max_features': 'auto', 'min_samples_leaf': 1, 'min_samples_split': 3, 'n_estimators': 10}. Best is trial 41 with value: 0.9592627631176829.[0m
[32m[I 2021-06-01 14:37:13,323][0m Trial 43 finished with value: 0.9578321594662752 and parameters: {'criterion': 'entropy', 'max_depth': 15, 'max_features': 'auto', 'min_samples_leaf': 1, 'min_samples_split': 2, 'n_estimators': 20}. Best is trial 41 with value: 0.9592627631176829.[0m
[32m[I 2021-06-01 14:37:13,852][0m Trial 30 finished with value: 0.956935641792494 and parameters: {'criterion': 'gini', 'max_depth': 15, 'max_features': 'log2', 'min_samples_leaf': 1, 'min_samples_split': 3, 'n_estimators': 265}. Best is trial 41 with value: 0.9592627631176829.[0m
[32m[I 2021-06-01 14:37:15,955][0m Trial 14 finished with value: 0.9564503621690736 and parameters: {'criterion': 'entropy', 'max_depth': 40, 'max_features': 'sqrt', 'min_samples_leaf': 9, 'min_samples_split': 6, 'n_estimators': 120}. Best is trial 41 with value: 0.9592627631176829.[0m
[32m[I 2021-06-01 14:37:20,653][0m Trial 44 finished with value: 0.9582364745835379 and parameters: {'criterion': 'entropy', 'max_depth': 35, 'max_features': 'auto', 'min_samples_leaf': 1, 'min_samples_split': 3, 'n_estimators': 25}. Best is trial 41 with value: 0.9592627631176829.[0m
[32m[I 2021-06-01 14:37:25,613][0m Trial 10 finished with value: 0.9564501505530467 and parameters: {'criterion': 'entropy', 'max_depth': 15, 'max_features': 'log2', 'min_samples_leaf': 9, 'min_samples_split': 2, 'n_estimators': 235}. Best is trial 41 with value: 0.9592627631176829.[0m
[32m[I 2021-06-01 14:37:28,012][0m Trial 33 finished with value: 0.9564500565014791 and parameters: {'criterion': 'gini', 'max_depth': None, 'max_features': 'auto', 'min_samples_leaf': 7, 'min_samples_split': 2, 'n_estimators': 185}. Best is trial 41 with value: 0.9592627631176829.[0m
[32m[I 2021-06-01 14:37:31,010][0m Trial 11 finished with value: 0.9566346628173505 and parameters: {'criterion': 'gini', 'max_depth': 30, 'max_features': 'auto', 'min_samples_leaf': 2, 'min_samples_split': 10, 'n_estimators': 210}. Best is trial 41 with value: 0.9592627631176829.[0m
[32m[I 2021-06-01 14:37:31,096][0m Trial 5 finished with value: 0.9567725689314377 and parameters: {'criterion': 'gini', 'max_depth': 20, 'max_features': 'sqrt', 'min_samples_leaf': 3, 'min_samples_split': 6, 'n_estimators': 235}. Best is trial 41 with value: 0.9592627631176829.[0m
[32m[I 2021-06-01 14:37:35,557][0m Trial 48 finished with value: 0.9578563685629453 and parameters: {'criterion': 'entropy', 'max_depth': 35, 'max_features': 'auto', 'min_samples_leaf': 1, 'min_samples_split': 3, 'n_estimators': 35}. Best is trial 41 with value: 0.9592627631176829.[0m
[32m[I 2021-06-01 14:37:39,596][0m Trial 24 finished with value: 0.9569628528432771 and parameters: {'criterion': 'entropy', 'max_depth': 40, 'max_features': 'sqrt', 'min_samples_leaf': 3, 'min_samples_split': 6, 'n_estimators': 125}. Best is trial 41 with value: 0.9592627631176829.[0m
[32m[I 2021-06-01 14:37:43,019][0m Trial 21 finished with value: 0.9565755858138807 and parameters: {'criterion': 'entropy', 'max_depth': 25, 'max_features': 'log2', 'min_samples_leaf': 2, 'min_samples_split': 10, 'n_estimators': 235}. Best is trial 41 with value: 0.9592627631176829.[0m
[32m[I 2021-06-01 14:37:46,389][0m Trial 16 finished with value: 0.9565729623599994 and parameters: {'criterion': 'entropy', 'max_depth': 45, 'max_features': 'auto', 'min_samples_leaf': 1, 'min_samples_split': 10, 'n_estimators': 130}. Best is trial 41 with value: 0.9592627631176829.[0m
[32m[I 2021-06-01 14:37:47,869][0m Trial 13 finished with value: 0.9564503386561818 and parameters: {'criterion': 'gini', 'max_depth': 40, 'max_features': 'sqrt', 'min_samples_leaf': 9, 'min_samples_split': 2, 'n_estimators': 300}. Best is trial 41 with value: 0.9592627631176829.[0m
[32m[I 2021-06-01 14:37:48,055][0m Trial 34 finished with value: 0.9564501975788305 and parameters: {'criterion': 'gini', 'max_depth': 30, 'max_features': 'sqrt', 'min_samples_leaf': 5, 'min_samples_split': 10, 'n_estimators': 210}. Best is trial 41 with value: 0.9592627631176829.[0m
[32m[I 2021-06-01 14:37:48,972][0m Trial 49 finished with value: 0.9575563602184991 and parameters: {'criterion': 'entropy', 'max_depth': 15, 'max_features': 'auto', 'min_samples_leaf': 1, 'min_samples_split': 2, 'n_estimators': 40}. Best is trial 41 with value: 0.9592627631176829.[0m
[32m[I 2021-06-01 14:37:49,593][0m Trial 50 finished with value: 0.9573690418162162 and parameters: {'criterion': 'entropy', 'max_depth': 15, 'max_features': 'auto', 'min_samples_leaf': 1, 'min_samples_split': 2, 'n_estimators': 40}. Best is trial 41 with value: 0.9592627631176829.[0m
[32m[I 2021-06-01 14:37:53,370][0m Trial 9 finished with value: 0.9564440115103986 and parameters: {'criterion': 'gini', 'max_depth': 25, 'max_features': 'sqrt', 'min_samples_leaf': 5, 'min_samples_split': 8, 'n_estimators': 295}. Best is trial 41 with value: 0.9592627631176829.[0m
[32m[I 2021-06-01 14:37:59,166][0m Trial 63 finished with value: 0.9569349790679436 and parameters: {'criterion': 'entropy', 'max_depth': 35, 'max_features': 'auto', 'min_samples_leaf': 4, 'min_samples_split': 3, 'n_estimators': 10}. Best is trial 41 with value: 0.9592627631176829.[0m
[32m[I 2021-06-01 14:38:00,869][0m Trial 51 finished with value: 0.9574585432478118 and parameters: {'criterion': 'entropy', 'max_depth': 35, 'max_features': 'auto', 'min_samples_leaf': 1, 'min_samples_split': 2, 'n_estimators': 45}. Best is trial 41 with value: 0.9592627631176829.[0m
[32m[I 2021-06-01 14:38:01,338][0m Trial 52 finished with value: 0.9583456951663811 and parameters: {'criterion': 'entropy', 'max_depth': 35, 'max_features': 'auto', 'min_samples_leaf': 1, 'min_samples_split': 3, 'n_estimators': 45}. Best is trial 41 with value: 0.9592627631176829.[0m
[32m[I 2021-06-01 14:38:06,113][0m Trial 28 finished with value: 0.9566442199775533 and parameters: {'criterion': 'gini', 'max_depth': 40, 'max_features': 'auto', 'min_samples_leaf': 3, 'min_samples_split': 10, 'n_estimators': 290}. Best is trial 41 with value: 0.9592627631176829.[0m
[32m[I 2021-06-01 14:38:07,010][0m Trial 53 finished with value: 0.9574115361196813 and parameters: {'criterion': 'entropy', 'max_depth': 35, 'max_features': 'auto', 'min_samples_leaf': 1, 'min_samples_split': 3, 'n_estimators': 40}. Best is trial 41 with value: 0.9592627631176829.[0m
[32m[I 2021-06-01 14:38:07,444][0m Trial 65 finished with value: 0.9568770398806432 and parameters: {'criterion': 'entropy', 'max_depth': 35, 'max_features': 'auto', 'min_samples_leaf': 4, 'min_samples_split': 3, 'n_estimators': 10}. Best is trial 41 with value: 0.9592627631176829.[0m
[32m[I 2021-06-01 14:38:09,017][0m Trial 54 finished with value: 0.9577112032455617 and parameters: {'criterion': 'entropy', 'max_depth': 35, 'max_features': 'auto', 'min_samples_leaf': 1, 'min_samples_split': 3, 'n_estimators': 45}. Best is trial 41 with value: 0.9592627631176829.[0m
[32m[I 2021-06-01 14:38:15,473][0m Trial 2 finished with value: 0.9564501270401549 and parameters: {'criterion': 'entropy', 'max_depth': 10, 'max_features': 'sqrt', 'min_samples_leaf': 6, 'min_samples_split': 6, 'n_estimators': 220}. Best is trial 41 with value: 0.9592627631176829.[0m
[32m[I 2021-06-01 14:38:16,354][0m Trial 56 finished with value: 0.9579923620783081 and parameters: {'criterion': 'entropy', 'max_depth': 35, 'max_features': 'auto', 'min_samples_leaf': 1, 'min_samples_split': 3, 'n_estimators': 45}. Best is trial 41 with value: 0.9592627631176829.[0m
[32m[I 2021-06-01 14:38:16,657][0m Trial 57 finished with value: 0.9578668318863122 and parameters: {'criterion': 'entropy', 'max_depth': 35, 'max_features': 'auto', 'min_samples_leaf': 1, 'min_samples_split': 3, 'n_estimators': 45}. Best is trial 41 with value: 0.9592627631176829.[0m
[32m[I 2021-06-01 14:38:17,756][0m Trial 55 finished with value: 0.9579518491956922 and parameters: {'criterion': 'entropy', 'max_depth': 35, 'max_features': 'auto', 'min_samples_leaf': 1, 'min_samples_split': 3, 'n_estimators': 45}. Best is trial 41 with value: 0.9592627631176829.[0m
[32m[I 2021-06-01 14:38:22,515][0m Trial 62 finished with value: 0.9566974280554165 and parameters: {'criterion': 'entropy', 'max_depth': 35, 'max_features': 'auto', 'min_samples_leaf': 4, 'min_samples_split': 3, 'n_estimators': 40}. Best is trial 41 with value: 0.9592627631176829.[0m
[32m[I 2021-06-01 14:38:23,256][0m Trial 64 finished with value: 0.956629617908276 and parameters: {'criterion': 'entropy', 'max_depth': 35, 'max_features': 'auto', 'min_samples_leaf': 4, 'min_samples_split': 3, 'n_estimators': 35}. Best is trial 41 with value: 0.9592627631176829.[0m
[32m[I 2021-06-01 14:38:23,963][0m Trial 60 finished with value: 0.9575380151115572 and parameters: {'criterion': 'entropy', 'max_depth': 35, 'max_features': 'auto', 'min_samples_leaf': 1, 'min_samples_split': 3, 'n_estimators': 40}. Best is trial 41 with value: 0.9592627631176829.[0m
[32m[I 2021-06-01 14:38:24,806][0m Trial 59 finished with value: 0.9565701424401729 and parameters: {'criterion': 'entropy', 'max_depth': 35, 'max_features': 'auto', 'min_samples_leaf': 4, 'min_samples_split': 3, 'n_estimators': 40}. Best is trial 41 with value: 0.9592627631176829.[0m
[32m[I 2021-06-01 14:38:25,326][0m Trial 58 finished with value: 0.957730512803497 and parameters: {'criterion': 'entropy', 'max_depth': 35, 'max_features': 'auto', 'min_samples_leaf': 1, 'min_samples_split': 3, 'n_estimators': 45}. Best is trial 41 with value: 0.9592627631176829.[0m
[32m[I 2021-06-01 14:38:26,241][0m Trial 32 finished with value: 0.9567689369167484 and parameters: {'criterion': 'entropy', 'max_depth': 30, 'max_features': 'log2', 'min_samples_leaf': 3, 'min_samples_split': 6, 'n_estimators': 295}. Best is trial 41 with value: 0.9592627631176829.[0m
[32m[I 2021-06-01 14:38:29,426][0m Trial 38 finished with value: 0.9574338089501536 and parameters: {'criterion': 'gini', 'max_depth': 45, 'max_features': 'auto', 'min_samples_leaf': 1, 'min_samples_split': 3, 'n_estimators': 225}. Best is trial 41 with value: 0.9592627631176829.[0m
[32m[I 2021-06-01 14:38:32,838][0m Trial 66 finished with value: 0.9570099377156117 and parameters: {'criterion': 'entropy', 'max_depth': 35, 'max_features': 'auto', 'min_samples_leaf': 3, 'min_samples_split': 3, 'n_estimators': 40}. Best is trial 41 with value: 0.9592627631176829.[0m
[32m[I 2021-06-01 14:38:34,947][0m Trial 17 finished with value: 0.9564504327077493 and parameters: {'criterion': 'entropy', 'max_depth': 10, 'max_features': 'auto', 'min_samples_leaf': 7, 'min_samples_split': 5, 'n_estimators': 250}. Best is trial 41 with value: 0.9592627631176829.[0m
[32m[I 2021-06-01 14:38:34,949][0m Trial 61 finished with value: 0.9577567616354408 and parameters: {'criterion': 'entropy', 'max_depth': 35, 'max_features': 'auto', 'min_samples_leaf': 1, 'min_samples_split': 3, 'n_estimators': 50}. Best is trial 41 with value: 0.9592627631176829.[0m
[32m[I 2021-06-01 14:38:47,043][0m Trial 29 finished with value: 0.9564503386561818 and parameters: {'criterion': 'entropy', 'max_depth': 20, 'max_features': 'auto', 'min_samples_leaf': 6, 'min_samples_split': 5, 'n_estimators': 225}. Best is trial 41 with value: 0.9592627631176829.[0m
[32m[I 2021-06-01 14:38:58,381][0m Trial 67 finished with value: 0.9570527150806036 and parameters: {'criterion': 'entropy', 'max_depth': 35, 'max_features': 'auto', 'min_samples_leaf': 2, 'min_samples_split': 3, 'n_estimators': 70}. Best is trial 41 with value: 0.9592627631176829.[0m
[32m[I 2021-06-01 14:39:03,524][0m Trial 39 finished with value: 0.9574366986107243 and parameters: {'criterion': 'gini', 'max_depth': 45, 'max_features': 'auto', 'min_samples_leaf': 1, 'min_samples_split': 3, 'n_estimators': 280}. Best is trial 41 with value: 0.9592627631176829.[0m
[32m[I 2021-06-01 14:39:03,845][0m Trial 68 finished with value: 0.957387504988524 and parameters: {'criterion': 'entropy', 'max_depth': 35, 'max_features': 'auto', 'min_samples_leaf': 2, 'min_samples_split': 3, 'n_estimators': 70}. Best is trial 41 with value: 0.9592627631176829.[0m
[32m[I 2021-06-01 14:39:04,283][0m Trial 69 finished with value: 0.9569343554854693 and parameters: {'criterion': 'entropy', 'max_depth': 35, 'max_features': 'auto', 'min_samples_leaf': 2, 'min_samples_split': 3, 'n_estimators': 70}. Best is trial 41 with value: 0.9592627631176829.[0m
[32m[I 2021-06-01 14:39:10,436][0m Trial 72 finished with value: 0.9573781679919555 and parameters: {'criterion': 'entropy', 'max_depth': 35, 'max_features': 'auto', 'min_samples_leaf': 2, 'min_samples_split': 4, 'n_estimators': 70}. Best is trial 41 with value: 0.9592627631176829.[0m
[32m[I 2021-06-01 14:39:12,605][0m Trial 71 finished with value: 0.9572435267178623 and parameters: {'criterion': 'entropy', 'max_depth': 35, 'max_features': 'auto', 'min_samples_leaf': 2, 'min_samples_split': 3, 'n_estimators': 75}. Best is trial 41 with value: 0.9592627631176829.[0m
[32m[I 2021-06-01 14:39:12,768][0m Trial 70 finished with value: 0.9571210865450481 and parameters: {'criterion': 'entropy', 'max_depth': 35, 'max_features': 'auto', 'min_samples_leaf': 2, 'min_samples_split': 3, 'n_estimators': 75}. Best is trial 41 with value: 0.9592627631176829.[0m
[32m[I 2021-06-01 14:39:14,634][0m Trial 74 finished with value: 0.9573194913386374 and parameters: {'criterion': 'entropy', 'max_depth': 35, 'max_features': 'auto', 'min_samples_leaf': 2, 'min_samples_split': 4, 'n_estimators': 70}. Best is trial 41 with value: 0.9592627631176829.[0m
[32m[I 2021-06-01 14:39:15,684][0m Trial 76 finished with value: 0.9573845736325641 and parameters: {'criterion': 'entropy', 'max_depth': 35, 'max_features': 'auto', 'min_samples_leaf': 2, 'min_samples_split': 4, 'n_estimators': 65}. Best is trial 41 with value: 0.9592627631176829.[0m
[32m[I 2021-06-01 14:39:19,407][0m Trial 73 finished with value: 0.9568747847734466 and parameters: {'criterion': 'entropy', 'max_depth': 35, 'max_features': 'auto', 'min_samples_leaf': 2, 'min_samples_split': 4, 'n_estimators': 70}. Best is trial 41 with value: 0.9592627631176829.[0m
[32m[I 2021-06-01 14:39:21,136][0m Trial 40 finished with value: 0.9573659757982751 and parameters: {'criterion': 'gini', 'max_depth': 35, 'max_features': 'auto', 'min_samples_leaf': 1, 'min_samples_split': 3, 'n_estimators': 300}. Best is trial 41 with value: 0.9592627631176829.[0m
[32m[I 2021-06-01 14:39:21,867][0m Trial 83 finished with value: 0.9564499859628036 and parameters: {'criterion': 'entropy', 'max_depth': 10, 'max_features': 'auto', 'min_samples_leaf': 2, 'min_samples_split': 4, 'n_estimators': 70}. Best is trial 41 with value: 0.9592627631176829.[0m
[32m[I 2021-06-01 14:39:23,260][0m Trial 84 finished with value: 0.956450291630398 and parameters: {'criterion': 'entropy', 'max_depth': 10, 'max_features': 'auto', 'min_samples_leaf': 2, 'min_samples_split': 4, 'n_estimators': 70}. Best is trial 41 with value: 0.9592627631176829.[0m
[32m[I 2021-06-01 14:39:23,896][0m Trial 82 finished with value: 0.957389331320796 and parameters: {'criterion': 'entropy', 'max_depth': 35, 'max_features': 'auto', 'min_samples_leaf': 2, 'min_samples_split': 4, 'n_estimators': 65}. Best is trial 41 with value: 0.9592627631176829.[0m
/gscratch/davinci/usr/evankomp/miniconda3/envs/cytoxnet/lib/python3.7/site-packages/sklearn/metrics/_classification.py:1248: UndefinedMetricWarning: Precision is ill-defined and being set to 0.0 due to no predicted samples. Use `zero_division` parameter to control this behavior.
  _warn_prf(average, modifier, msg_start, len(result))
[32m[I 2021-06-01 14:39:24,656][0m Trial 77 finished with value: 0.9573907379672344 and parameters: {'criterion': 'entropy', 'max_depth': 35, 'max_features': 'auto', 'min_samples_leaf': 2, 'min_samples_split': 4, 'n_estimators': 70}. Best is trial 41 with value: 0.9592627631176829.[0m
[32m[I 2021-06-01 14:39:25,413][0m Trial 79 finished with value: 0.9573852307836519 and parameters: {'criterion': 'entropy', 'max_depth': 45, 'max_features': 'auto', 'min_samples_leaf': 2, 'min_samples_split': 4, 'n_estimators': 70}. Best is trial 41 with value: 0.9592627631176829.[0m
[32m[I 2021-06-01 14:39:26,046][0m Trial 80 finished with value: 0.957334813816239 and parameters: {'criterion': 'entropy', 'max_depth': 45, 'max_features': 'auto', 'min_samples_leaf': 2, 'min_samples_split': 4, 'n_estimators': 70}. Best is trial 41 with value: 0.9592627631176829.[0m
/gscratch/davinci/usr/evankomp/miniconda3/envs/cytoxnet/lib/python3.7/site-packages/sklearn/metrics/_classification.py:1248: UndefinedMetricWarning: Precision is ill-defined and being set to 0.0 due to no predicted samples. Use `zero_division` parameter to control this behavior.
  _warn_prf(average, modifier, msg_start, len(result))
[32m[I 2021-06-01 14:39:27,607][0m Trial 81 finished with value: 0.9571190130614932 and parameters: {'criterion': 'entropy', 'max_depth': 45, 'max_features': 'auto', 'min_samples_leaf': 2, 'min_samples_split': 4, 'n_estimators': 70}. Best is trial 41 with value: 0.9592627631176829.[0m
[32m[I 2021-06-01 14:39:27,954][0m Trial 75 finished with value: 0.9571761368907239 and parameters: {'criterion': 'entropy', 'max_depth': 35, 'max_features': 'auto', 'min_samples_leaf': 2, 'min_samples_split': 4, 'n_estimators': 80}. Best is trial 41 with value: 0.9592627631176829.[0m
/gscratch/davinci/usr/evankomp/miniconda3/envs/cytoxnet/lib/python3.7/site-packages/sklearn/metrics/_classification.py:1248: UndefinedMetricWarning: Precision is ill-defined and being set to 0.0 due to no predicted samples. Use `zero_division` parameter to control this behavior.
  _warn_prf(average, modifier, msg_start, len(result))
/gscratch/davinci/usr/evankomp/miniconda3/envs/cytoxnet/lib/python3.7/site-packages/sklearn/metrics/_classification.py:1248: UndefinedMetricWarning: Precision is ill-defined and being set to 0.0 due to no predicted samples. Use `zero_division` parameter to control this behavior.
  _warn_prf(average, modifier, msg_start, len(result))
/gscratch/davinci/usr/evankomp/miniconda3/envs/cytoxnet/lib/python3.7/site-packages/sklearn/metrics/_classification.py:1248: UndefinedMetricWarning: Precision is ill-defined and being set to 0.0 due to no predicted samples. Use `zero_division` parameter to control this behavior.
  _warn_prf(average, modifier, msg_start, len(result))
/gscratch/davinci/usr/evankomp/miniconda3/envs/cytoxnet/lib/python3.7/site-packages/sklearn/metrics/_classification.py:1248: UndefinedMetricWarning: Precision is ill-defined and being set to 0.0 due to no predicted samples. Use `zero_division` parameter to control this behavior.
  _warn_prf(average, modifier, msg_start, len(result))
/gscratch/davinci/usr/evankomp/miniconda3/envs/cytoxnet/lib/python3.7/site-packages/sklearn/metrics/_classification.py:1248: UndefinedMetricWarning: Precision is ill-defined and being set to 0.0 due to no predicted samples. Use `zero_division` parameter to control this behavior.
  _warn_prf(average, modifier, msg_start, len(result))
[32m[I 2021-06-01 14:39:30,976][0m Trial 94 finished with value: 0.9564501505530467 and parameters: {'criterion': 'entropy', 'max_depth': 10, 'max_features': 'auto', 'min_samples_leaf': 2, 'min_samples_split': 4, 'n_estimators': 25}. Best is trial 41 with value: 0.9592627631176829.[0m
